,original_label,score_x,twitter_id,Comments_x,MR1_label,score_y,Comments_y,MR2_label,score,Comments
0,n,0.9889905452728271,1467810369,"@switchfoot http://twitpic.com/2y1zl - Awww, that's a bummer.  You shoulda got David Carr of Third Day to do it. ;D",LABEL_2,0.9862891435623169,"@switchfoot http://twitpic.com/2y1zl - Awww, that's a bummer.  You shoulda got David Carr of Third Day to do it. ;DTHE PPL @ T-MOBiLE ARE ALWAYS SO NiCE &amp;&amp; THEY ALWAYS FiX ANY PROBLEMS PROMPTLY. ",LABEL_2,0.962791383266449,"@switchfoot http://twitpic.com/2y1zl - Awww, that's a bummer.  You shoulda got David Carr of Third Day to do it. ;DTHE PPL @ T-MOBiLE ARE ALWAYS SO NiCE &amp;&amp; THEY ALWAYS FiX ANY PROBLEMS PROMPTLY. @angry_barista I baked you a cake but I ated it "
1,n,0.9957559704780579,1467810672,is upset that he can't update his Facebook by texting it... and might cry as a result  School today also. Blah!,LABEL_0,0.9254960417747498,is upset that he can't update his Facebook by texting it... and might cry as a result  School today also. Blah!This trolley has up packed in like sardines! Padre game and they REMOVE a car?! Good call MTS ,LABEL_0,0.9842464923858643,"is upset that he can't update his Facebook by texting it... and might cry as a result  School today also. Blah!This trolley has up packed in like sardines! Padre game and they REMOVE a car?! Good call MTS @KishoreK this is strange, illegal torrents avlbl everywhere, legal DVD not in stock  What do I do now???"
2,m,0.7132061719894409,1467810917,@Kenichan I dived many times for the ball. Managed to save 50%  The rest go out of bounds,LABEL_2,0.9866460561752319,"@Kenichan I dived many times for the ball. Managed to save 50%  The rest go out of bounds@kelly_straycat  btw, THANK YOU SOOOO MUCH FOR  THAT PLUG FROM BEFORE!!!! i was wondering where the twitter requests was coming from ",LABEL_2,0.8767909407615662,"@Kenichan I dived many times for the ball. Managed to save 50%  The rest go out of bounds@kelly_straycat  btw, THANK YOU SOOOO MUCH FOR  THAT PLUG FROM BEFORE!!!! i was wondering where the twitter requests was coming from would rather the first party send bad messages than the 3rd party send mixed ones  Sophmore year all over again?"
3,n,0.9504910111427307,1467811184,my whole body feels itchy and like its on fire ,LABEL_2,0.859717607498169,"my whole body feels itchy and like its on fire @tabithakristen no problem, it was super late  I could still use your opinion though...will DM",LABEL_0,0.9889219999313354,"my whole body feels itchy and like its on fire @tabithakristen no problem, it was super late  I could still use your opinion though...will DMis upset that he can't update his Facebook by texting it... and might cry as a result  School today also. Blah!"
4,n,0.9929641485214233,1467811193,"@nationwideclass no, it's not behaving at all. i'm mad. why am i here? because I can't see you all over there. ",LABEL_1,0.601313591003418,"@nationwideclass no, it's not behaving at all. i'm mad. why am i here? because I can't see you all over there. @senoritajulia Well then we should go sometime! Yay for lunch specials! ",LABEL_0,0.9919414520263672,"@nationwideclass no, it's not behaving at all. i'm mad. why am i here? because I can't see you all over there. @senoritajulia Well then we should go sometime! Yay for lunch specials! is upset that he can't update his Facebook by texting it... and might cry as a result  School today also. Blah!"
5,n,0.9532774686813354,1467811372,@Kwesidei not the whole crew ,LABEL_2,0.9635375738143921,@Kwesidei not the whole crew or several books with partial of Bella and Edwards perspective could be REALLY cool  Just like with Jacob in Breaking Dawn  ,LABEL_0,0.8268604278564453,@Kwesidei not the whole crew or several books with partial of Bella and Edwards perspective could be REALLY cool  Just like with Jacob in Breaking Dawn  I don't understand why things get taken away. I didn't have enough time with him its unfair. I want him back!! He was like my baby 
6,m,0.9681565761566162,1467811592,Need a hug ,LABEL_2,0.9940462112426758,"Need a hug had pure banter today, which was very much needed  Good Times! x Muwah Laura aha",LABEL_1,0.8478773832321167,"Need a hug had pure banter today, which was very much needed  Good Times! x Muwah Laura aha@Sofii_Noel thatï¿½s bad "
7,p,0.874988853931427,1467811594,"@LOLTrish hey  long time no see! Yes.. Rains a bit ,only a bit  LOL , I'm fine thanks , how's you ?",LABEL_2,0.9805331230163574,"@LOLTrish hey  long time no see! Yes.. Rains a bit ,only a bit  LOL , I'm fine thanks , how's you ?@jessgonacha Congrats! Well deserved ",LABEL_1,0.9797489047050476,"@LOLTrish hey  long time no see! Yes.. Rains a bit ,only a bit  LOL , I'm fine thanks , how's you ?@jessgonacha Congrats! Well deserved @imaginarypeach now your leaving me  .... -gets sad-"
8,m,0.9971201419830322,1467811795,@Tatiana_K nope they didn't have it ,LABEL_2,0.9951605200767517,"@Tatiana_K nope they didn't have it &quot;butterly in the sky - i can go twice as high, take a look it's in a book.. reading rainbow&quot;!!!! reading rainbowwww! loved that show  ",LABEL_1,0.9446266889572144,"@Tatiana_K nope they didn't have it &quot;butterly in the sky - i can go twice as high, take a look it's in a book.. reading rainbow&quot;!!!! reading rainbowwww! loved that show  I'm sooo sad!!! they killed off Kutner on House  whyyyyyyyy"
9,m,0.9967780709266663,1467812025,@twittera que me muera ? ,LABEL_2,0.9950560331344604,@twittera que me muera ? sonny with a chance is so funny! ,LABEL_1,0.9677300453186035,@twittera que me muera ? sonny with a chance is so funny! Poor Joshy is sick???   those damn tejanos!
10,m,0.9973969459533691,1467812416,spring break in plain city... it's snowing ,LABEL_2,0.9938679337501526,spring break in plain city... it's snowing @k_love032705 I believe it's a way to send a shout out to your friendly followers. Seems to get you more followers somehow. And it's fun ,LABEL_2,0.9647456407546997,spring break in plain city... it's snowing @k_love032705 I believe it's a way to send a shout out to your friendly followers. Seems to get you more followers somehow. And it's fun trust is hard 
11,n,0.9944794178009033,1467812579,I just re-pierced my ears ,LABEL_2,0.9787980914115906,I just re-pierced my ears @okizarisu Just found out. Congratulations! ,LABEL_0,0.9922182559967041,"I just re-pierced my ears @okizarisu Just found out. Congratulations! Sad, sad, sad. I don't know why but I hate this feeling  I wanna sleep and I still can't!"
12,n,0.9424850344657898,1467812723,@caregiving I couldn't bear to watch it.  And I thought the UA loss was embarrassing . . . . .,LABEL_1,0.9084716439247131,@caregiving I couldn't bear to watch it.  And I thought the UA loss was embarrassing . . . . .Enjoying the rain ,LABEL_1,0.8829195499420166,@caregiving I couldn't bear to watch it.  And I thought the UA loss was embarrassing . . . . .Enjoying the rain ..and of course... I have access to my Halo 3 Mythic Map Pack re-download.. but bad news.. not the Legendary Map Pack... ugh.. 600MS... 
13,m,0.994549572467804,1467812771,"@octolinz16 It it counts, idk why I did either. you never talk to me anymore ",LABEL_2,0.9852544069290161,"@octolinz16 It it counts, idk why I did either. you never talk to me anymore Where did u move to?  I thought u were already in sd. ?? Hmmm. Random u found me. Glad to hear yer doing well.",LABEL_2,0.9747915863990784,"@octolinz16 It it counts, idk why I did either. you never talk to me anymore Where did u move to?  I thought u were already in sd. ?? Hmmm. Random u found me. Glad to hear yer doing well.@miss_om Aww  I know I felt like that yesterday at work "
14,n,0.9939974546432495,1467812784,"@smarrison i would've been the first, but i didn't have a gun.    not really though, zac snyder's just a doucheclown.",LABEL_1,0.808809220790863,"@smarrison i would've been the first, but i didn't have a gun.    not really though, zac snyder's just a doucheclown.@michaelawarren you'll get there too one day MW   You're too talented not to! Keeping my eye on you Kyle and Bwhite. Keep the dreams alive",LABEL_0,0.9792140126228333,"@smarrison i would've been the first, but i didn't have a gun.    not really though, zac snyder's just a doucheclown.@michaelawarren you'll get there too one day MW   You're too talented not to! Keeping my eye on you Kyle and Bwhite. Keep the dreams aliveSHOOTING OUTSIDE MY HOUSE :O NOT KIDDING! So SCARED "
15,n,0.9943158030509949,1467812799,@iamjazzyfizzle I wish I got to watch it with you!! I miss you and @iamlilnicki  how was the premiere?!,LABEL_0,0.8808053731918335,@iamjazzyfizzle I wish I got to watch it with you!! I miss you and @iamlilnicki  how was the premiere?!@merrickmgt Thanks for the FollowFirday Taryn ,LABEL_0,0.9921050071716309,@iamjazzyfizzle I wish I got to watch it with you!! I miss you and @iamlilnicki  how was the premiere?!@merrickmgt Thanks for the FollowFirday Taryn What tragedy and disaster in the news this week 
16,n,0.9897828698158264,1467812964,Hollis' death scene will hurt me severely to watch on film  wry is directors cut not out now?,LABEL_0,0.9123084545135498,Hollis' death scene will hurt me severely to watch on film  wry is directors cut not out now?watching the MTV Movie Awards for the 5th time  ~ true friends are simple the best but hard to get (:,LABEL_0,0.8380705714225769,Hollis' death scene will hurt me severely to watch on film  wry is directors cut not out now?watching the MTV Movie Awards for the 5th time  ~ true friends are simple the best but hard to get (:i think my arms are sore from tennis 
17,m,0.9965710639953613,1467813137,about to file taxes ,LABEL_1,0.8327103853225708,about to file taxes New video card is DOA. ,LABEL_0,0.992004930973053,about to file taxes New video card is DOA. @bostongarden I miss bentley 
18,p,0.9943333864212036,1467813579,@LettyA ahh ive always wanted to see rent  love the soundtrack!!,LABEL_2,0.9964295029640198,@LettyA ahh ive always wanted to see rent  love the soundtrack!!@create4fun Morning people? They see in the cold light of day what you saw as a stroke on genius in the middle of the night. ,LABEL_1,0.9157547354698181,@LettyA ahh ive always wanted to see rent  love the soundtrack!!@create4fun Morning people? They see in the cold light of day what you saw as a stroke on genius in the middle of the night. @dannyvegasbaby danny im upset that i wasnt here to watch the live chat  i was in a car. for 3 hours on a trip im soooo upset!!
19,n,0.9799189567565918,1467813782,@FakerPattyPattz Oh dear. Were you drinking out of the forgotten table drinks? ,LABEL_1,0.9298052191734314,@FakerPattyPattz Oh dear. Were you drinking out of the forgotten table drinks? is alone downstairs...working ,LABEL_0,0.9881108999252319,@FakerPattyPattz Oh dear. Were you drinking out of the forgotten table drinks? is alone downstairs...working throat is closing up and i had some string cheese. not a good idea 
20,n,0.5921735167503357,1467813985,@alydesigns i was out most of the day so didn't get much done ,LABEL_1,0.9926292896270752,@alydesigns i was out most of the day so didn't get much done @mandayyy ,LABEL_1,0.9663739204406738,"@alydesigns i was out most of the day so didn't get much done @mandayyy why to we, the only school in the world, be in this week.My school is silly  anyway... look on the bright side. When i'm off, u will be in"
21,n,0.9713995456695557,1467813992,"one of my friend called me, and asked to meet with her at Mid Valley today...but i've no time *sigh* ",LABEL_2,0.996263325214386,"one of my friend called me, and asked to meet with her at Mid Valley today...but i've no time *sigh* @Timberwolf123 Hey, a girl can look ya know. I just appreciate, that's all. ",LABEL_2,0.6112467050552368,"one of my friend called me, and asked to meet with her at Mid Valley today...but i've no time *sigh* @Timberwolf123 Hey, a girl can look ya know. I just appreciate, that's all. @nicolerichie OH MY YES!! i miss "
22,n,0.9933165311813354,1467814119,@angry_barista I baked you a cake but I ated it ,LABEL_2,0.992090106010437,@angry_barista I baked you a cake but I ated it @lisarinna: Ahh a lot of people still love you and I def want to read your book ,LABEL_2,0.9934508800506592,@angry_barista I baked you a cake but I ated it @lisarinna: Ahh a lot of people still love you and I def want to read your book Strider is a sick little puppy  http://apps.facebook.com/dogbook/profile/view/5248435
23,n,0.9620634913444519,1467814180,this week is not going as i had hoped ,LABEL_2,0.9833110570907593,this week is not going as i had hoped @YoungQ Morning Rob!!  Blessings and have a great day too!! ,LABEL_2,0.9839509725570679,this week is not going as i had hoped @YoungQ Morning Rob!!  Blessings and have a great day too!! ugh. cant sleep. its 1:30am. 
24,n,0.5844972133636475,1467814192,blagh class at 8 tomorrow ,LABEL_2,0.7753086686134338,blagh class at 8 tomorrow @TexasMisty @IamSucceeding @kellydmahaffey @KCLAnderson @fitnewbie @PatBarone Thanks for the FF mention ,LABEL_0,0.9177144765853882,blagh class at 8 tomorrow @TexasMisty @IamSucceeding @kellydmahaffey @KCLAnderson @fitnewbie @PatBarone Thanks for the FF mention @bananaface IM SORRY I GOT YOU SICK.  lol. going to bed too. NIGHT!
25,n,0.9947563409805298,1467814438,I hate when I have to call and wake people up ,LABEL_2,0.6606639623641968,I hate when I have to call and wake people up THE PPL @ T-MOBiLE ARE ALWAYS SO NiCE &amp;&amp; THEY ALWAYS FiX ANY PROBLEMS PROMPTLY. ,LABEL_1,0.8444204926490784,"I hate when I have to call and wake people up THE PPL @ T-MOBiLE ARE ALWAYS SO NiCE &amp;&amp; THEY ALWAYS FiX ANY PROBLEMS PROMPTLY. @haynes_dave my life is a hangover, dave.  "
26,n,0.8833982944488525,1467814783,Just going to cry myself to sleep after watching Marley and Me.  ,LABEL_1,0.9838871359825134,Just going to cry myself to sleep after watching Marley and Me.  @buckhollywood smile ,LABEL_1,0.6896052956581116,"Just going to cry myself to sleep after watching Marley and Me.  @buckhollywood smile My tummy hurts.  I wonder if the hypnosis has anything to do with it? If so, it's working, I get it, STOP SMOKING!!!"
27,n,0.9955400824546814,1467814883,im sad now  Miss.Lilly,LABEL_0,0.8889061212539673,im sad now  Miss.Lilly@create4fun Morning people? They see in the cold light of day what you saw as a stroke on genius in the middle of the night. ,LABEL_0,0.9943968057632446,im sad now  Miss.Lilly@create4fun Morning people? They see in the cold light of day what you saw as a stroke on genius in the middle of the night.  Body Of Missing Northern Calif. Girl Found: Police have found the remains of a missing Northern California girl .. http://tr.im/imji
28,m,0.9918349981307983,1467815199,ooooh.... LOL  that leslie.... and ok I won't do it again so leslie won't  get mad again ,LABEL_2,0.502351701259613,ooooh.... LOL  that leslie.... and ok I won't do it again so leslie won't  get mad again watching the MTV Movie Awards for the 5th time  ~ true friends are simple the best but hard to get (:,LABEL_1,0.5455594062805176,"ooooh.... LOL  that leslie.... and ok I won't do it again so leslie won't  get mad again watching the MTV Movie Awards for the 5th time  ~ true friends are simple the best but hard to get (:@trishzw megafast trip, you have time during day tom/weds? Or, you going out tonight? Want to see you bad. Tried to warn you, tech fail "
29,n,0.9885011911392212,1467815753,Meh... Almost Lover is the exception... this track gets me depressed every time. ,LABEL_1,0.8800997138023376,Meh... Almost Lover is the exception... this track gets me depressed every time. Found a good song on #spotify : http://bit.ly/p8xts ,LABEL_0,0.9095215201377869,Meh... Almost Lover is the exception... this track gets me depressed every time. Found a good song on #spotify : http://bit.ly/p8xts @tea oh! i'm so sorry  i didn't think about that before retweeting.
30,n,0.9953874945640564,1467815923,some1 hacked my account on aim  now i have to make a new one,LABEL_2,0.9095401763916016,"some1 hacked my account on aim  now i have to make a new one@LizzyBee16 I knowww!! I barely watch anything on Nick and CN these days. I still watch Disney tho, well yeah, it's my favorite channel ",LABEL_0,0.9560000896453857,"some1 hacked my account on aim  now i have to make a new one@LizzyBee16 I knowww!! I barely watch anything on Nick and CN these days. I still watch Disney tho, well yeah, it's my favorite channel hey, I actually won one of my bracket pools! Too bad it wasn't the one for money "
31,m,0.96197909116745,1467815924,@alielayus I want to go to promote GEAR AND GROOVE but unfornately no ride there  I may b going to the one in Anaheim in May though,LABEL_2,0.7530999183654785,@alielayus I want to go to promote GEAR AND GROOVE but unfornately no ride there  I may b going to the one in Anaheim in May thoughGood morning twitterbugs!  it's friday! ,LABEL_0,0.9891876578330994,@alielayus I want to go to promote GEAR AND GROOVE but unfornately no ride there  I may b going to the one in Anaheim in May thoughGood morning twitterbugs!  it's friday! couldn't get shit done today ~ i'm so screwed 
32,m,0.9869803786277771,1467815988,thought sleeping in was an option tomorrow but realizing that it now is not. evaluations in the morning and work in the afternoon! ,LABEL_1,0.8188905715942383,thought sleeping in was an option tomorrow but realizing that it now is not. evaluations in the morning and work in the afternoon! I think I'm still full from dinner last night! Thanks Mel ,LABEL_0,0.9900110363960266,thought sleeping in was an option tomorrow but realizing that it now is not. evaluations in the morning and work in the afternoon! I think I'm still full from dinner last night! Thanks Mel stupid movies we watched... mirrors ugggggh... stooopeeed!!! rip off! 
33,m,0.9802371859550476,1467816149,@julieebaby awe i love you too!!!! 1 am here  i miss you,LABEL_1,0.9492701292037964,"@julieebaby awe i love you too!!!! 1 am here  i miss you@kyliecross An OB/GYN once told me that pregnancy lasts one month too long. After four, I can say I definitely agree! Yes, in Boston. ",LABEL_1,0.9580914378166199,"@julieebaby awe i love you too!!!! 1 am here  i miss you@kyliecross An OB/GYN once told me that pregnancy lasts one month too long. After four, I can say I definitely agree! Yes, in Boston. I don't understand... I really don't "
34,n,0.9898674488067627,1467816665,@HumpNinja I cry my asian eyes to sleep at night ,LABEL_2,0.9880151152610779,@HumpNinja I cry my asian eyes to sleep at night This is the best leather sofa in the world!  It's in the office though which means I'm still here working ,LABEL_2,0.979403555393219,@HumpNinja I cry my asian eyes to sleep at night This is the best leather sofa in the world!  It's in the office though which means I'm still here working @Hollywoodheat I should have paid more attention when we covered photoshop in my webpage design class in undergrad 
35,n,0.9951979517936707,1467816749,ok I'm sick and spent an hour sitting in the shower cause I was too sick to stand and held back the puke like a champ. BED now ,LABEL_1,0.9670587778091431,"ok I'm sick and spent an hour sitting in the shower cause I was too sick to stand and held back the puke like a champ. BED now @makeherfamous hmm  , do u really enjoy being with him ? if the problems are too constants u should think things more , find someone ulike",LABEL_1,0.9486185312271118,"ok I'm sick and spent an hour sitting in the shower cause I was too sick to stand and held back the puke like a champ. BED now @makeherfamous hmm  , do u really enjoy being with him ? if the problems are too constants u should think things more , find someone ulikesooo sick of the snow  ughh"
36,n,0.9665759205818176,1467817225,@cocomix04 ill tell ya the story later  not a good day and ill be workin for like three more hours...,LABEL_1,0.9361348748207092,"@cocomix04 ill tell ya the story later  not a good day and ill be workin for like three more hours...@debbieskerten how lovely! Reminds me,  am getting a Norfolk fix soon. Heading to North Norfolk before week in Centre Parcs - can't wait. ",LABEL_1,0.9615118503570557,"@cocomix04 ill tell ya the story later  not a good day and ill be workin for like three more hours...@debbieskerten how lovely! Reminds me,  am getting a Norfolk fix soon. Heading to North Norfolk before week in Centre Parcs - can't wait. @nationwideclass no, it's not behaving at all. i'm mad. why am i here? because I can't see you all over there. "
37,n,0.9948712587356567,1467817374,@MissXu sorry! bed time came here (GMT+1)   http://is.gd/fNge,LABEL_0,0.9061304926872253,@MissXu sorry! bed time came here (GMT+1)   http://is.gd/fNgeCan't wait for sunday  gonna be so good,LABEL_0,0.9885070323944092,@MissXu sorry! bed time came here (GMT+1)   http://is.gd/fNgeCan't wait for sunday  gonna be so goodWatching Who Framed Roger Rabbit. Makes me miss Toon Town. 
38,n,0.9936322569847107,1467817502,@fleurylis I don't either. Its depressing. I don't think I even want to know about the kids in suitcases. ,LABEL_1,0.9794182777404785,@fleurylis I don't either. Its depressing. I don't think I even want to know about the kids in suitcases. @SamLuminate Thanks for the reply  It's great that you are sharing God's love on here. You never know who God will touch through you ,LABEL_1,0.9668667912483215,@fleurylis I don't either. Its depressing. I don't think I even want to know about the kids in suitcases. @SamLuminate Thanks for the reply  It's great that you are sharing God's love on here. You never know who God will touch through you @Sara_Kate Im afraid too  ( ur reply about uni from ages ago
39,n,0.9955633878707886,1467818007,Bed. Class 8-12. Work 12-3. Gym 3-5 or 6. Then class 6-10. Another day that's gonna fly by. I miss my girlfriend ,LABEL_0,0.9909842014312744,Bed. Class 8-12. Work 12-3. Gym 3-5 or 6. Then class 6-10. Another day that's gonna fly by. I miss my girlfriend @downwithdesign Very tempting indeed ,LABEL_0,0.9921860694885254,Bed. Class 8-12. Work 12-3. Gym 3-5 or 6. Then class 6-10. Another day that's gonna fly by. I miss my girlfriend @downwithdesign Very tempting indeed laying in bed with no voice.. 
40,n,0.9870173335075378,1467818020,really don't feel like getting up today... but got to study to for tomorrows practical exam... ,LABEL_2,0.9720046520233154,really don't feel like getting up today... but got to study to for tomorrows practical exam... @blarkness word... thanks girl!  safe travels... have fun ,LABEL_1,0.8143996596336365,really don't feel like getting up today... but got to study to for tomorrows practical exam... @blarkness word... thanks girl!  safe travels... have fun Still 3 more days until my Internet gets uncapped 
41,n,0.9596704244613647,1467818481,He's the reason for the teardrops on my guitar the only one who has enough of me to break my heart ,LABEL_2,0.9634711742401123,He's the reason for the teardrops on my guitar the only one who has enough of me to break my heart Where did u move to?  I thought u were already in sd. ?? Hmmm. Random u found me. Glad to hear yer doing well.,LABEL_1,0.9755563139915466,"He's the reason for the teardrops on my guitar the only one who has enough of me to break my heart Where did u move to?  I thought u were already in sd. ?? Hmmm. Random u found me. Glad to hear yer doing well.Put vacation photos online a few yrs ago. PC crashed, and now I forget the name of the site. "
42,n,0.9955920577049255,1467818603,"Sad, sad, sad. I don't know why but I hate this feeling  I wanna sleep and I still can't!",LABEL_0,0.9701575636863708,"Sad, sad, sad. I don't know why but I hate this feeling  I wanna sleep and I still can't!This trolley has up packed in like sardines! Padre game and they REMOVE a car?! Good call MTS ",LABEL_0,0.9808339476585388,"Sad, sad, sad. I don't know why but I hate this feeling  I wanna sleep and I still can't!This trolley has up packed in like sardines! Padre game and they REMOVE a car?! Good call MTS is strangely sad about LiLo and SamRo breaking up. "
43,n,0.9836902022361755,1467818900,@JonathanRKnight Awww I soo wish I was there to see you finally comfortable! Im sad that I missed it ,LABEL_1,0.9354782104492188,@JonathanRKnight Awww I soo wish I was there to see you finally comfortable! Im sad that I missed it This trolley has up packed in like sardines! Padre game and they REMOVE a car?! Good call MTS ,LABEL_1,0.7504270672798157,"@JonathanRKnight Awww I soo wish I was there to see you finally comfortable! Im sad that I missed it This trolley has up packed in like sardines! Padre game and they REMOVE a car?! Good call MTS @Marge_Inovera I tried tweetdeck once and I hated it with a passion. Or it hated me, I'm not sure... "
44,n,0.9952345490455627,1467819022,Falling asleep. Just heard about that Tracy girl's body being found. How sad  My heart breaks for that family.,LABEL_0,0.9732233285903931,Falling asleep. Just heard about that Tracy girl's body being found. How sad  My heart breaks for that family.Thank you for the #followfriday and back at ya!  @HJSWritergal @Fanny57 @frelle @crazyjohnkerecz @UrbanitySCMG @thekatalist,LABEL_0,0.9857134819030762,Falling asleep. Just heard about that Tracy girl's body being found. How sad  My heart breaks for that family.Thank you for the #followfriday and back at ya!  @HJSWritergal @Fanny57 @frelle @crazyjohnkerecz @UrbanitySCMG @thekatalistthroat is closing up and i had some string cheese. not a good idea 
