,original_label,score_x,twitter_id,Comments_x,MR1_label,score_y,Comments_y,MR2_label,score,Comments
274,m,0.9748713374137878,1467880431,@DiannePulham OOOOOOOO who with? (im not neither but thats because i need to study  ),LABEL_2,0.9958609938621521,@DiannePulham OOOOOOOO who with? (im not neither but thats because i need to study  )i'm goin down to d members-only private lounge now to surf d webbie. heard bfast wud be awesome tmr. i &lt;3 their croissants n lil kebabs ,LABEL_2,0.987951934337616,@DiannePulham OOOOOOOO who with? (im not neither but thats because i need to study  )i'm goin down to d members-only private lounge now to surf d webbie. heard bfast wud be awesome tmr. i &lt;3 their croissants n lil kebabs i left my IDs at the location and now i can not go out to bars  FUCKKKKKKKKKKKKK
275,p,0.9921016097068787,1467880442,"Haven't tweeted nearly all day  Posted my website tonight, hopefully that goes well  Night time!",LABEL_2,0.9962059259414673,"Haven't tweeted nearly all day  Posted my website tonight, hopefully that goes well  Night time!Celebrating National Donut day with sweet creative thinking    Ahhhh, sugar high helps marketing ideas! Is there a national chocolate day?",LABEL_1,0.9245784878730774,"Haven't tweeted nearly all day  Posted my website tonight, hopefully that goes well  Night time!Celebrating National Donut day with sweet creative thinking    Ahhhh, sugar high helps marketing ideas! Is there a national chocolate day?stupid movies we watched... mirrors ugggggh... stooopeeed!!! rip off! "
276,n,0.9951545000076294,1467880463,@bostongarden I miss bentley ,LABEL_0,0.9854932427406311,@bostongarden I miss bentley @jpwrye41 no it isnt..embrace it ,LABEL_0,0.9897034764289856,@bostongarden I miss bentley @jpwrye41 no it isnt..embrace it would rather the first party send bad messages than the 3rd party send mixed ones  Sophmore year all over again?
277,n,0.9550568461418152,1467880692,seriously needs to finish these job applications ,LABEL_2,0.9923291802406311,seriously needs to finish these job applications @scarletkristi Love you too! ,LABEL_1,0.9193536043167114,seriously needs to finish these job applications @scarletkristi Love you too! @Sofii_Noel thatï¿½s bad 
278,n,0.992529571056366,1467881131,"My son Vincas is sick, so I stay at home  Just three tense days at work, and I am back on holiday with kids",LABEL_1,0.9855302572250366,"My son Vincas is sick, so I stay at home  Just three tense days at work, and I am back on holiday with kidsThe Wonder Girls are touring with the Jonas Brothers... Hm.. That's... cool. I guess ",LABEL_1,0.9580727219581604,"My son Vincas is sick, so I stay at home  Just three tense days at work, and I am back on holiday with kidsThe Wonder Girls are touring with the Jonas Brothers... Hm.. That's... cool. I guess day 2. a lot harder than day 1. let's see how day 3 goes tomorrow. "
279,m,0.9823678731918335,1467881373,Whinging. My client&amp;boss don't understand English well. Rewrote some text unreadable. It's written by v. good writer&amp;reviewed correctly. ,LABEL_2,0.9513023495674133,Whinging. My client&amp;boss don't understand English well. Rewrote some text unreadable. It's written by v. good writer&amp;reviewed correctly. @AbuzzB Thanks ,LABEL_0,0.9678589701652527,Whinging. My client&amp;boss don't understand English well. Rewrote some text unreadable. It's written by v. good writer&amp;reviewed correctly. @AbuzzB Thanks I just saw that they found that Tracy girl in a piece of luggage... How fucking terrible 
280,n,0.9900321960449219,1467881376,@huntermoore I don't want him to ever punch me.  ,LABEL_2,0.9929031729698181,@huntermoore I don't want him to ever punch me.  @YoungQ good morning!!  I'm in VA Beach - gonna be a fab day!!  Bring it!!  ,LABEL_2,0.9905228018760681,@huntermoore I don't want him to ever punch me.  @YoungQ good morning!!  I'm in VA Beach - gonna be a fab day!!  Bring it!!  im looking forward to the new season of the hills  i've always hated kristin 
281,n,0.9834167957305908,1467881457,sooo sick of the snow  ughh,LABEL_2,0.8617558479309082,sooo sick of the snow  ughhNow it's sunny. Better. Just had a great meeting with people about missions stuff in Stanly County! ,LABEL_1,0.9644816517829895,"sooo sick of the snow  ughhNow it's sunny. Better. Just had a great meeting with people about missions stuff in Stanly County! I'm sweating my forthcoming trip to E3.  If I can't find someone to crash with while I'm out there, I may be screwed.  "
282,n,0.6147704720497131,1467881474,@ITS_NEMESIS ------- ,LABEL_2,0.9958078861236572,"@ITS_NEMESIS ------- #Video [David Bowie - Starman] Thank you very much @Pepperfire, happy weekend!  â™« http://blip.fm/~7oowe",LABEL_2,0.9941295385360718,"@ITS_NEMESIS ------- #Video [David Bowie - Starman] Thank you very much @Pepperfire, happy weekend!  â™« http://blip.fm/~7oowemy whole body feels itchy and like its on fire "
283,n,0.9614424109458923,1467881686,@LoveMeagan it doesn't work your fan is upset ,LABEL_0,0.748245358467102,@LoveMeagan it doesn't work your fan is upset My man crush Jake Peavy let me down  #gayforpeavy,LABEL_0,0.9914878606796265,"@LoveMeagan it doesn't work your fan is upset My man crush Jake Peavy let me down  #gayforpeavySad, sad, sad. I don't know why but I hate this feeling  I wanna sleep and I still can't!"
284,n,0.9433447122573853,1467881809,I would like to apologize for the repeated Video Games Live related tweets. I am going to have a stern discussion with Koodo soon. Stern. ,LABEL_1,0.8626590371131897,I would like to apologize for the repeated Video Games Live related tweets. I am going to have a stern discussion with Koodo soon. Stern. This trolley has up packed in like sardines! Padre game and they REMOVE a car?! Good call MTS ,LABEL_1,0.8868091702461243,I would like to apologize for the repeated Video Games Live related tweets. I am going to have a stern discussion with Koodo soon. Stern. This trolley has up packed in like sardines! Padre game and they REMOVE a car?! Good call MTS has lost his ring. It's no-where to be seen 
285,m,0.705848753452301,1467881897,@zaydia but i cant figure out how to get there / back / pay for a hotel etc ,LABEL_2,0.554543137550354,@zaydia but i cant figure out how to get there / back / pay for a hotel etc @sarah2175 thanks for the follow Friday ,LABEL_0,0.985469400882721,"@zaydia but i cant figure out how to get there / back / pay for a hotel etc @sarah2175 thanks for the follow Friday My bathtub drain is fired: it haz 1 job 2 do, &amp; it iz FAIL. I got all Drano on its ass, &amp; iz STILL NOT DRAINING. I wanna shower, dangit!! "
286,m,0.40926268696784973,1467881920,"FML: So much for seniority, bc of technological ineptness, I now have to &quot;register&quot; for classes AGAIN ",LABEL_2,0.9728481769561768,"FML: So much for seniority, bc of technological ineptness, I now have to &quot;register&quot; for classes AGAIN @catmagellan @fjfonseca you're most welcome!  Iâ€™ve been away, but now Iâ€™m back in business!",LABEL_0,0.6889350414276123,"FML: So much for seniority, bc of technological ineptness, I now have to &quot;register&quot; for classes AGAIN @catmagellan @fjfonseca you're most welcome!  Iâ€™ve been away, but now Iâ€™m back in business!My bathtub drain is fired: it haz 1 job 2 do, &amp; it iz FAIL. I got all Drano on its ass, &amp; iz STILL NOT DRAINING. I wanna shower, dangit!! "
287,n,0.9878224730491638,1467882140,feels like she slept the day away.    Not looking forward to any more bouts with my gallbladder.  At least I have pills now for the pain.,LABEL_1,0.8223492503166199,feels like she slept the day away.    Not looking forward to any more bouts with my gallbladder.  At least I have pills now for the pain.Back from the library. Logan was a very good boy and caused his mommy no stress at all ,LABEL_1,0.9125606417655945,feels like she slept the day away.    Not looking forward to any more bouts with my gallbladder.  At least I have pills now for the pain.Back from the library. Logan was a very good boy and caused his mommy no stress at all @lolitariot oh no  hope you're not getting sick too!
288,m,0.9662277698516846,1467882491,@ThaStevieG but what I really want is my old bass back ,LABEL_2,0.8001847267150879,@ThaStevieG but what I really want is my old bass back twiggassssssss I been out of range all day  I'm back now and hopefully for good.,LABEL_2,0.6972780823707581,@ThaStevieG but what I really want is my old bass back twiggassssssss I been out of range all day  I'm back now and hopefully for good.Kind of longs for the bus that shows up at the end of Ghost World right now. Ugh. 
289,n,0.9865425825119019,1467882592,Mad tired today... Callin it in early tonight  nighty night twittas,LABEL_1,0.901476263999939,Mad tired today... Callin it in early tonight  nighty night twittas@james_a_michael Wow. I have been there. -lol- I have family in OH not far from there. Have a safe trip!! ,LABEL_1,0.8347586989402771,Mad tired today... Callin it in early tonight  nighty night twittas@james_a_michael Wow. I have been there. -lol- I have family in OH not far from there. Have a safe trip!! @cococourtney i was just listening to the sweets for the first time in forever! i miss them so much  can we go to chi town for visits plz?
290,p,0.9833136200904846,1467882902,"@LevenRambin: Take it easy, and be good to you. ",LABEL_2,0.9879485368728638,"@LevenRambin: Take it easy, and be good to you. @ashleyac My donkey is sensitive about such comments. Nevertheless, he'd (and me'd) be glad to see your mug asap. Charger is still awol. ",LABEL_2,0.9742019176483154,"@LevenRambin: Take it easy, and be good to you. @ashleyac My donkey is sensitive about such comments. Nevertheless, he'd (and me'd) be glad to see your mug asap. Charger is still awol. I'm sweating my forthcoming trip to E3.  If I can't find someone to crash with while I'm out there, I may be screwed.  "
291,n,0.9949951171875,1467888679,I'm afraid I had bad code. ,LABEL_1,0.9667628407478333,I'm afraid I had bad code. @psyfe Sounds like a great solution strategy ,LABEL_1,0.8336413502693176,I'm afraid I had bad code. @psyfe Sounds like a great solution strategy @frago I hate you. I didn't need to see that. I need to call my therapist now. 
292,m,0.9669450521469116,1467888732,Think I'm going to bed. Goodniight. I hate this ,LABEL_1,0.8774198889732361,Think I'm going to bed. Goodniight. I hate this @hummiemd I KNOW! I was really surprised since everyone recommends them on youtube.  I have to call them tomorrow and figure it all out.,LABEL_1,0.9195282459259033,Think I'm going to bed. Goodniight. I hate this @hummiemd I KNOW! I was really surprised since everyone recommends them on youtube.  I have to call them tomorrow and figure it all out.ChiefDelphi is down 
293,p,0.9967734217643738,1467888953,"@riancurtis  i'm here, friend, and i love you.",LABEL_2,0.9970495700836182,"@riancurtis  i'm here, friend, and i love you.Thanks for bursting my bubble ",LABEL_1,0.888435423374176,"@riancurtis  i'm here, friend, and i love you.Thanks for bursting my bubble Hollis' death scene will hurt me severely to watch on film  wry is directors cut not out now?"
294,m,0.9920331835746765,1467889231,@kariajay  All this time you didn't notice I was gone...just needed DB2 is it??,LABEL_1,0.7786263227462769,@kariajay  All this time you didn't notice I was gone...just needed DB2 is it??@chelserlynn haha its so cooooold in the d! and no  but you should still go to the show. they do some incredible stuff,LABEL_1,0.9806771278381348,@kariajay  All this time you didn't notice I was gone...just needed DB2 is it??@chelserlynn haha its so cooooold in the d! and no  but you should still go to the show. they do some incredible stuff@oanhLove I hate when that happens... 
295,m,0.9892345666885376,1467889251,@aaronrva is in the bathroom and i have to pee!    ,LABEL_2,0.9465391039848328,"@aaronrva is in the bathroom and i have to pee!    Just got done taking Bauer baby for some errands, Peaks Island tonight with Ashlie poo  and thennnn hopefully getting drunk ",LABEL_1,0.9889089465141296,"@aaronrva is in the bathroom and i have to pee!    Just got done taking Bauer baby for some errands, Peaks Island tonight with Ashlie poo  and thennnn hopefully getting drunk HELP! I need a new boyfriend... I'm stuck in a rut "
296,m,0.9031680822372437,1467889334,@ashleyskyy but I wanted a margarita too! ,LABEL_2,0.9935991764068604,@ashleyskyy but I wanted a margarita too! here's mii follow friday  follow @LiLg3m1n1 @FLyGUy2800 @ashleyjanae @bjayjones @Yung_Cordi &amp;&amp;&amp; @gegebaybee &lt;- the best out of all yee!,LABEL_2,0.9894120097160339,@ashleyskyy but I wanted a margarita too! here's mii follow friday  follow @LiLg3m1n1 @FLyGUy2800 @ashleyjanae @bjayjones @Yung_Cordi &amp;&amp;&amp; @gegebaybee &lt;- the best out of all yee!@kpreyes Remember my bum leg? Strikes back this time its serious 
297,n,0.9693918228149414,1467889574,@KourtneyKardash yup night workouts r the worst but unfortunetly my work schedule only allows me to go at night  its tough!,LABEL_0,0.9712845683097839,@KourtneyKardash yup night workouts r the worst but unfortunetly my work schedule only allows me to go at night  its tough!@babygirlparis http://twitpic.com/6nih9 - I was so there! I wish I could have officially met you in person and got a pic!! ,LABEL_0,0.9936726093292236,@KourtneyKardash yup night workouts r the worst but unfortunetly my work schedule only allows me to go at night  its tough!@babygirlparis http://twitpic.com/6nih9 - I was so there! I wish I could have officially met you in person and got a pic!! @TheLeagueSF Not Fun &amp; Furious? The new mantra for the Bay 2 Breakers? It was getting 2 rambunctious;the city overreacted &amp; clamped down 
298,m,0.9333930015563965,1467889791,Just called Hillsong again - they said they couldn't tell me where I was on the waiting list - I don't know if it's looking so good ,LABEL_2,0.9912840127944946,Just called Hillsong again - they said they couldn't tell me where I was on the waiting list - I don't know if it's looking so good THE PPL @ T-MOBiLE ARE ALWAYS SO NiCE &amp;&amp; THEY ALWAYS FiX ANY PROBLEMS PROMPTLY. ,LABEL_1,0.920095682144165,Just called Hillsong again - they said they couldn't tell me where I was on the waiting list - I don't know if it's looking so good THE PPL @ T-MOBiLE ARE ALWAYS SO NiCE &amp;&amp; THEY ALWAYS FiX ANY PROBLEMS PROMPTLY. sleep soon... i just hate saying bye and see you tomorrow for the night. 
299,m,0.9932698607444763,1467889988,"has 0g of milky bar left, and around 200ml of coke ",LABEL_2,0.9948384165763855,"has 0g of milky bar left, and around 200ml of coke @geuis Cool, thanks,  glad I could help ",LABEL_2,0.9948680400848389,"has 0g of milky bar left, and around 200ml of coke @geuis Cool, thanks,  glad I could help seriously needs to finish these job applications "
300,m,0.9882860779762268,1467890079,@jokerrrr It stillllll hasn't arrived ,LABEL_1,0.9912809729576111,@jokerrrr It stillllll hasn't arrived goodmornin ,LABEL_0,0.6730203628540039,"@jokerrrr It stillllll hasn't arrived goodmornin Our sweet little man just fell asleep while waiting up for daddy and big brother to get home!  Poor baby, he missed them so much today!"
301,n,0.9916642904281616,1467890212,"Mraow, I feel like dancing, but first art school wants to rape me some more. ",LABEL_2,0.9940242171287537,"Mraow, I feel like dancing, but first art school wants to rape me some more. @DonnieWahlberg Always following but don't think I'll make it from Scotland!!  Keep having a blast-I'm loving this ride xx",LABEL_1,0.8741363883018494,"Mraow, I feel like dancing, but first art school wants to rape me some more. @DonnieWahlberg Always following but don't think I'll make it from Scotland!!  Keep having a blast-I'm loving this ride xx@grum WAH I can't see clip, must be el-stupido work filters. Can't wait 'till I get a 'puter. Something else 2 blame ex 4. He broke mine "
302,m,0.9908588528633118,1467890222,@karenucol ah! I bet it does I've been like craving to play softball or basketball !!! But I have noo time ,LABEL_1,0.9946080446243286,"@karenucol ah! I bet it does I've been like craving to play softball or basketball !!! But I have noo time @onezumi Whatever you have to offer. Listened to Within Temptation on loop for a couple months, so maybe something new? ",LABEL_1,0.9819135069847107,"@karenucol ah! I bet it does I've been like craving to play softball or basketball !!! But I have noo time @onezumi Whatever you have to offer. Listened to Within Temptation on loop for a couple months, so maybe something new? @ohsbrat30...I'm sorry. I'm feeling kinda yucky myself. 5am is going to come too quick "
303,n,0.9896355271339417,1467890723,Is terrified she accidentally deleted a reference in her management assignment and hopes she doesnt get in trouble when she gets back ,LABEL_2,0.6589446663856506,"Is terrified she accidentally deleted a reference in her management assignment and hopes she doesnt get in trouble when she gets back gonna put the twins down for their nap. Then head to BG when they wake up to shop for some pageant dresses! Fun, Fun! ",LABEL_1,0.9437665939331055,"Is terrified she accidentally deleted a reference in her management assignment and hopes she doesnt get in trouble when she gets back gonna put the twins down for their nap. Then head to BG when they wake up to shop for some pageant dresses! Fun, Fun! im lonely  keep me company! 22 female, california"
304,n,0.9930453896522522,1467891826,amazon s3 plugin not worked in my website . it need PHP 5 . but my hosting provider has only PHP 4.4  . very sad.,LABEL_0,0.9900868535041809,amazon s3 plugin not worked in my website . it need PHP 5 . but my hosting provider has only PHP 4.4  . very sad.sonny with a chance is so funny! ,LABEL_0,0.9902675747871399,amazon s3 plugin not worked in my website . it need PHP 5 . but my hosting provider has only PHP 4.4  . very sad.sonny with a chance is so funny! omg. my mouth is in so much pain  i just wanna sleep untill its time to take my braces off.
305,m,0.9791631102561951,1467891880,"Argh! I was suuuper sleepy an hour ago, now I'm wide awake.  Hope I don't stay up all night. :-/",LABEL_1,0.9672365188598633,"Argh! I was suuuper sleepy an hour ago, now I'm wide awake.  Hope I don't stay up all night. :-/@terrikeller seeing as you were playing it at 1030 last night. hmmmmm....wonder why you dont get enough sleep either.  love you mom.",LABEL_1,0.9777423739433289,"Argh! I was suuuper sleepy an hour ago, now I'm wide awake.  Hope I don't stay up all night. :-/@terrikeller seeing as you were playing it at 1030 last night. hmmmmm....wonder why you dont get enough sleep either.  love you mom.@jdarter Oh! Haha... dude I dont really look at em unless someone says HEY I ADDED YOU. Sorry  I'm so terrible at that. I need a pop up!"
306,p,0.9676548838615417,1467892075,"@austinhill I wish I was!  Sold out   If you have some time let me know, I would love to hear more about what you are up to!",LABEL_2,0.996235191822052,"@austinhill I wish I was!  Sold out   If you have some time let me know, I would love to hear more about what you are up to!Yay, scored great Pink seats.  Section 124 row 2! http://www.wachoviacenter.com/seating/images/pink.jpg",LABEL_1,0.8494331240653992,"@austinhill I wish I was!  Sold out   If you have some time let me know, I would love to hear more about what you are up to!Yay, scored great Pink seats.  Section 124 row 2! http://www.wachoviacenter.com/seating/images/pink.jpgmight be getting a sore throat again "
307,n,0.9935867190361023,1467892419,Just watched tropic thunder. Dreading tomorrow ,LABEL_0,0.855331301689148,Just watched tropic thunder. Dreading tomorrow @mmmmmrob because we want commercially aware innovators? ,LABEL_0,0.9931635856628418,Just watched tropic thunder. Dreading tomorrow @mmmmmrob because we want commercially aware innovators? too worried and tired to post tonight 
308,n,0.9956446886062622,1467892515,@qweendassah no...he's still miss'n... ,LABEL_0,0.9933311343193054,@qweendassah no...he's still miss'n... @krisstraub I'd agree with that statement regarding lenka - but I have to defend fiest as a fellow Calgarian. ,LABEL_0,0.9947041869163513,@qweendassah no...he's still miss'n... @krisstraub I'd agree with that statement regarding lenka - but I have to defend fiest as a fellow Calgarian. @mediocre_mum that's not a problem...that's a disaster 
309,n,0.9828475713729858,1467892667,ChiefDelphi is down ,LABEL_1,0.9584810733795166,ChiefDelphi is down @james_a_michael Wow. I have been there. -lol- I have family in OH not far from there. Have a safe trip!! ,LABEL_0,0.9393925070762634,ChiefDelphi is down @james_a_michael Wow. I have been there. -lol- I have family in OH not far from there. Have a safe trip!! Getting eyebrows waxed. More pain 
310,n,0.95909583568573,1467892720,"http://twitpic.com/2y2wr - according to my bro, our new puppy had a poo fight and was covered in poop  (picture stolen from him)",LABEL_1,0.9957239627838135,"http://twitpic.com/2y2wr - according to my bro, our new puppy had a poo fight and was covered in poop  (picture stolen from him)@xTwilighter Going out for dinner - will phone ya when I get bk about 2moro!  Have got everything sorted!",LABEL_0,0.990136981010437,"http://twitpic.com/2y2wr - according to my bro, our new puppy had a poo fight and was covered in poop  (picture stolen from him)@xTwilighter Going out for dinner - will phone ya when I get bk about 2moro!  Have got everything sorted!@nicolerichie OH MY YES!! i miss "
311,m,0.9883480668067932,1467892760,playing game at home! my new boss didn't call me yet... ,LABEL_2,0.9915522933006287,playing game at home! my new boss didn't call me yet... A little bit of Bom Chicka Wah Wah + Boom Boom Pow = Dolce ON TOP OF THE WOLRD!!!! HAPPY FRIDAY EVERYONE ,LABEL_2,0.988970160484314,playing game at home! my new boss didn't call me yet... A little bit of Bom Chicka Wah Wah + Boom Boom Pow = Dolce ON TOP OF THE WOLRD!!!! HAPPY FRIDAY EVERYONE I'm afraid I had bad code. 
312,n,0.9911341071128845,1467892889,Su yin Huen tweeted I feel unbearable guilt. I made my staff cry  http://tinyurl.com/cw2l9t,LABEL_1,0.9473484754562378,Su yin Huen tweeted I feel unbearable guilt. I made my staff cry  http://tinyurl.com/cw2l9t@eveningvicar hope that helps my friend.... and puts a smile on that face ,LABEL_0,0.916979193687439,Su yin Huen tweeted I feel unbearable guilt. I made my staff cry  http://tinyurl.com/cw2l9t@eveningvicar hope that helps my friend.... and puts a smile on that face @nicklivingston WTF?!?! this series might just get me a new tv.... only because i might break mine! 
313,n,0.9936355352401733,1467892945,Poor Joshy is sick???   those damn tejanos!,LABEL_1,0.9871357083320618,Poor Joshy is sick???   those damn tejanos!@xgetwellcardsx its okay  and i will be. love you cathyyyyy!,LABEL_1,0.9830385446548462,Poor Joshy is sick???   those damn tejanos!@xgetwellcardsx its okay  and i will be. love you cathyyyyy!laying in bed with no voice.. 
314,n,0.9854053854942322,1467893163,My thoughts are with Sandra Cantu's family at this difficult and sad time ,LABEL_1,0.9264631867408752,"My thoughts are with Sandra Cantu's family at this difficult and sad time Good Morning San Francisco: http://twitpic.com/6od4z (view from my room), ok, it ain't great...but it's SF...so I am happy ",LABEL_1,0.8735355138778687,"My thoughts are with Sandra Cantu's family at this difficult and sad time Good Morning San Francisco: http://twitpic.com/6od4z (view from my room), ok, it ain't great...but it's SF...so I am happy Going to school soon... can't find anything to wear!! gosh it's so hard "
315,m,0.9702873826026917,1467893258,"@FranzGlaus I know, just wanted to let everybody know what was happening  ",LABEL_2,0.8027250170707703,"@FranzGlaus I know, just wanted to let everybody know what was happening  Picked Mich St to win it all from the get go.  Was feeling pretty good about that pick all the way up until......tonight.  A's lost too ",LABEL_1,0.9248918294906616,"@FranzGlaus I know, just wanted to let everybody know what was happening  Picked Mich St to win it all from the get go.  Was feeling pretty good about that pick all the way up until......tonight.  A's lost too My mind and body are severely protesting this &quot;getting up&quot;  thing. Had nightmares to boot "
316,n,0.9948947429656982,1467893275,Michigan who?  I don't know them.                   *sigh*   Shameful!,LABEL_1,0.7876401543617249,"Michigan who?  I don't know them.                   *sigh*   Shameful!@Sugarwilla Hhaha, I wasn't up at 4 am! ??? Must have been a text from yesterday, took its sweet time getting to you. ",LABEL_0,0.6698654890060425,"Michigan who?  I don't know them.                   *sigh*   Shameful!@Sugarwilla Hhaha, I wasn't up at 4 am! ??? Must have been a text from yesterday, took its sweet time getting to you. my God is more than an ideology&amp;a philosophy-He's the one who takes my self-reliant brokenness and pours in His fulness and delight.. "
317,m,0.8747591376304626,1467893504,i have to fill two hours ,LABEL_2,0.9491802453994751,"i have to fill two hours had pure banter today, which was very much needed  Good Times! x Muwah Laura aha",LABEL_1,0.6123635768890381,"i have to fill two hours had pure banter today, which was very much needed  Good Times! x Muwah Laura ahai miss kenny powers "
