,original_label,score_x,twitter_id,Comments_x,MR1_label,score_y,Comments_y,MR2_label,score,Comments
723,p,0.7738534212112427,2044336117,"@pchaney By the way, I learned about you from @ines, a presentation she gave for #smcsf, spoke verrry highly of you.  ",LABEL_2,0.9960601925849915,"@pchaney By the way, I learned about you from @ines, a presentation she gave for #smcsf, spoke verrry highly of you.  It's refreshing listening to Radio 3 whilst at work... at a radio station... ",LABEL_2,0.9925172328948975,"@pchaney By the way, I learned about you from @ines, a presentation she gave for #smcsf, spoke verrry highly of you.  It's refreshing listening to Radio 3 whilst at work... at a radio station... is in the bathroom... wake up lakin. "
724,p,0.9948010444641113,2044336122,Welcome to Day 2 of fast forward though Claudia's story. Unsubscribe if you're getting bored. I swear it's pretty interesting on my end. ,LABEL_2,0.9947041869163513,Welcome to Day 2 of fast forward though Claudia's story. Unsubscribe if you're getting bored. I swear it's pretty interesting on my end. @create4fun Morning people? They see in the cold light of day what you saw as a stroke on genius in the middle of the night. ,LABEL_2,0.9914519786834717,Welcome to Day 2 of fast forward though Claudia's story. Unsubscribe if you're getting bored. I swear it's pretty interesting on my end. @create4fun Morning people? They see in the cold light of day what you saw as a stroke on genius in the middle of the night. ..and of course... I have access to my Halo 3 Mythic Map Pack re-download.. but bad news.. not the Legendary Map Pack... ugh.. 600MS... 
725,m,0.9969502091407776,2044336132,@mj12982 Use the &quot;Block&quot; feature on a user profile to stop people following you ,LABEL_2,0.992057740688324,@mj12982 Use the &quot;Block&quot; feature on a user profile to stop people following you Only i could manage to get my hair caught on a tree going into a mcdonalds  haha i love me!,LABEL_1,0.9707444906234741,@mj12982 Use the &quot;Block&quot; feature on a user profile to stop people following you Only i could manage to get my hair caught on a tree going into a mcdonalds  haha i love me!Wish I had all the XBLM downloads all on the gamertag 'Hitokyri'. This 5 gamertag thing is nonsense... and I'm tired of it 
726,n,0.9016371965408325,2044336238,@nicklivingston WTF?!?! this series might just get me a new tv.... only because i might break mine! ,LABEL_2,0.7941854596138,@nicklivingston WTF?!?! this series might just get me a new tv.... only because i might break mine! @TexasMisty @IamSucceeding @kellydmahaffey @KCLAnderson @fitnewbie @PatBarone Thanks for the FF mention ,LABEL_0,0.9304223656654358,@nicklivingston WTF?!?! this series might just get me a new tv.... only because i might break mine! @TexasMisty @IamSucceeding @kellydmahaffey @KCLAnderson @fitnewbie @PatBarone Thanks for the FF mention im looking forward to the new season of the hills  i've always hated kristin 
727,m,0.4344111979007721,2044336276,"#FF Smart, Witty, &amp; Sassy Ladies (Did I mention Smart?)    @kimdhbutler @jbranigan @williger @beingswell",LABEL_1,0.401093989610672,"#FF Smart, Witty, &amp; Sassy Ladies (Did I mention Smart?)    @kimdhbutler @jbranigan @williger @beingswell@mandayyy   ",LABEL_0,0.3947565257549286,"#FF Smart, Witty, &amp; Sassy Ladies (Did I mention Smart?)    @kimdhbutler @jbranigan @williger @beingswell@mandayyy   blagh class at 8 tomorrow "
728,m,0.9967753291130066,2044336340,DONE with Algebra exam! Off to babysit! ,LABEL_2,0.992439866065979,DONE with Algebra exam! Off to babysit! @billy_norris Enjoy the view! Do you have any more pics to share with us? ,LABEL_1,0.9514394998550415,"DONE with Algebra exam! Off to babysit! @billy_norris Enjoy the view! Do you have any more pics to share with us? My son Vincas is sick, so I stay at home  Just three tense days at work, and I am back on holiday with kids"
729,m,0.6032812595367432,2044336473,"@DonnieWahlberg Oh how I wish I could be there!! BUT I still have hope for an after party in HOUSTON!! Last concert, u gott do it! ",LABEL_2,0.9590892791748047,"@DonnieWahlberg Oh how I wish I could be there!! BUT I still have hope for an after party in HOUSTON!! Last concert, u gott do it! 2 days left then off to Houston for a couple weeks for my internship, got to make this weekend a good one ",LABEL_1,0.9272217750549316,"@DonnieWahlberg Oh how I wish I could be there!! BUT I still have hope for an after party in HOUSTON!! Last concert, u gott do it! 2 days left then off to Houston for a couple weeks for my internship, got to make this weekend a good one running nose + spinning head = not a good combination for a meeting! "
730,p,0.9489089846611023,2044336481,@james_a_michael Wow. I have been there. -lol- I have family in OH not far from there. Have a safe trip!! ,LABEL_2,0.9966785907745361,"@james_a_michael Wow. I have been there. -lol- I have family in OH not far from there. Have a safe trip!! @debbieskerten how lovely! Reminds me,  am getting a Norfolk fix soon. Heading to North Norfolk before week in Centre Parcs - can't wait. ",LABEL_1,0.8820990920066833,"@james_a_michael Wow. I have been there. -lol- I have family in OH not far from there. Have a safe trip!! @debbieskerten how lovely! Reminds me,  am getting a Norfolk fix soon. Heading to North Norfolk before week in Centre Parcs - can't wait. @Anistorm Sorry "
731,p,0.9917928576469421,2044336599,"@leomakkinje hey I'm on vacation, I'm supposed to do things I like  like sitting next to a pc user with my shiny powerbook ;)",LABEL_2,0.9671869874000549,"@leomakkinje hey I'm on vacation, I'm supposed to do things I like  like sitting next to a pc user with my shiny powerbook ;)@jpwrye41 no it isnt..embrace it ",LABEL_1,0.9593677520751953,"@leomakkinje hey I'm on vacation, I'm supposed to do things I like  like sitting next to a pc user with my shiny powerbook ;)@jpwrye41 no it isnt..embrace it coolershakes earlier, now feel even more sick, but fish and chips later "
732,m,0.9969294667243958,2044336609,@loyaltoliberty hey Alan; who came up with the idea for q Lfair tax?&quot; hint--1996. ,LABEL_1,0.93515545129776,@loyaltoliberty hey Alan; who came up with the idea for q Lfair tax?&quot; hint--1996. @sarah2175 thanks for the follow Friday ,LABEL_0,0.9767107367515564,@loyaltoliberty hey Alan; who came up with the idea for q Lfair tax?&quot; hint--1996. @sarah2175 thanks for the follow Friday My mind and body are severely protesting this &quot;getting up&quot;  thing. Had nightmares to boot 
733,m,0.7989083528518677,2044336689,Best friend randomly woke me up today! Partaayyy!!! ,LABEL_2,0.7406398057937622,Best friend randomly woke me up today! Partaayyy!!! 20 minutes left in work ...Carrigans for dinner then home to play the Sims 3 ALL night.....! Cany wait! ,LABEL_1,0.8167237639427185,Best friend randomly woke me up today! Partaayyy!!! 20 minutes left in work ...Carrigans for dinner then home to play the Sims 3 ALL night.....! Cany wait! No phantasy star yesterday  going to work...
734,p,0.9909392595291138,2044336751,"@JessicaKnows Thanks for recommending it, I'm off to check it out! ",LABEL_2,0.9866254329681396,"@JessicaKnows Thanks for recommending it, I'm off to check it out! @FaithfulChosen @powerwriter @mystic23 @spiritunes thank you for the #FollowFriday mentions! ",LABEL_1,0.9719662070274353,"@JessicaKnows Thanks for recommending it, I'm off to check it out! @FaithfulChosen @powerwriter @mystic23 @spiritunes thank you for the #FollowFriday mentions! @brian_armstrong What a pity YouTube is currently blocked in China.  I can't see the vids. "
735,p,0.9953380823135376,2044336782,"@christinekambo Thank you, thank you, thank you! ",LABEL_2,0.9961728453636169,"@christinekambo Thank you, thank you, thank you! Little Joy tonight! I'm pumped ",LABEL_2,0.5602513551712036,"@christinekambo Thank you, thank you, thank you! Little Joy tonight! I'm pumped can't believe it! I'm in disbelief of it all in a way really. How much can I take from people and always get hurt by others!! "
736,m,0.9301749467849731,2044336805,"@pvaras That's why we get along, we both have a very warped sense of humor and self.  ",LABEL_2,0.9963485598564148,"@pvaras That's why we get along, we both have a very warped sense of humor and self.  @geuis Cool, thanks,  glad I could help ",LABEL_2,0.9958708882331848,"@pvaras That's why we get along, we both have a very warped sense of humor and self.  @geuis Cool, thanks,  glad I could help Sadly though, I've never gotten to experience the post coitus cigarette before, and now I never will. "
737,p,0.9923325777053833,2044336859,@serenetan got leh...bright bright ,LABEL_2,0.9938481450080872,"@serenetan got leh...bright bright @DBVII yeah, but i didn't get offered a PS3 for $50, &quot;lolz.&quot;   plus, I've always got my Boxee",LABEL_1,0.9805493950843811,"@serenetan got leh...bright bright @DBVII yeah, but i didn't get offered a PS3 for $50, &quot;lolz.&quot;   plus, I've always got my Boxee@QCF2 I miss chatting to u guys.. i shud get on the chat mre often...i will do once my essays and stuff are over.... chat 2 u guys soon "
738,p,0.9361353516578674,2044336870,@okizarisu Just found out. Congratulations! ,LABEL_2,0.996151864528656,@okizarisu Just found out. Congratulations! THE PPL @ T-MOBiLE ARE ALWAYS SO NiCE &amp;&amp; THEY ALWAYS FiX ANY PROBLEMS PROMPTLY. ,LABEL_2,0.9922692775726318,@okizarisu Just found out. Congratulations! THE PPL @ T-MOBiLE ARE ALWAYS SO NiCE &amp;&amp; THEY ALWAYS FiX ANY PROBLEMS PROMPTLY. just did the evil deed 
739,p,0.9964706897735596,2044336882,@asafrommaui Awesome! Happy Aloha Friday to you! ,LABEL_2,0.9956541061401367,@asafrommaui Awesome! Happy Aloha Friday to you! Going to sleep. Hoping tomorrow is a better day. ,LABEL_1,0.9111232757568359,@asafrommaui Awesome! Happy Aloha Friday to you! Going to sleep. Hoping tomorrow is a better day. @labelsnotlove   my home town. My mammy called all depressd.  Pls explain y a parent let their 8yr old child walk alone? Hello? Its 2009!
740,p,0.9963206052780151,2044336964,@scarletkristi Love you too! ,LABEL_2,0.9959951639175415,@scarletkristi Love you too! @wei_ren yeah...saw u responded to the call. Hope to see you soon ,LABEL_1,0.9658737778663635,@scarletkristi Love you too! @wei_ren yeah...saw u responded to the call. Hope to see you soon is tireddddddd. want to sleep but i have an assignment to finish and an exam tomorrow to study for 
741,m,0.9964473843574524,2044336970,@xoxoJL They aren't robots. They're Batman &amp; Robin! ,LABEL_2,0.943866491317749,@xoxoJL They aren't robots. They're Batman &amp; Robin! Can't wait for sunday  gonna be so good,LABEL_1,0.9756870269775391,"@xoxoJL They aren't robots. They're Batman &amp; Robin! Can't wait for sunday  gonna be so goodgetting sick  time for some hot tea, studying, and then sleeeep"
742,m,0.9977318644523621,2044337017,@ABenton  still waiting for the BW20 AD Network so I can join...,LABEL_1,0.6499300599098206,"@ABenton  still waiting for the BW20 AD Network so I can join...Good Morning San Francisco: http://twitpic.com/6od4z (view from my room), ok, it ain't great...but it's SF...so I am happy ",LABEL_2,0.7577940225601196,"@ABenton  still waiting for the BW20 AD Network so I can join...Good Morning San Francisco: http://twitpic.com/6od4z (view from my room), ok, it ain't great...but it's SF...so I am happy dierks bentley is comin' to columbus, OH!! i wanna go so bad "
743,p,0.9281026721000671,2044337043,Save the Mangos! â€” @StuccoHouse Thank you!!! Is that 1 or 2 large mangos or 102?  http://tinyurl.com/pjpkpa,LABEL_2,0.9964208602905273,Save the Mangos! â€” @StuccoHouse Thank you!!! Is that 1 or 2 large mangos or 102?  http://tinyurl.com/pjpkpa@cakesofamy it was brilliant on so many levels ,LABEL_2,0.9628845453262329,"Save the Mangos! â€” @StuccoHouse Thank you!!! Is that 1 or 2 large mangos or 102?  http://tinyurl.com/pjpkpa@cakesofamy it was brilliant on so many levels why to we, the only school in the world, be in this week.My school is silly  anyway... look on the bright side. When i'm off, u will be in"
744,p,0.9955084323883057,2044337055,@k_love032705 I believe it's a way to send a shout out to your friendly followers. Seems to get you more followers somehow. And it's fun ,LABEL_2,0.9972323775291443,@k_love032705 I believe it's a way to send a shout out to your friendly followers. Seems to get you more followers somehow. And it's fun @ladyjai87 @JammieAdams happy birthday!! Hope u have a blessed one  ~Thank you lil momma its already blessed He woke me up this morning ~,LABEL_2,0.9940337538719177,@k_love032705 I believe it's a way to send a shout out to your friendly followers. Seems to get you more followers somehow. And it's fun @ladyjai87 @JammieAdams happy birthday!! Hope u have a blessed one  ~Thank you lil momma its already blessed He woke me up this morning ~Still 3 more days until my Internet gets uncapped 
745,p,0.9953418970108032,2044337056,@ifpetscouldtype I suspect that walks with you guys are as much fun as tweeting with U  Enjoy!,LABEL_2,0.9932050704956055,@ifpetscouldtype I suspect that walks with you guys are as much fun as tweeting with U  Enjoy!Where did u move to?  I thought u were already in sd. ?? Hmmm. Random u found me. Glad to hear yer doing well.,LABEL_1,0.7878932356834412,@ifpetscouldtype I suspect that walks with you guys are as much fun as tweeting with U  Enjoy!Where did u move to?  I thought u were already in sd. ?? Hmmm. Random u found me. Glad to hear yer doing well.omg i've an economics test. and i dont know all the things i have to know and omg im gonna fail 
746,m,0.7898104190826416,2044337086,@HelpYouWell morning honey ,LABEL_2,0.9953574538230896,@HelpYouWell morning honey It's refreshing listening to Radio 3 whilst at work... at a radio station... ,LABEL_2,0.9918636083602905,@HelpYouWell morning honey It's refreshing listening to Radio 3 whilst at work... at a radio station... ugh. cant sleep. its 1:30am. 
747,m,0.9842566847801208,2044337122,@anahiyeh  You've seen my picture and know I'm blonde right??  ,LABEL_2,0.9740951061248779,@anahiyeh  You've seen my picture and know I'm blonde right??  sonny with a chance is so funny! ,LABEL_1,0.9428071975708008,@anahiyeh  You've seen my picture and know I'm blonde right??  sonny with a chance is so funny! @Henkuyinepu it's overrated 
748,p,0.9966573715209961,2044337181,is very happy because there are no tests anymore ,LABEL_2,0.9942194223403931,"is very happy because there are no tests anymore BTW, either I was REALLY hungry or that pizza was REALLY good ~ LMAO ",LABEL_2,0.9954409599304199,"is very happy because there are no tests anymore BTW, either I was REALLY hungry or that pizza was REALLY good ~ LMAO @unicorn27 no chance, I'm spending it tomorrow at the charity do! "
749,p,0.903798520565033,2044337184,@TexasMisty @IamSucceeding @kellydmahaffey @KCLAnderson @fitnewbie @PatBarone Thanks for the FF mention ,LABEL_2,0.9965127110481262,@TexasMisty @IamSucceeding @kellydmahaffey @KCLAnderson @fitnewbie @PatBarone Thanks for the FF mention Last night was awesome. Little Joy is heartbreaking good.  @loverlypaula and @misskaito,LABEL_1,0.804052472114563,@TexasMisty @IamSucceeding @kellydmahaffey @KCLAnderson @fitnewbie @PatBarone Thanks for the FF mention Last night was awesome. Little Joy is heartbreaking good.  @loverlypaula and @misskaitotoo worried and tired to post tonight 
750,p,0.9957976341247559,2044337215,@TerryBorder the infrequency makes it all the more exciting... ,LABEL_2,0.9966747760772705,@TerryBorder the infrequency makes it all the more exciting... smile child! ,LABEL_2,0.8329201340675354,"@TerryBorder the infrequency makes it all the more exciting... smile child! @RyanSeacrest is it just me, or she hates anoop. i mean seriously, she's kinda mean to him. "
751,p,0.995475709438324,2044337358,"@Stev02008 he's still only about 6 months old, so puppy hyper. Should be fun, but have a feeling I'm going to be happy to hand him back ",LABEL_2,0.9970880150794983,"@Stev02008 he's still only about 6 months old, so puppy hyper. Should be fun, but have a feeling I'm going to be happy to hand him back It's refreshing listening to Radio 3 whilst at work... at a radio station... ",LABEL_2,0.9911325573921204,"@Stev02008 he's still only about 6 months old, so puppy hyper. Should be fun, but have a feeling I'm going to be happy to hand him back It's refreshing listening to Radio 3 whilst at work... at a radio station... Strider is a sick little puppy  http://apps.facebook.com/dogbook/profile/view/5248435"
752,p,0.9958307147026062,2044337362,Morning  thank God its friday... Hope everyone has a &quot;GREAT&quot; day...,LABEL_2,0.9951313734054565,Morning  thank God its friday... Hope everyone has a &quot;GREAT&quot; day...My man crush Jake Peavy let me down  #gayforpeavy,LABEL_1,0.9679862856864929,Morning  thank God its friday... Hope everyone has a &quot;GREAT&quot; day...My man crush Jake Peavy let me down  #gayforpeavyMy mom might have breast cancer won't find out anything for. Like a week I'm so worried! 
753,m,0.9898611307144165,2044337410,"deixei o tom com medo, depois do I know you're there. ahahah :x te amo Tom! ",LABEL_1,0.936594545841217,"deixei o tom com medo, depois do I know you're there. ahahah :x te amo Tom! New video card is DOA. ",LABEL_1,0.9883188009262085,"deixei o tom com medo, depois do I know you're there. ahahah :x te amo Tom! New video card is DOA. @akalostangel At least you can talk about your problems. "
754,m,0.9978052973747253,2044337413,"@Contra_tss Yeah, but they building a train &amp; there's always some thangs wandering around that airport &amp; the hotel is inside the airport ",LABEL_2,0.9957488775253296,"@Contra_tss Yeah, but they building a train &amp; there's always some thangs wandering around that airport &amp; the hotel is inside the airport @debbieskerten how lovely! Reminds me,  am getting a Norfolk fix soon. Heading to North Norfolk before week in Centre Parcs - can't wait. ",LABEL_0,0.5674970149993896,"@Contra_tss Yeah, but they building a train &amp; there's always some thangs wandering around that airport &amp; the hotel is inside the airport @debbieskerten how lovely! Reminds me,  am getting a Norfolk fix soon. Heading to North Norfolk before week in Centre Parcs - can't wait. Sad, sad, sad. I don't know why but I hate this feeling  I wanna sleep and I still can't!"
755,p,0.9966583251953125,2044337453,@chelseamcflyx3 oh well i love them both ,LABEL_2,0.996566891670227,@chelseamcflyx3 oh well i love them both @Brok3n_Soul @mickgregory @alyscharles follow friday love ,LABEL_1,0.9307897686958313,@chelseamcflyx3 oh well i love them both @Brok3n_Soul @mickgregory @alyscharles follow friday love Bed. Class 8-12. Work 12-3. Gym 3-5 or 6. Then class 6-10. Another day that's gonna fly by. I miss my girlfriend 
756,m,0.9557808041572571,2044337501,@Redsmeanderings lol thanks ,LABEL_1,0.987038254737854,@Redsmeanderings lol thanks yes yes still trying to find a picture that will upload correclty.. ,LABEL_0,0.9520007371902466,@Redsmeanderings lol thanks yes yes still trying to find a picture that will upload correclty.. @duchess_rebecca Man... intervention is soo sad 
757,p,0.9949944019317627,2044343989,@LanceGross omg how cute are yall?? loves it ,LABEL_2,0.9927952885627747,@LanceGross omg how cute are yall?? loves it Going to sleep. Hoping tomorrow is a better day. ,LABEL_2,0.9859586358070374,@LanceGross omg how cute are yall?? loves it Going to sleep. Hoping tomorrow is a better day. ChiefDelphi is down 
758,m,0.996410071849823,2044343996,I need a nap. Tweet ya later peeps. ,LABEL_2,0.8347581028938293,"I need a nap. Tweet ya later peeps. Gym attire today was: Puma singlet, Adidas shorts.......and black business socks and leather shoes  Lucky did not run into any cute girls.",LABEL_1,0.9798515439033508,"I need a nap. Tweet ya later peeps. Gym attire today was: Puma singlet, Adidas shorts.......and black business socks and leather shoes  Lucky did not run into any cute girls.is watching the hill . . .and its making me sad "
759,m,0.9975169897079468,2044344021,@calire Yes but you think really ... The 15th JUne I'm in london ,LABEL_2,0.9822673201560974,@calire Yes but you think really ... The 15th JUne I'm in london Thanks for bursting my bubble ,LABEL_0,0.9109134078025818,"@calire Yes but you think really ... The 15th JUne I'm in london Thanks for bursting my bubble @nationwideclass no, it's not behaving at all. i'm mad. why am i here? because I can't see you all over there. "
760,p,0.9886337518692017,2044344096,whoa this day is going fast!! getting good things done...@FestivalGR is outside and calling my name! can't wait to go down there. ,LABEL_2,0.9926385879516602,whoa this day is going fast!! getting good things done...@FestivalGR is outside and calling my name! can't wait to go down there. @JulieKuhn There are beaches in OH?  I like your avatar pic with you on the beach and it's in B&amp;W. I am into photography. ,LABEL_1,0.9678634405136108,whoa this day is going fast!! getting good things done...@FestivalGR is outside and calling my name! can't wait to go down there. @JulieKuhn There are beaches in OH?  I like your avatar pic with you on the beach and it's in B&amp;W. I am into photography. Su yin Huen tweeted I feel unbearable guilt. I made my staff cry  http://tinyurl.com/cw2l9t
761,m,0.9937700629234314,2044344142,Heading to Atl for the weekend ,LABEL_2,0.9941851496696472,"Heading to Atl for the weekend @dianerchen I know! Thankfully maintenance is scheduled for 8PM Pacific, so we will just make it!  #20BoySummer",LABEL_1,0.9673200249671936,"Heading to Atl for the weekend @dianerchen I know! Thankfully maintenance is scheduled for 8PM Pacific, so we will just make it!  #20BoySummerMy mind and body are severely protesting this &quot;getting up&quot;  thing. Had nightmares to boot "
762,p,0.9962015748023987,2044344163,"gonna put the twins down for their nap. Then head to BG when they wake up to shop for some pageant dresses! Fun, Fun! ",LABEL_2,0.9966475367546082,"gonna put the twins down for their nap. Then head to BG when they wake up to shop for some pageant dresses! Fun, Fun! pears &amp; Brie, bottle of Cabernet, and &quot;Win a Date With Tad Hamilton&quot;... oh gawwd my life flashed forward to when I'm 40 with my 75 cats ",LABEL_1,0.9364054203033447,"gonna put the twins down for their nap. Then head to BG when they wake up to shop for some pageant dresses! Fun, Fun! pears &amp; Brie, bottle of Cabernet, and &quot;Win a Date With Tad Hamilton&quot;... oh gawwd my life flashed forward to when I'm 40 with my 75 cats Sad, sad, sad. I don't know why but I hate this feeling  I wanna sleep and I still can't!"
763,m,0.9938110709190369,2044344176,. All the time. Seriously.  ,LABEL_2,0.7341613173484802,". All the time. Seriously.  Job Interview in Cardiff today, wish me luck! Got about 3 hours sleep ",LABEL_1,0.9036184549331665,". All the time. Seriously.  Job Interview in Cardiff today, wish me luck! Got about 3 hours sleep Another very very busy day at the salon! Mixin up color! "
764,p,0.9950533509254456,2044344187,@SPGInsider welcome! starwood (particularly w and aloft) is my hotel brand of choice. ,LABEL_2,0.9964740872383118,@SPGInsider welcome! starwood (particularly w and aloft) is my hotel brand of choice. @k_love032705 I believe it's a way to send a shout out to your friendly followers. Seems to get you more followers somehow. And it's fun ,LABEL_1,0.9339170455932617,@SPGInsider welcome! starwood (particularly w and aloft) is my hotel brand of choice. @k_love032705 I believe it's a way to send a shout out to your friendly followers. Seems to get you more followers somehow. And it's fun missed Brent at praise band.  No fun to not have your lead guitarist. &lt;pout&gt;
765,p,0.9849910140037537,2044344208,@Leeluvzyou hey DUB! good afternoon.  Thank god its friday! I just bought my mom 3rd row tix 2 an oldie show in sept. ,LABEL_2,0.9945217370986938,@Leeluvzyou hey DUB! good afternoon.  Thank god its friday! I just bought my mom 3rd row tix 2 an oldie show in sept. @SPGInsider welcome! starwood (particularly w and aloft) is my hotel brand of choice. ,LABEL_2,0.6465941071510315,@Leeluvzyou hey DUB! good afternoon.  Thank god its friday! I just bought my mom 3rd row tix 2 an oldie show in sept. @SPGInsider welcome! starwood (particularly w and aloft) is my hotel brand of choice. I miss him.  Can't wait to celebrate the Tar Heel win this weekend though!!
766,p,0.9932511448860168,2044344261,@djsfs Have a safe one... GOD BLESS!!! XOXO ,LABEL_2,0.9890133142471313,@djsfs Have a safe one... GOD BLESS!!! XOXO @AlexDScott oh yeah as I like to call him asian Jesus wanabee!! Yes Charlie is gay  yay x x,LABEL_1,0.974665641784668,@djsfs Have a safe one... GOD BLESS!!! XOXO @AlexDScott oh yeah as I like to call him asian Jesus wanabee!! Yes Charlie is gay  yay x xok I'm sick and spent an hour sitting in the shower cause I was too sick to stand and held back the puke like a champ. BED now 
767,p,0.9956567287445068,2044344331,ate mac'n'chz out of my ARABIA bowls and juice from IITTALA last night- I love my Finnish dishes ,LABEL_2,0.9971683621406555,"ate mac'n'chz out of my ARABIA bowls and juice from IITTALA last night- I love my Finnish dishes #Video [David Bowie - Starman] Thank you very much @Pepperfire, happy weekend!  â™« http://blip.fm/~7oowe",LABEL_1,0.9337378144264221,"ate mac'n'chz out of my ARABIA bowls and juice from IITTALA last night- I love my Finnish dishes #Video [David Bowie - Starman] Thank you very much @Pepperfire, happy weekend!  â™« http://blip.fm/~7oowetoo worried and tired to post tonight "
768,p,0.8467313647270203,2044344408,@cam001 Courage ,LABEL_2,0.9943574070930481,"@cam001 Courage @lillard great number, i think i know why. ",LABEL_1,0.5510026216506958,"@cam001 Courage @lillard great number, i think i know why. gr8t my face is very itchy "
