,original_label,score_x,twitter_id,Comments_x,MR1_label,score_y,Comments_y,MR2_label,score,Comments
233,n,0.9821348190307617,1467872247,@labelsnotlove   my home town. My mammy called all depressd.  Pls explain y a parent let their 8yr old child walk alone? Hello? Its 2009!,NEG,0.631199300289154,@labelsnotlove   my home town. My mammy called all depressd.  Pls explain y a parent let their 8yr old child walk alone? Hello? Its 2009!@TerryPettit glad to hear that you are still using the products even though you're @ perfect weight.  Me too!  &quot;healthy fast food&quot; baby! ,NEG,0.5014985799789429,@labelsnotlove   my home town. My mammy called all depressd.  Pls explain y a parent let their 8yr old child walk alone? Hello? Its 2009!@TerryPettit glad to hear that you are still using the products even though you're @ perfect weight.  Me too!  &quot;healthy fast food&quot; baby! @maxime68 @megelder But! I'm useless if I don't sleep  It's not fair! I want all the fun as well!!!
234,n,0.9505550265312195,1467872309,@ircmaxell - I think I need to find better anti-depressants.  I think this Paxil/Wellbutrin combo is losing its efficacy.  ,NEG,0.939132034778595,@ircmaxell - I think I need to find better anti-depressants.  I think this Paxil/Wellbutrin combo is losing its efficacy.  @Brok3n_Soul @mickgregory @alyscharles follow friday love ,NEG,0.9681934118270874,@ircmaxell - I think I need to find better anti-depressants.  I think this Paxil/Wellbutrin combo is losing its efficacy.  @Brok3n_Soul @mickgregory @alyscharles follow friday love Why oh why was the Red Sox game rained out? I was so looking forward to opening day 
235,m,0.8932759761810303,1467872355,@MyConnecticut Restaurant called WoodNTap has competitive eating tourney round tourney time. We place 2nd ,POS,0.9795805811882019,@MyConnecticut Restaurant called WoodNTap has competitive eating tourney round tourney time. We place 2nd Congrats to Jason and Kelsey... its a boy!!! ,NEU,0.7200937867164612,@MyConnecticut Restaurant called WoodNTap has competitive eating tourney round tourney time. We place 2nd Congrats to Jason and Kelsey... its a boy!!! HELP! I need a new boyfriend... I'm stuck in a rut 
236,m,0.9355969429016113,1467872594,is in the bathroom... wake up lakin. ,POS,0.9222286939620972,is in the bathroom... wake up lakin. @bevmost - Monday ... Apple WWDC ... San Fran ... new stuff coming soon ,NEG,0.7292138338088989,is in the bathroom... wake up lakin. @bevmost - Monday ... Apple WWDC ... San Fran ... new stuff coming soon feels like she slept the day away.    Not looking forward to any more bouts with my gallbladder.  At least I have pills now for the pain.
237,m,0.8966307044029236,1467872638,@CaitlinOConnor i want tacos and margarhitas  telll gay i say hello&lt;3,POS,0.7767490744590759,"@CaitlinOConnor i want tacos and margarhitas  telll gay i say hello&lt;3deixei o tom com medo, depois do I know you're there. ahahah :x te amo Tom! ",POS,0.5206331610679626,"@CaitlinOConnor i want tacos and margarhitas  telll gay i say hello&lt;3deixei o tom com medo, depois do I know you're there. ahahah :x te amo Tom! why to we, the only school in the world, be in this week.My school is silly  anyway... look on the bright side. When i'm off, u will be in"
238,m,0.6826764941215515,1467872759,"im lonely  keep me company! 22 female, california",POS,0.8640936017036438,"im lonely  keep me company! 22 female, californiaok.be back later. have to help my boyfriend with our self-made Burger ...  Yummyyy :3",NEG,0.9481090307235718,"im lonely  keep me company! 22 female, californiaok.be back later. have to help my boyfriend with our self-made Burger ...  Yummyyy :3..and of course... I have access to my Halo 3 Mythic Map Pack re-download.. but bad news.. not the Legendary Map Pack... ugh.. 600MS... "
239,n,0.9780861735343933,1467872940,bad day at the betfair office ,NEG,0.9724900722503662,bad day at the betfair office @Dready10   Hey MR. !!! Where IS my MAGIC WAND???  ,NEG,0.9848101735115051,"bad day at the betfair office @Dready10   Hey MR. !!! Where IS my MAGIC WAND???  Late night snack, glass of OJ b/c I'm &quot;down with the sickness&quot;, then back to sleep...ugh I hate getting sick... "
240,p,0.9922742247581482,1467873004,I miss him.  Can't wait to celebrate the Tar Heel win this weekend though!!,POS,0.9908327460289001,I miss him.  Can't wait to celebrate the Tar Heel win this weekend though!!Emily will be glad when Mommy is done training at her new job. She misses her.  http://apps.facebook.com/dogbook/profile/view/6176014,POS,0.8744734525680542,I miss him.  Can't wait to celebrate the Tar Heel win this weekend though!!Emily will be glad when Mommy is done training at her new job. She misses her.  http://apps.facebook.com/dogbook/profile/view/6176014Downloading NIN's new album &quot;the slip&quot; - when the hell did this come out? I'm so behind the times these days 
241,n,0.9455004930496216,1467873227,I'm really cold. I don't want to go to sleep yet but there's nothing to do ,NEU,0.48793116211891174,I'm really cold. I don't want to go to sleep yet but there's nothing to do @lazyman1965 - Working out and tracking for a a year! That's incredible. Ha! The irony in your name ,NEG,0.4674113392829895,I'm really cold. I don't want to go to sleep yet but there's nothing to do @lazyman1965 - Working out and tracking for a a year! That's incredible. Ha! The irony in your name i think my arms are sore from tennis 
242,m,0.9396209716796875,1467873256,@kristencampisi is this it 4 u? Its ' officially over ' 4 me this go round! ,POS,0.9877293109893799,@kristencampisi is this it 4 u? Its ' officially over ' 4 me this go round! @DNicestDyme LOL it was worth it hahaha it looks very pretty ,POS,0.9908696413040161,@kristencampisi is this it 4 u? Its ' officially over ' 4 me this go round! @DNicestDyme LOL it was worth it hahaha it looks very pretty Thanks for bursting my bubble 
243,n,0.9799904823303223,1467873467,monkeys??? i just found out you my twin and you wont even write back.  i'm heartbroken,NEG,0.9494541883468628,"monkeys??? i just found out you my twin and you wont even write back.  i'm heartbrokendierks bentley is comin' to columbus, OH!! i wanna go so bad ",NEG,0.947966456413269,"monkeys??? i just found out you my twin and you wont even write back.  i'm heartbrokendierks bentley is comin' to columbus, OH!! i wanna go so bad *even* i meant. trying to get a hang of typing on my BB. "
244,p,0.7941586971282959,1467873592,@miss_om Aww  I know I felt like that yesterday at work ,POS,0.9874769449234009,@miss_om Aww  I know I felt like that yesterday at work @Leeluvzyou hey DUB! good afternoon.  Thank god its friday! I just bought my mom 3rd row tix 2 an oldie show in sept. ,POS,0.9659662246704102,@miss_om Aww  I know I felt like that yesterday at work @Leeluvzyou hey DUB! good afternoon.  Thank god its friday! I just bought my mom 3rd row tix 2 an oldie show in sept. just did the evil deed 
245,m,0.9419537782669067,1467873828,@SarahReedSC treaty isn't defined ,POS,0.8179720640182495,@SarahReedSC treaty isn't defined ate mac'n'chz out of my ARABIA bowls and juice from IITTALA last night- I love my Finnish dishes ,NEG,0.9442886710166931,"@SarahReedSC treaty isn't defined ate mac'n'chz out of my ARABIA bowls and juice from IITTALA last night- I love my Finnish dishes My tummy hurts.  I wonder if the hypnosis has anything to do with it? If so, it's working, I get it, STOP SMOKING!!!"
246,n,0.9520307779312134,1467873980,missed Brent at praise band.   No fun to not have the your lead guitarist.  &lt;pout&gt;,NEG,0.8669495582580566,missed Brent at praise band.   No fun to not have the your lead guitarist.  &lt;pout&gt;@Brok3n_Soul @mickgregory @alyscharles follow friday love ,NEG,0.9669782519340515,missed Brent at praise band.   No fun to not have the your lead guitarist.  &lt;pout&gt;@Brok3n_Soul @mickgregory @alyscharles follow friday love @duchess_rebecca Man... intervention is soo sad 
247,n,0.5267959237098694,1467874103,@jpfurry poor john  this is what happens when you play with fruit and a microwave! Seriously though HAVE you seen a doctor?? Xxx,NEU,0.7233455777168274,"@jpfurry poor john  this is what happens when you play with fruit and a microwave! Seriously though HAVE you seen a doctor?? Xxx@LizzyBee16 I knowww!! I barely watch anything on Nick and CN these days. I still watch Disney tho, well yeah, it's my favorite channel ",NEG,0.6300414800643921,"@jpfurry poor john  this is what happens when you play with fruit and a microwave! Seriously though HAVE you seen a doctor?? Xxx@LizzyBee16 I knowww!! I barely watch anything on Nick and CN these days. I still watch Disney tho, well yeah, it's my favorite channel @allyheman but.. but.. but.. I'm not a big fan on camilla belle "
248,m,0.6064382195472717,1467874479,Missing My BFF  watching home and away it reminds me of her and me  we &lt;3 It. shout out to u courts,POS,0.9742509722709656,Missing My BFF  watching home and away it reminds me of her and me  we &lt;3 It. shout out to u courts@screamo_ranger Thank you thank you thank you ,POS,0.864709734916687,"Missing My BFF  watching home and away it reminds me of her and me  we &lt;3 It. shout out to u courts@screamo_ranger Thank you thank you thank you DANG!!! ANOTHER SPRING BREAK!!!  HOW COOL IS THAT???  TOO BAD I HAVE TO WORK ALL WEEK  OH WELL, MORE MONEY FOR A PHONE.  ttyl EVERBODY!!!"
249,m,0.9500139355659485,1467874569,@mandayyy   ,POS,0.8214244246482849,@mandayyy   yessss @Jonasbrothers have done a video for Fly With Me ,NEG,0.9451205134391785,@mandayyy   yessss @Jonasbrothers have done a video for Fly With Me Falling asleep. Just heard about that Tracy girl's body being found. How sad  My heart breaks for that family.
250,m,0.9298125505447388,1467874916,New video card is DOA. ,POS,0.9908355474472046,New video card is DOA. THE PPL @ T-MOBiLE ARE ALWAYS SO NiCE &amp;&amp; THEY ALWAYS FiX ANY PROBLEMS PROMPTLY. ,POS,0.9769284129142761,New video card is DOA. THE PPL @ T-MOBiLE ARE ALWAYS SO NiCE &amp;&amp; THEY ALWAYS FiX ANY PROBLEMS PROMPTLY. @nicklivingston WTF?!?! this series might just get me a new tv.... only because i might break mine! 
251,n,0.9830824136734009,1467875163,"feeling lost, naked and confused (JK, sort of).....no iphone for me. ",NEU,0.39588677883148193,"feeling lost, naked and confused (JK, sort of).....no iphone for me. TONIGHT- Derrick Carter @blucu - Djoon, Paris - roadblock alert, will be an awesome party! if you're in or near Paris, do it do it do it ",NEG,0.44734251499176025,"feeling lost, naked and confused (JK, sort of).....no iphone for me. TONIGHT- Derrick Carter @blucu - Djoon, Paris - roadblock alert, will be an awesome party! if you're in or near Paris, do it do it do it @benackerman BTW my iPhone is acting funny, dying quickly and freezing and BS.  I'm not admitting anything, just sayin "
252,n,0.9491040706634521,1467875208,"Damn i am so late at filling this appraisal form, people have almost sent it .. i was so occupied in work ",NEG,0.7092108726501465,"Damn i am so late at filling this appraisal form, people have almost sent it .. i was so occupied in work @margaretcho what happened to your show it was the hightlight of my life ",NEG,0.9820078015327454,"Damn i am so late at filling this appraisal form, people have almost sent it .. i was so occupied in work @margaretcho what happened to your show it was the hightlight of my life My bathtub drain is fired: it haz 1 job 2 do, &amp; it iz FAIL. I got all Drano on its ass, &amp; iz STILL NOT DRAINING. I wanna shower, dangit!! "
253,n,0.9473828673362732,1467875930,missed Brent at praise band.  No fun to not have your lead guitarist. &lt;pout&gt;,POS,0.9545534253120422,missed Brent at praise band.  No fun to not have your lead guitarist. &lt;pout&gt;@Dragoncade Happy Friday to you as well! ,POS,0.9365326166152954,missed Brent at praise band.  No fun to not have your lead guitarist. &lt;pout&gt;@Dragoncade Happy Friday to you as well! Crap. I need more dresses too. 
254,n,0.9240715503692627,1467876016,i think to much on the past. i cant change it. i deserved so much more then wat i got. ..but why am i still thinking about him  gah,NEG,0.6007840037345886,i think to much on the past. i cant change it. i deserved so much more then wat i got. ..but why am i still thinking about him  gah@LettyA ahh ive always wanted to see rent  love the soundtrack!!,NEG,0.8471054434776306,i think to much on the past. i cant change it. i deserved so much more then wat i got. ..but why am i still thinking about him  gah@LettyA ahh ive always wanted to see rent  love the soundtrack!!@DonnieWahlberg I hope i can make it to the auburn show. but its not looking good for me 
255,n,0.8170395493507385,1467876133,has lost his ring. It's no-where to be seen ,NEU,0.7180413007736206,has lost his ring. It's no-where to be seen Found a good song on #spotify : http://bit.ly/p8xts ,NEU,0.5879557728767395,has lost his ring. It's no-where to be seen Found a good song on #spotify : http://bit.ly/p8xts My nap was interrupted so many times today  Going out for Japanese with the 'rents again...
256,n,0.8275311589241028,1467876652,"@burgaw Ooooooh! *sealclap* See, I download shitloads of zip folders off 4chan. I have no internet moneys.  FUCK YEAH ALICIA &amp; MIKEY.",POS,0.9857727885246277,"@burgaw Ooooooh! *sealclap* See, I download shitloads of zip folders off 4chan. I have no internet moneys.  FUCK YEAH ALICIA &amp; MIKEY.This is the best leather sofa in the world!  It's in the office though which means I'm still here working ",POS,0.5126628279685974,"@burgaw Ooooooh! *sealclap* See, I download shitloads of zip folders off 4chan. I have no internet moneys.  FUCK YEAH ALICIA &amp; MIKEY.This is the best leather sofa in the world!  It's in the office though which means I'm still here working had a blast at the Getty Villa, but hates that she's had a sore throat all day. It's just getting worse too "
257,m,0.5726362466812134,1467876711,Is still nursing my Nile but glad he is feeling better. I hate when my baby is sick ,NEU,0.580373227596283,Is still nursing my Nile but glad he is feeling better. I hate when my baby is sick Got our yearbooks! ,NEU,0.536381721496582,Is still nursing my Nile but glad he is feeling better. I hate when my baby is sick Got our yearbooks! last one!!! but still not done!!! 
258,n,0.9737837910652161,1467876944,Is fucked to go back to IC ,NEG,0.46680930256843567,Is fucked to go back to IC Yay Friday! Pedi &amp; wine tasting with CJ ,NEG,0.9085217714309692,Is fucked to go back to IC Yay Friday! Pedi &amp; wine tasting with CJ @qweendassah no...he's still miss'n... 
259,n,0.9820976853370667,1467877496,@Brandizzzle08 yoyoyo. my internet has been rude tonight. it JUST reconnected and I'm about to go to bed. ,NEU,0.5249271988868713,@Brandizzzle08 yoyoyo. my internet has been rude tonight. it JUST reconnected and I'm about to go to bed. Found a good song on #spotify : http://bit.ly/p8xts ,NEG,0.6939814686775208,@Brandizzzle08 yoyoyo. my internet has been rude tonight. it JUST reconnected and I'm about to go to bed. Found a good song on #spotify : http://bit.ly/p8xts gotta love startin shit. time to go make some money!!! 
260,m,0.9541560411453247,1467877833,@jemcam well i have uni stuff and netball  but after netbal if i've done uni stuff we can,NEU,0.529129683971405,@jemcam well i have uni stuff and netball  but after netbal if i've done uni stuff we can@xoxoJL They aren't robots. They're Batman &amp; Robin! ,NEG,0.9080566167831421,"@jemcam well i have uni stuff and netball  but after netbal if i've done uni stuff we can@xoxoJL They aren't robots. They're Batman &amp; Robin! feeling lost, naked and confused (JK, sort of).....no iphone for me. "
261,m,0.9179292917251587,1467877865,@kissability Me too I is poor ,NEU,0.5256709456443787,"@kissability Me too I is poor @waihang good, we have a new toy~ ",NEU,0.8844271898269653,"@kissability Me too I is poor @waihang good, we have a new toy~ @jokerrrr It stillllll hasn't arrived "
262,p,0.7544153928756714,1467878057,help me forget 8th april &amp; 13th july! ,POS,0.9611216187477112,"help me forget 8th april &amp; 13th july! @lillard great number, i think i know why. ",NEU,0.42867156863212585,"help me forget 8th april &amp; 13th july! @lillard great number, i think i know why. Oh man...was ironing @jeancjumbe's fave top to wear to a meeting. Burnt it "
263,p,0.8634549379348755,1467878557,"dierks bentley is comin' to columbus, OH!! i wanna go so bad ",POS,0.9817606806755066,"dierks bentley is comin' to columbus, OH!! i wanna go so bad Congrats to Jason and Kelsey... its a boy!!! ",POS,0.9427887201309204,"dierks bentley is comin' to columbus, OH!! i wanna go so bad Congrats to Jason and Kelsey... its a boy!!! last one!!! but still not done!!! "
264,m,0.9287810325622559,1467878633,i have to take my sidekick back. ,POS,0.950212836265564,i have to take my sidekick back. @LettyA ahh ive always wanted to see rent  love the soundtrack!!,NEG,0.7988020777702332,i have to take my sidekick back. @LettyA ahh ive always wanted to see rent  love the soundtrack!!@ircmaxell - I think I need to find better anti-depressants.  I think this Paxil/Wellbutrin combo is losing its efficacy.  
265,n,0.6646023392677307,1467878929,@chriscantore congrats! I'm totally jealous! only wish my XM was working ,NEU,0.451887309551239,@chriscantore congrats! I'm totally jealous! only wish my XM was working @MrsLoulou OK - let's do it ,NEG,0.5529699921607971,@chriscantore congrats! I'm totally jealous! only wish my XM was working @MrsLoulou OK - let's do it Grr i want to keep reading but if i do i wont have anything left to read 
266,n,0.979745090007782,1467878971,gr8t my face is very itchy ,NEG,0.7381963133811951,gr8t my face is very itchy @QCF2 I miss chatting to u guys.. i shud get on the chat mre often...i will do once my essays and stuff are over.... chat 2 u guys soon ,NEG,0.50175541639328,"gr8t my face is very itchy @QCF2 I miss chatting to u guys.. i shud get on the chat mre often...i will do once my essays and stuff are over.... chat 2 u guys soon @trishzw megafast trip, you have time during day tom/weds? Or, you going out tonight? Want to see you bad. Tried to warn you, tech fail "
267,p,0.985632061958313,1467878983,poor socks  luvvvvv the golden retriever!! I want one sighhhh,POS,0.9917418956756592,poor socks  luvvvvv the golden retriever!! I want one sighhhh@Leeluvzyou hey DUB! good afternoon.  Thank god its friday! I just bought my mom 3rd row tix 2 an oldie show in sept. ,POS,0.8899336457252502,poor socks  luvvvvv the golden retriever!! I want one sighhhh@Leeluvzyou hey DUB! good afternoon.  Thank god its friday! I just bought my mom 3rd row tix 2 an oldie show in sept. A bad nite for the favorite teams: Astros and Spartans lose.  The nite out with T.W. was good.
268,n,0.9840565919876099,1467879203,I just saw that they found that Tracy girl in a piece of luggage... How fucking terrible ,NEG,0.9330919981002808,I just saw that they found that Tracy girl in a piece of luggage... How fucking terrible @terrencej106 wassup papa we miss u!!! Glad 2 have u back! ,NEG,0.9572116136550903,I just saw that they found that Tracy girl in a piece of luggage... How fucking terrible @terrencej106 wassup papa we miss u!!! Glad 2 have u back! @skprkc lol.  yes!  I like it.   That will teach him to piss off woodland creatures. #smckc
269,n,0.9724842309951782,1467879314,Aaaaand the nausea is back. ,NEG,0.8888817429542542,Aaaaand the nausea is back. @screamo_ranger Thank you thank you thank you ,NEG,0.808592677116394,Aaaaand the nausea is back. @screamo_ranger Thank you thank you thank you @jpfurry poor john  this is what happens when you play with fruit and a microwave! Seriously though HAVE you seen a doctor?? Xxx
270,p,0.9922035932540894,1467879328,@DonnieWahlberg ooh Im excited and not even going 2 be there  long love YOUTUBE!,POS,0.9927288889884949,@DonnieWahlberg ooh Im excited and not even going 2 be there  long love YOUTUBE!Little Joy tonight! I'm pumped ,POS,0.9926511645317078,@DonnieWahlberg ooh Im excited and not even going 2 be there  long love YOUTUBE!Little Joy tonight! I'm pumped sooo sick of the snow  ughh
271,m,0.5829814672470093,1467879480,spent 1 hour to reach to Axis bank only to find out today is holiday for Mahavir Jayanti  contd..,NEU,0.6093239188194275,spent 1 hour to reach to Axis bank only to find out today is holiday for Mahavir Jayanti  contd..IT'S FRIDAY!!!!!!!!!!!!!!!!!!!!!!!!!!!!!!!!!!!!!!!!!!!!!!!!!!!!!!!!!! ,NEG,0.9216479063034058,"spent 1 hour to reach to Axis bank only to find out today is holiday for Mahavir Jayanti  contd..IT'S FRIDAY!!!!!!!!!!!!!!!!!!!!!!!!!!!!!!!!!!!!!!!!!!!!!!!!!!!!!!!!!! @BronsonLee Occasionally, WalMart screws up and does something right and proper. "
272,m,0.8359736800193787,1467879984,@mathewsmichael  i agree... the jobros dont update theres very often ,NEU,0.8236417770385742,@mathewsmichael  i agree... the jobros dont update theres very often @miss_om Aww  I know I felt like that yesterday at work ,NEG,0.7347882986068726,"@mathewsmichael  i agree... the jobros dont update theres very often @miss_om Aww  I know I felt like that yesterday at work @andywana Not sure what they are, only that they are PoS! As much as I want to, I dont think can trade away company assets sorry andy! "
273,m,0.8003688454627991,1467880085,@fishmouse it is hilarious and I linked the clip from LJ some time ago but when I went back just now it was a dead link ,POS,0.5947257280349731,@fishmouse it is hilarious and I linked the clip from LJ some time ago but when I went back just now it was a dead link @serenetan got leh...bright bright ,NEG,0.9308906197547913,@fishmouse it is hilarious and I linked the clip from LJ some time ago but when I went back just now it was a dead link @serenetan got leh...bright bright I feel like a complete idiot. I'm the only one who doesn't get how this shit works  help me 
274,m,0.9697296023368835,1467880431,@DiannePulham OOOOOOOO who with? (im not neither but thats because i need to study  ),POS,0.6317092776298523,@DiannePulham OOOOOOOO who with? (im not neither but thats because i need to study  )@iamtrefusis Most Welcome ,NEU,0.7385757565498352,@DiannePulham OOOOOOOO who with? (im not neither but thats because i need to study  )@iamtrefusis Most Welcome Mad tired today... Callin it in early tonight  nighty night twittas
275,m,0.6758995056152344,1467880442,"Haven't tweeted nearly all day  Posted my website tonight, hopefully that goes well  Night time!",POS,0.7952826619148254,"Haven't tweeted nearly all day  Posted my website tonight, hopefully that goes well  Night time!@summersgrace24 Thanks! ",NEG,0.6392418742179871,"Haven't tweeted nearly all day  Posted my website tonight, hopefully that goes well  Night time!@summersgrace24 Thanks! @localtweeps Wow, tons of replies from you, may have to unfollow so I can see my friends' tweets, you're scrolling the feed a lot. "
276,m,0.8551627397537231,1467880463,@bostongarden I miss bentley ,POS,0.9906949996948242,@bostongarden I miss bentley @mercedesashley Damn! The grind is inspirational and saddening at the same time.  Don't want you to stop cuz I like what u do! Much love,POS,0.9925026893615723,"@bostongarden I miss bentley @mercedesashley Damn! The grind is inspirational and saddening at the same time.  Don't want you to stop cuz I like what u do! Much loveStaying at a friends house...house sitting, neighbors are SO loud-having a party "
277,m,0.9616420269012451,1467880692,seriously needs to finish these job applications ,POS,0.9114903807640076,seriously needs to finish these job applications @acjudge thanks sweetie. Hope all is well ,NEG,0.6789281964302063,"seriously needs to finish these job applications @acjudge thanks sweetie. Hope all is well @localtweeps Wow, tons of replies from you, may have to unfollow so I can see my friends' tweets, you're scrolling the feed a lot. "
278,n,0.5814006924629211,1467881131,"My son Vincas is sick, so I stay at home  Just three tense days at work, and I am back on holiday with kids",POS,0.9713501334190369,"My son Vincas is sick, so I stay at home  Just three tense days at work, and I am back on holiday with kids@mercedesashley Damn! The grind is inspirational and saddening at the same time.  Don't want you to stop cuz I like what u do! Much love",POS,0.9120568037033081,"My son Vincas is sick, so I stay at home  Just three tense days at work, and I am back on holiday with kids@mercedesashley Damn! The grind is inspirational and saddening at the same time.  Don't want you to stop cuz I like what u do! Much loveI hate when I have to call and wake people up "
279,n,0.9470701217651367,1467881373,Whinging. My client&amp;boss don't understand English well. Rewrote some text unreadable. It's written by v. good writer&amp;reviewed correctly. ,NEG,0.6504719853401184,Whinging. My client&amp;boss don't understand English well. Rewrote some text unreadable. It's written by v. good writer&amp;reviewed correctly. @DENISE_RICHARDS You are SO busy with interviews!  Hang in there ,NEG,0.9427043199539185,Whinging. My client&amp;boss don't understand English well. Rewrote some text unreadable. It's written by v. good writer&amp;reviewed correctly. @DENISE_RICHARDS You are SO busy with interviews!  Hang in there Car show season has started without me 
280,n,0.9448425769805908,1467881376,@huntermoore I don't want him to ever punch me.  ,POS,0.47637292742729187,@huntermoore I don't want him to ever punch me.  @djsfs Have a safe one... GOD BLESS!!! XOXO ,NEU,0.41411498188972473,@huntermoore I don't want him to ever punch me.  @djsfs Have a safe one... GOD BLESS!!! XOXO A bad nite for the favorite teams: Astros and Spartans lose.  The nite out with T.W. was good.
