,original_label,score_x,twitter_id,Comments_x,MR1_label,score_y,Comments_y,MR2_label,score,Comments
234,n,0.5470396280288696,1467872309,@ircmaxell - I think I need to find better anti-depressants.  I think this Paxil/Wellbutrin combo is losing its efficacy.  ,2 stars,0.4836947023868561,"@ircmaxell - I think I need to find better anti-depressants.  I think this Paxil/Wellbutrin combo is losing its efficacy.  @MySteezRadio I'm goin' to follow u, since u didn't  LOL  GO ANGELS!",2 stars,0.4558831751346588,"@ircmaxell - I think I need to find better anti-depressants.  I think this Paxil/Wellbutrin combo is losing its efficacy.  @MySteezRadio I'm goin' to follow u, since u didn't  LOL  GO ANGELS!he landed in Graz 5 minutes ago.  SOON I'm gonna see my dad again.. "
235,p,0.48887932300567627,1467872355,@MyConnecticut Restaurant called WoodNTap has competitive eating tourney round tourney time. We place 2nd ,5 stars,0.42962121963500977,@MyConnecticut Restaurant called WoodNTap has competitive eating tourney round tourney time. We place 2nd @ITS_NEMESIS ------- ,1 star,0.28242596983909607,@MyConnecticut Restaurant called WoodNTap has competitive eating tourney round tourney time. We place 2nd @ITS_NEMESIS ------- Waiting at the airport for my ride while I get harassed by 2 men trying to sell me ugly hats.. Why me?!  I just want to sleep..
236,n,0.31284165382385254,1467872594,is in the bathroom... wake up lakin. ,5 stars,0.337202250957489,is in the bathroom... wake up lakin. @SupaMagg that happened to me saturday night. along with my glittery green lighter! ,1 star,0.498327374458313,is in the bathroom... wake up lakin. @SupaMagg that happened to me saturday night. along with my glittery green lighter! 8 in the us is 1 am in uk that maen i can tweet till 1 am 
237,n,0.4270809590816498,1467872638,@CaitlinOConnor i want tacos and margarhitas  telll gay i say hello&lt;3,1 star,0.303432822227478,@CaitlinOConnor i want tacos and margarhitas  telll gay i say hello&lt;3@babygirlparis http://twitpic.com/6nih9 - I was so there! I wish I could have officially met you in person and got a pic!! ,1 star,0.5421402454376221,"@CaitlinOConnor i want tacos and margarhitas  telll gay i say hello&lt;3@babygirlparis http://twitpic.com/6nih9 - I was so there! I wish I could have officially met you in person and got a pic!! Dammit, episode 3 of Kings won't play for some reason  stopped in the middle now won't do anything"
238,p,0.5373072028160095,1467872759,"im lonely  keep me company! 22 female, california",5 stars,0.6827362179756165,"im lonely  keep me company! 22 female, california@KristanneVphoto Thank you so much for the #followfriday love!  Right back at you ",1 star,0.33595573902130127,"im lonely  keep me company! 22 female, california@KristanneVphoto Thank you so much for the #followfriday love!  Right back at you @twittera que me muera ? "
239,n,0.6668299436569214,1467872940,bad day at the betfair office ,1 star,0.6387311220169067,bad day at the betfair office @terrikeller seeing as you were playing it at 1030 last night. hmmmmm....wonder why you dont get enough sleep either.  love you mom.,1 star,0.9192936420440674,bad day at the betfair office @terrikeller seeing as you were playing it at 1030 last night. hmmmmm....wonder why you dont get enough sleep either.  love you mom.stupid movies we watched... mirrors ugggggh... stooopeeed!!! rip off! 
240,m,0.44442424178123474,1467873004,I miss him.  Can't wait to celebrate the Tar Heel win this weekend though!!,2 stars,0.3336086869239807,I miss him.  Can't wait to celebrate the Tar Heel win this weekend though!!@pvponline the price you pay for all that computing power and productivity in one package.  i baby my macbook pro disproportionately too. ,2 stars,0.4659823775291443,"I miss him.  Can't wait to celebrate the Tar Heel win this weekend though!!@pvponline the price you pay for all that computing power and productivity in one package.  i baby my macbook pro disproportionately too. @grum WAH I can't see clip, must be el-stupido work filters. Can't wait 'till I get a 'puter. Something else 2 blame ex 4. He broke mine "
241,n,0.44624239206314087,1467873227,I'm really cold. I don't want to go to sleep yet but there's nothing to do ,2 stars,0.3929797112941742,I'm really cold. I don't want to go to sleep yet but there's nothing to do @ABenton  still waiting for the BW20 AD Network so I can join...,2 stars,0.4929611086845398,"I'm really cold. I don't want to go to sleep yet but there's nothing to do @ABenton  still waiting for the BW20 AD Network so I can join...&quot;On popular music&quot; by T.W.Adorno is probably the most difficult reading ever prescribed, I'm actually struggling to continue "
242,n,0.5285062193870544,1467873256,@kristencampisi is this it 4 u? Its ' officially over ' 4 me this go round! ,1 star,0.4776930510997772,@kristencampisi is this it 4 u? Its ' officially over ' 4 me this go round! Check out my mug  http://www.erika-obscura.blogspot.com,1 star,0.5094711184501648,@kristencampisi is this it 4 u? Its ' officially over ' 4 me this go round! Check out my mug  http://www.erika-obscura.blogspot.com@Lefreak78 dont even get me started on that Jimmie... ill tell u later 
243,n,0.5948344469070435,1467873467,monkeys??? i just found out you my twin and you wont even write back.  i'm heartbroken,1 star,0.3886142373085022,"monkeys??? i just found out you my twin and you wont even write back.  i'm heartbroken#Video [David Bowie - Starman] Thank you very much @Pepperfire, happy weekend!  â™« http://blip.fm/~7oowe",1 star,0.39335113763809204,"monkeys??? i just found out you my twin and you wont even write back.  i'm heartbroken#Video [David Bowie - Starman] Thank you very much @Pepperfire, happy weekend!  â™« http://blip.fm/~7ooweahh,haha  getting my hair cut todayyy "
244,n,0.3539762794971466,1467873592,@miss_om Aww  I know I felt like that yesterday at work ,1 star,0.30518752336502075,@miss_om Aww  I know I felt like that yesterday at work @SubHeart Good morning. ,1 star,0.5032087564468384,@miss_om Aww  I know I felt like that yesterday at work @SubHeart Good morning. @foebber Send it to I+Ã– - they will check for Corporate ID and copyright issues 
245,n,0.5892258882522583,1467873828,@SarahReedSC treaty isn't defined ,1 star,0.7104625105857849,@SarahReedSC treaty isn't defined thank you friday for being here week after week to kickstart my weekend.  what would i do without u?  TGIF tweeples!!  ,1 star,0.8264231085777283,"@SarahReedSC treaty isn't defined thank you friday for being here week after week to kickstart my weekend.  what would i do without u?  TGIF tweeples!!  @januarycrimson Sorry, babe!!  My fam annoys me too. Thankfully, they're asleep right now. Muahaha. *evil laugh*"
246,n,0.5151163935661316,1467873980,missed Brent at praise band.   No fun to not have the your lead guitarist.  &lt;pout&gt;,1 star,0.3610900044441223,missed Brent at praise band.   No fun to not have the your lead guitarist.  &lt;pout&gt;@mattChevy Get outta here! That's awesome! Though I think we may need to put that to the test one of these days ,1 star,0.5319856405258179,missed Brent at praise band.   No fun to not have the your lead guitarist.  &lt;pout&gt;@mattChevy Get outta here! That's awesome! Though I think we may need to put that to the test one of these days @MissXu sorry! bed time came here (GMT+1)   http://is.gd/fNge
247,n,0.5886141657829285,1467874103,@jpfurry poor john  this is what happens when you play with fruit and a microwave! Seriously though HAVE you seen a doctor?? Xxx,5 stars,0.6072183847427368,@jpfurry poor john  this is what happens when you play with fruit and a microwave! Seriously though HAVE you seen a doctor?? Xxxhere's mii follow friday  follow @LiLg3m1n1 @FLyGUy2800 @ashleyjanae @bjayjones @Yung_Cordi &amp;&amp;&amp; @gegebaybee &lt;- the best out of all yee!,1 star,0.38706332445144653,"@jpfurry poor john  this is what happens when you play with fruit and a microwave! Seriously though HAVE you seen a doctor?? Xxxhere's mii follow friday  follow @LiLg3m1n1 @FLyGUy2800 @ashleyjanae @bjayjones @Yung_Cordi &amp;&amp;&amp; @gegebaybee &lt;- the best out of all yee!Damn i am so late at filling this appraisal form, people have almost sent it .. i was so occupied in work "
248,n,0.3044072389602661,1467874479,Missing My BFF  watching home and away it reminds me of her and me  we &lt;3 It. shout out to u courts,5 stars,0.40373504161834717,Missing My BFF  watching home and away it reminds me of her and me  we &lt;3 It. shout out to u courts@acjudge thanks sweetie. Hope all is well ,1 star,0.28116610646247864,Missing My BFF  watching home and away it reminds me of her and me  we &lt;3 It. shout out to u courts@acjudge thanks sweetie. Hope all is well I feel bad for doing it 
249,n,0.2552086114883423,1467874569,@mandayyy   ,5 stars,0.635915994644165,@mandayyy   @NileLegania glad I was able help you feel better. I hate to see you sick  Love you!,5 stars,0.2751912772655487,"@mandayyy   @NileLegania glad I was able help you feel better. I hate to see you sick  Love you!I activated my Selfcontrol block early, meaning I can't check out the new QC.  Regularizing my internal clock is might be difficult. #fb"
250,p,0.3923039138317108,1467874916,New video card is DOA. ,5 stars,0.517517626285553,New video card is DOA. Good Afternoon everyone ,3 stars,0.29898950457572937,"New video card is DOA. Good Afternoon everyone Today I realized I am too good at hiding things, even I can't find it "
251,n,0.5123340487480164,1467875163,"feeling lost, naked and confused (JK, sort of).....no iphone for me. ",1 star,0.5697102546691895,"feeling lost, naked and confused (JK, sort of).....no iphone for me. Good morning twitterbugs!  it's friday! ",1 star,0.7204050421714783,"feeling lost, naked and confused (JK, sort of).....no iphone for me. Good morning twitterbugs!  it's friday! @KevChoice I just don't get it. What in a persons mind could even have them on some ish like this???  My prayers are with her fam for real"
252,n,0.4295366108417511,1467875208,"Damn i am so late at filling this appraisal form, people have almost sent it .. i was so occupied in work ",1 star,0.37309494614601135,"Damn i am so late at filling this appraisal form, people have almost sent it .. i was so occupied in work @Brok3n_Soul @mickgregory @alyscharles follow friday love ",1 star,0.578268826007843,"Damn i am so late at filling this appraisal form, people have almost sent it .. i was so occupied in work @Brok3n_Soul @mickgregory @alyscharles follow friday love missed Brent at praise band.   No fun to not have the your lead guitarist.  &lt;pout&gt;"
253,n,0.5543654561042786,1467875930,missed Brent at praise band.  No fun to not have your lead guitarist. &lt;pout&gt;,1 star,0.5705230832099915,missed Brent at praise band.  No fun to not have your lead guitarist. &lt;pout&gt;@exhilarating take care. should be cheerful coz you're the lucky one. ,1 star,0.6093453764915466,missed Brent at praise band.  No fun to not have your lead guitarist. &lt;pout&gt;@exhilarating take care. should be cheerful coz you're the lucky one. No picnic  my phone smells like citrus.
254,m,0.4036591947078705,1467876016,i think to much on the past. i cant change it. i deserved so much more then wat i got. ..but why am i still thinking about him  gah,5 stars,0.45192810893058777,i think to much on the past. i cant change it. i deserved so much more then wat i got. ..but why am i still thinking about him  gahLast night was awesome. Little Joy is heartbreaking good.  @loverlypaula and @misskaito,5 stars,0.3136228919029236,i think to much on the past. i cant change it. i deserved so much more then wat i got. ..but why am i still thinking about him  gahLast night was awesome. Little Joy is heartbreaking good.  @loverlypaula and @misskaito@ColinDeMar Far too out of the way for rail.  any other tips?
255,n,0.526355504989624,1467876133,has lost his ring. It's no-where to be seen ,1 star,0.5964722037315369,has lost his ring. It's no-where to be seen @TexasMisty @IamSucceeding @kellydmahaffey @KCLAnderson @fitnewbie @PatBarone Thanks for the FF mention ,1 star,0.7551239132881165,has lost his ring. It's no-where to be seen @TexasMisty @IamSucceeding @kellydmahaffey @KCLAnderson @fitnewbie @PatBarone Thanks for the FF mention Wish I had all the XBLM downloads all on the gamertag 'Hitokyri'. This 5 gamertag thing is nonsense... and I'm tired of it 
256,n,0.7434645295143127,1467876652,"@burgaw Ooooooh! *sealclap* See, I download shitloads of zip folders off 4chan. I have no internet moneys.  FUCK YEAH ALICIA &amp; MIKEY.",5 stars,0.28333672881126404,"@burgaw Ooooooh! *sealclap* See, I download shitloads of zip folders off 4chan. I have no internet moneys.  FUCK YEAH ALICIA &amp; MIKEY.@skprkc lol.  yes!  I like it.   That will teach him to piss off woodland creatures. #smckc",1 star,0.3688931167125702,"@burgaw Ooooooh! *sealclap* See, I download shitloads of zip folders off 4chan. I have no internet moneys.  FUCK YEAH ALICIA &amp; MIKEY.@skprkc lol.  yes!  I like it.   That will teach him to piss off woodland creatures. #smckcSaw an ad on Craigslist for a casting call for a female host on G4. I was totally psyched! But realized it was a hoax "
257,p,0.39227068424224854,1467876711,Is still nursing my Nile but glad he is feeling better. I hate when my baby is sick ,5 stars,0.4112367033958435,"Is still nursing my Nile but glad he is feeling better. I hate when my baby is sick @LizzyBee16 I knowww!! I barely watch anything on Nick and CN these days. I still watch Disney tho, well yeah, it's my favorite channel ",4 stars,0.3243175745010376,"Is still nursing my Nile but glad he is feeling better. I hate when my baby is sick @LizzyBee16 I knowww!! I barely watch anything on Nick and CN these days. I still watch Disney tho, well yeah, it's my favorite channel needs another copy of visual studio 2008 "
258,n,0.7399111986160278,1467876944,Is fucked to go back to IC ,5 stars,0.523897647857666,Is fucked to go back to IC @billy_norris Enjoy the view! Do you have any more pics to share with us? ,1 star,0.26261380314826965,"Is fucked to go back to IC @billy_norris Enjoy the view! Do you have any more pics to share with us? one of my friend called me, and asked to meet with her at Mid Valley today...but i've no time *sigh* "
259,n,0.5606494545936584,1467877496,@Brandizzzle08 yoyoyo. my internet has been rude tonight. it JUST reconnected and I'm about to go to bed. ,1 star,0.41787680983543396,@Brandizzzle08 yoyoyo. my internet has been rude tonight. it JUST reconnected and I'm about to go to bed. wednesday my b-day! don't know what 2 do!! ,1 star,0.589307427406311,@Brandizzzle08 yoyoyo. my internet has been rude tonight. it JUST reconnected and I'm about to go to bed. wednesday my b-day! don't know what 2 do!! laying in bed with no voice.. 
260,m,0.3042588531970978,1467877833,@jemcam well i have uni stuff and netball  but after netbal if i've done uni stuff we can,3 stars,0.2574669122695923,@jemcam well i have uni stuff and netball  but after netbal if i've done uni stuff we canGot our yearbooks! ,1 star,0.4708283245563507,@jemcam well i have uni stuff and netball  but after netbal if i've done uni stuff we canGot our yearbooks! some1 hacked my account on aim  now i have to make a new one
261,n,0.394746333360672,1467877865,@kissability Me too I is poor ,1 star,0.34494611620903015,@kissability Me too I is poor is on his way to mobile with jonney and taylor ,1 star,0.44614166021347046,@kissability Me too I is poor is on his way to mobile with jonney and taylor @jpwrye41 no it isnt..embrace it 
262,n,0.606940746307373,1467878057,help me forget 8th april &amp; 13th july! ,1 star,0.4009588956832886,help me forget 8th april &amp; 13th july! Ghost Rider on Cinemax  http://plurk.com/p/yovwx,1 star,0.42109423875808716,help me forget 8th april &amp; 13th july! Ghost Rider on Cinemax  http://plurk.com/p/yovwx@mathewsmichael  i agree... the jobros dont update theres very often 
263,n,0.6338248252868652,1467878557,"dierks bentley is comin' to columbus, OH!! i wanna go so bad ",1 star,0.6354044079780579,"dierks bentley is comin' to columbus, OH!! i wanna go so bad @localtweeps Wow, tons of replies from you, may have to unfollow so I can see my friends' tweets, you're scrolling the feed a lot. ",1 star,0.6754142642021179,"dierks bentley is comin' to columbus, OH!! i wanna go so bad @localtweeps Wow, tons of replies from you, may have to unfollow so I can see my friends' tweets, you're scrolling the feed a lot. @ZRHERO Heyy im fyne tah wt out u "
264,n,0.3332662880420685,1467878633,i have to take my sidekick back. ,5 stars,0.60342937707901,"i have to take my sidekick back. @catmagellan @fjfonseca you're most welcome!  Iâ€™ve been away, but now Iâ€™m back in business!",5 stars,0.4160589873790741,"i have to take my sidekick back. @catmagellan @fjfonseca you're most welcome!  Iâ€™ve been away, but now Iâ€™m back in business!@BFAS I finally ordered two bracelets. Yay! "
265,n,0.7241385579109192,1467878929,@chriscantore congrats! I'm totally jealous! only wish my XM was working ,1 star,0.5275918245315552,@chriscantore congrats! I'm totally jealous! only wish my XM was working @LettyA ahh ive always wanted to see rent  love the soundtrack!!,1 star,0.7327567338943481,"@chriscantore congrats! I'm totally jealous! only wish my XM was working @LettyA ahh ive always wanted to see rent  love the soundtrack!!Home from Franklin street, I almost jumped over a fire. Someone kicked it before I could.  Jenny lost her shoe."
266,n,0.4319881796836853,1467878971,gr8t my face is very itchy ,2 stars,0.30337414145469666,gr8t my face is very itchy smile child! ,1 star,0.3781734108924866,gr8t my face is very itchy smile child! @nicolerichie OH MY YES!! i miss 
267,n,0.6133598685264587,1467878983,poor socks  luvvvvv the golden retriever!! I want one sighhhh,1 star,0.43106943368911743,poor socks  luvvvvv the golden retriever!! I want one sighhhhAnother very very busy day at the salon! Mixin up color! ,1 star,0.4748818874359131,poor socks  luvvvvv the golden retriever!! I want one sighhhhAnother very very busy day at the salon! Mixin up color! @cocomix04 ill tell ya the story later  not a good day and ill be workin for like three more hours...
268,n,0.8235065340995789,1467879203,I just saw that they found that Tracy girl in a piece of luggage... How fucking terrible ,1 star,0.7476822733879089,I just saw that they found that Tracy girl in a piece of luggage... How fucking terrible @selenagomez hey thanks for adding me on bebo ,1 star,0.8370575308799744,I just saw that they found that Tracy girl in a piece of luggage... How fucking terrible @selenagomez hey thanks for adding me on bebo @TickleMeJoey please shout out to @MarianneSays plzzz 
269,n,0.5240871906280518,1467879314,Aaaaand the nausea is back. ,1 star,0.5538235306739807,Aaaaand the nausea is back. Another city another awards show - off to the Step Up Inspiration Awards. Can't wait to retire my Spanx at the end of the week! ,1 star,0.5948960781097412,Aaaaand the nausea is back. Another city another awards show - off to the Step Up Inspiration Awards. Can't wait to retire my Spanx at the end of the week! @corrosivecandy Ive forgotten how to snoo-snoo  I wonder if snoo-snoo and I will ever meet again...
270,n,0.572441041469574,1467879328,@DonnieWahlberg ooh Iï¿½m excited and not even going 2 be there  long love YOUTUBE!,5 stars,0.4108522832393646,"@DonnieWahlberg ooh Iï¿½m excited and not even going 2 be there  long love YOUTUBE!surprisingly productive day, despite staying up til 4.30 watching the Lakers demolish Orlando ",1 star,0.41969406604766846,"@DonnieWahlberg ooh Iï¿½m excited and not even going 2 be there  long love YOUTUBE!surprisingly productive day, despite staying up til 4.30 watching the Lakers demolish Orlando @onemoreproject that is lame "
271,n,0.2942158877849579,1467879480,spent 1 hour to reach to Axis bank only to find out today is holiday for Mahavir Jayanti  contd..,5 stars,0.28100651502609253,"spent 1 hour to reach to Axis bank only to find out today is holiday for Mahavir Jayanti  contd..Man, that took forever. ",1 star,0.40995222330093384,"spent 1 hour to reach to Axis bank only to find out today is holiday for Mahavir Jayanti  contd..Man, that took forever. Going to sleep. Hoping tomorrow is a better day. "
272,n,0.28106075525283813,1467879984,@mathewsmichael  i agree... the jobros dont update theres very often ,1 star,0.2727488577365875,@mathewsmichael  i agree... the jobros dont update theres very often watching &quot;House&quot; ,2 stars,0.3835480213165283,@mathewsmichael  i agree... the jobros dont update theres very often watching &quot;House&quot; Getting eyebrows waxed. More pain 
273,m,0.27078360319137573,1467880085,@fishmouse it is hilarious and I linked the clip from LJ some time ago but when I went back just now it was a dead link ,1 star,0.26942044496536255,@fishmouse it is hilarious and I linked the clip from LJ some time ago but when I went back just now it was a dead link @screamo_ranger Thank you thank you thank you ,1 star,0.36850976943969727,@fishmouse it is hilarious and I linked the clip from LJ some time ago but when I went back just now it was a dead link @screamo_ranger Thank you thank you thank you  Body Of Missing Northern Calif. Girl Found: Police have found the remains of a missing Northern California girl .. http://tr.im/imji
274,n,0.3287522494792938,1467880431,@DiannePulham OOOOOOOO who with? (im not neither but thats because i need to study  ),3 stars,0.2988753914833069,@DiannePulham OOOOOOOO who with? (im not neither but thats because i need to study  )@HeartMileyCyrus of course  followed,2 stars,0.3666526973247528,@DiannePulham OOOOOOOO who with? (im not neither but thats because i need to study  )@HeartMileyCyrus of course  followedI feel bad for doing it 
275,p,0.45872560143470764,1467880442,"Haven't tweeted nearly all day  Posted my website tonight, hopefully that goes well  Night time!",5 stars,0.31672927737236023,"Haven't tweeted nearly all day  Posted my website tonight, hopefully that goes well  Night time!@glamorousjo Congrats Team Illingworth! Welcome to Nashville, Harry! Probably already thinking about doing this whole thing again, huh? ",3 stars,0.24824507534503937,"Haven't tweeted nearly all day  Posted my website tonight, hopefully that goes well  Night time!@glamorousjo Congrats Team Illingworth! Welcome to Nashville, Harry! Probably already thinking about doing this whole thing again, huh? feeling lost, naked and confused (JK, sort of).....no iphone for me. "
276,p,0.2631324231624603,1467880463,@bostongarden I miss bentley ,5 stars,0.6074548959732056,@bostongarden I miss bentley @crazylovegirl Hope you have a WONDERFUL weekend!  ,3 stars,0.4753513038158417,"@bostongarden I miss bentley @crazylovegirl Hope you have a WONDERFUL weekend!  @robcthegeek Once upon a time Hundred Islands was the pride of Philippine tourism, but coral/clam/rare fish poaching did it in. Kinda sad "
277,n,0.35753849148750305,1467880692,seriously needs to finish these job applications ,2 stars,0.3501010239124298,seriously needs to finish these job applications is in love with scrappy and is missin him already ,2 stars,0.48879358172416687,"seriously needs to finish these job applications is in love with scrappy and is missin him already @pvaras That's why we get along, we both have a very warped sense of humor and self.  "
278,p,0.2614051103591919,1467881131,"My son Vincas is sick, so I stay at home  Just three tense days at work, and I am back on holiday with kids",5 stars,0.456077516078949,"My son Vincas is sick, so I stay at home  Just three tense days at work, and I am back on holiday with kidsMy Pookie has a UTI.  I have to be Nurse Gabbie and get him back to 100%!!! No more sodas!!!!!!!!!!!!!!",1 star,0.6415231823921204,"My son Vincas is sick, so I stay at home  Just three tense days at work, and I am back on holiday with kidsMy Pookie has a UTI.  I have to be Nurse Gabbie and get him back to 100%!!! No more sodas!!!!!!!!!!!!!!ugh. cant sleep. its 1:30am. "
279,n,0.37918534874916077,1467881373,Whinging. My client&amp;boss don't understand English well. Rewrote some text unreadable. It's written by v. good writer&amp;reviewed correctly. ,1 star,0.4441595673561096,Whinging. My client&amp;boss don't understand English well. Rewrote some text unreadable. It's written by v. good writer&amp;reviewed correctly. @_CrC_ damn whats up with all of the rain! no worries by the time y'all make it to HOUSTON it will be hot as hell. lets DO this ,1 star,0.5661348700523376,Whinging. My client&amp;boss don't understand English well. Rewrote some text unreadable. It's written by v. good writer&amp;reviewed correctly. @_CrC_ damn whats up with all of the rain! no worries by the time y'all make it to HOUSTON it will be hot as hell. lets DO this Aaaaand the nausea is back. 
280,n,0.5070522427558899,1467881376,@huntermoore I don't want him to ever punch me.  ,1 star,0.31858810782432556,@huntermoore I don't want him to ever punch me.  homework.... ,1 star,0.4790040850639343,@huntermoore I don't want him to ever punch me.  homework.... goodnight guys haha.my last tweet for this day 
281,n,0.32110339403152466,1467881457,sooo sick of the snow  ughh,1 star,0.25003623962402344,sooo sick of the snow  ughhHeading to Atl for the weekend ,1 star,0.5221699476242065,sooo sick of the snow  ughhHeading to Atl for the weekend RIP Sandra....its so sad    how can someone do something like that??
282,p,0.3550521433353424,1467881474,@ITS_NEMESIS ------- ,5 stars,0.3147110342979431,@ITS_NEMESIS ------- Greetings from the piano bench  (photo) http://twitpic.com/6oe8i,1 star,0.6160224080085754,@ITS_NEMESIS ------- Greetings from the piano bench  (photo) http://twitpic.com/6oe8i@chriscantore congrats! I'm totally jealous! only wish my XM was working 
