,original_label,score_x,twitter_id,Comments_x,MR1_label,score_y,Comments_y,MR2_label,score,Comments
462,m,0.4948611557483673,1467929601,@corrosivecandy Ive forgotten how to snoo-snoo  I wonder if snoo-snoo and I will ever meet again...,NEU,0.829971969127655,@corrosivecandy Ive forgotten how to snoo-snoo  I wonder if snoo-snoo and I will ever meet again...@BFHeroes hope its done soon ,NEG,0.8956080675125122,@corrosivecandy Ive forgotten how to snoo-snoo  I wonder if snoo-snoo and I will ever meet again...@BFHeroes hope its done soon ok I'm sick and spent an hour sitting in the shower cause I was too sick to stand and held back the puke like a champ. BED now 
463,n,0.9398264288902283,1467929809,@AmaNorris wow that last tweet made me seem like a giant sexist...sorry about that ,POS,0.6214133501052856,@AmaNorris wow that last tweet made me seem like a giant sexist...sorry about that @devvvv_  thanks. feel better!!!!!!!!!!!!!!!!!!!!!!!!!!!!!!!!!!!!!!!,NEG,0.9738948345184326,@AmaNorris wow that last tweet made me seem like a giant sexist...sorry about that @devvvv_  thanks. feel better!!!!!!!!!!!!!!!!!!!!!!!!!!!!!!!!!!!!!!!@Sofii_Noel thats bad 
464,n,0.9837055206298828,1467929915,"My bathtub drain is fired: it haz 1 job 2 do, &amp; it iz FAIL. I got all Drano on its ass, &amp; iz STILL NOT DRAINING. I wanna shower, dangit!! ",NEG,0.9689422845840454,"My bathtub drain is fired: it haz 1 job 2 do, &amp; it iz FAIL. I got all Drano on its ass, &amp; iz STILL NOT DRAINING. I wanna shower, dangit!! Congrats to atlassian (http://www.atlassian.com/), finally the free beer for Java Posse payed off ",NEG,0.9794133901596069,"My bathtub drain is fired: it haz 1 job 2 do, &amp; it iz FAIL. I got all Drano on its ass, &amp; iz STILL NOT DRAINING. I wanna shower, dangit!! Congrats to atlassian (http://www.atlassian.com/), finally the free beer for Java Posse payed off @caregiving I couldn't bear to watch it.  And I thought the UA loss was embarrassing . . . . ."
465,n,0.9304525852203369,1467930017,stuck at home ,NEU,0.5761275291442871,stuck at home @williechan in KL at a foam party watching the craziness  u done with work and having some fun with ur Friday?,NEG,0.6320071220397949,stuck at home @williechan in KL at a foam party watching the craziness  u done with work and having some fun with ur Friday?@B_Barnett I did not really see that coming 
466,m,0.9383665919303894,1467930083,@nomadicmatt mine is 1/10  how do you get it up?,POS,0.9451355338096619,@nomadicmatt mine is 1/10  how do you get it up?@billy_norris Enjoy the view! Do you have any more pics to share with us? ,POS,0.7845363020896912,@nomadicmatt mine is 1/10  how do you get it up?@billy_norris Enjoy the view! Do you have any more pics to share with us? is tireddddddd. want to sleep but i have an assignment to finish and an exam tomorrow to study for 
467,n,0.8824302554130554,1467930157,Duckling in famous children's book stolen from Boston's Public Garden - The Boston Globe http://tinyurl.com/dc2htx via @ShareThis OH NO!! ,NEU,0.5293787121772766,Duckling in famous children's book stolen from Boston's Public Garden - The Boston Globe http://tinyurl.com/dc2htx via @ShareThis OH NO!! @BFAS I finally ordered two bracelets. Yay! ,NEG,0.9671909809112549,Duckling in famous children's book stolen from Boston's Public Garden - The Boston Globe http://tinyurl.com/dc2htx via @ShareThis OH NO!! @BFAS I finally ordered two bracelets. Yay! i hate to see the spartans so sad 
468,p,0.6544352769851685,1467930220,"@Appomattox_News Thank you! However, I hate to be on the same list that includes 2 convicts.  ",POS,0.5491489768028259,"@Appomattox_News Thank you! However, I hate to be on the same list that includes 2 convicts.  im looking forward to the new season of the hills  i've always hated kristin ",NEU,0.6119281053543091,"@Appomattox_News Thank you! However, I hate to be on the same list that includes 2 convicts.  im looking forward to the new season of the hills  i've always hated kristin feeling lost, naked and confused (JK, sort of).....no iphone for me. "
469,m,0.8579649329185486,1467930309,"Heading to Altrincham, again! Out of hours install ",POS,0.828027606010437,"Heading to Altrincham, again! Out of hours install Tooth Fairy 4got to leave $ 4 Carson. So Palmer said &quot;Mom U gotta open the window so the tooth fairy can get in for Carson&quot; he's so smart ",NEU,0.8142625689506531,"Heading to Altrincham, again! Out of hours install Tooth Fairy 4got to leave $ 4 Carson. So Palmer said &quot;Mom U gotta open the window so the tooth fairy can get in for Carson&quot; he's so smart I'm really cold. I don't want to go to sleep yet but there's nothing to do "
470,n,0.982451856136322,1467930341,MORNING!!! Good im bloody knackered!!! Work is not for me today  HELPPP!!!! xxx,NEG,0.9736015200614929,MORNING!!! Good im bloody knackered!!! Work is not for me today  HELPPP!!!! xxx@thecoolestout Ha the sun's already gone ,NEG,0.9832822680473328,MORNING!!! Good im bloody knackered!!! Work is not for me today  HELPPP!!!! xxx@thecoolestout Ha the sun's already gone monkeys??? i just found out you my twin and you wont even write back.  i'm heartbroken
471,m,0.5119268298149109,1467930699,@jeffreecuntstar  I don't have a garage.  But you can park in my driveway!,POS,0.6581685543060303,"@jeffreecuntstar  I don't have a garage.  But you can park in my driveway!@MySteezRadio I'm goin' to follow u, since u didn't  LOL  GO ANGELS!",NEU,0.5168147683143616,"@jeffreecuntstar  I don't have a garage.  But you can park in my driveway!@MySteezRadio I'm goin' to follow u, since u didn't  LOL  GO ANGELS!Think I'm going to bed. Goodniight. I hate this "
472,m,0.9804027080535889,1467931027,@lauredhel  What happened?,POS,0.966116726398468,@lauredhel  What happened?I'm in love with this little blue bird ,NEG,0.9217878580093384,@lauredhel  What happened?I'm in love with this little blue bird monkeys??? i just found out you my twin and you wont even write back.  i'm heartbroken
473,n,0.58375483751297,1467931070,"&quot;On popular music&quot; by T.W.Adorno is probably the most difficult reading ever prescribed, I'm actually struggling to continue ",NEU,0.763471782207489,"&quot;On popular music&quot; by T.W.Adorno is probably the most difficult reading ever prescribed, I'm actually struggling to continue @azelmer yes please.. I get to go. Boss lady said so!! ",NEG,0.9453848004341125,"&quot;On popular music&quot; by T.W.Adorno is probably the most difficult reading ever prescribed, I'm actually struggling to continue @azelmer yes please.. I get to go. Boss lady said so!! couldn't get shit done today ~ i'm so screwed "
474,m,0.869933545589447,1467931396,"http://twitpic.com/2y36e - cant see the flowers falling  i dont have a camera, just my cellphone",POS,0.9524884819984436,"http://twitpic.com/2y36e - cant see the flowers falling  i dont have a camera, just my cellphoneor several books with partial of Bella and Edwards perspective could be REALLY cool  Just like with Jacob in Breaking Dawn  ",POS,0.4998186230659485,"http://twitpic.com/2y36e - cant see the flowers falling  i dont have a camera, just my cellphoneor several books with partial of Bella and Edwards perspective could be REALLY cool  Just like with Jacob in Breaking Dawn  I am listing more items on ebay to sell!  Takes forever..meanwhile Coleman is watching The Hills season premier without me.. "
475,m,0.6348179578781128,1467931501,"We've been good. I'm not liking the snow right now, was getting used to the nice Spring-like weather.  How about you?",POS,0.9438567161560059,"We've been good. I'm not liking the snow right now, was getting used to the nice Spring-like weather.  How about you?getting called a FF fox...a sign of bright and shiny things to come today?  Sweet!  Thanks @bobwarren for the #FF mention  ",NEG,0.47123420238494873,"We've been good. I'm not liking the snow right now, was getting used to the nice Spring-like weather.  How about you?getting called a FF fox...a sign of bright and shiny things to come today?  Sweet!  Thanks @bobwarren for the #FF mention  MORNING!!! Good im bloody knackered!!! Work is not for me today  HELPPP!!!! xxx"
476,n,0.9725180268287659,1467931736,@brian_armstrong What a pity YouTube is currently blocked in China.  I can't see the vids. ,NEG,0.9544404745101929,@brian_armstrong What a pity YouTube is currently blocked in China.  I can't see the vids. Afternoon. It appears I'm back in the land of the living  yaaaaaay.,NEG,0.9234839677810669,@brian_armstrong What a pity YouTube is currently blocked in China.  I can't see the vids. Afternoon. It appears I'm back in the land of the living  yaaaaaay.My Mum says that I use TOO MUCH toothpaste. Maybe cos it's mint? 
477,p,0.7475693225860596,1467931839,@margaretcho what happened to your show it was the hightlight of my life ,POS,0.9803324937820435,"@margaretcho what happened to your show it was the hightlight of my life 2 days left then off to Houston for a couple weeks for my internship, got to make this weekend a good one ",POS,0.9369850754737854,"@margaretcho what happened to your show it was the hightlight of my life 2 days left then off to Houston for a couple weeks for my internship, got to make this weekend a good one Lol!  i guess your reading material is like my business law class from last summer-snooze material"
478,p,0.9919954538345337,1467931983,This is the best leather sofa in the world!  It's in the office though which means I'm still here working ,POS,0.9926020503044128,This is the best leather sofa in the world!  It's in the office though which means I'm still here working @exhilarating take care. should be cheerful coz you're the lucky one. ,POS,0.8328560590744019,This is the best leather sofa in the world!  It's in the office though which means I'm still here working @exhilarating take care. should be cheerful coz you're the lucky one. Opps.. As I said.. I still got one day remain and now problem come 
479,n,0.8293570876121521,1467932117,Still 3 more days until my Internet gets uncapped ,POS,0.6626264452934265,"Still 3 more days until my Internet gets uncapped In sunny Sunderland for a wedding. Out tonight, England match tomorrow and wedding itself Sunday. Wedding in haunted house ",NEG,0.864901065826416,"Still 3 more days until my Internet gets uncapped In sunny Sunderland for a wedding. Out tonight, England match tomorrow and wedding itself Sunday. Wedding in haunted house @carolrainbow no Internet at home, have to drive into Ox to use Internet because of builders! "
480,n,0.5459321141242981,1467932208,"If he doesn't get better in a few days, he could have something lodged in his belly ",NEU,0.8616494536399841,"If he doesn't get better in a few days, he could have something lodged in his belly is looking forward to the weekend ahead ",NEU,0.830463171005249,"If he doesn't get better in a few days, he could have something lodged in his belly is looking forward to the weekend ahead Is terrified she accidentally deleted a reference in her management assignment and hopes she doesnt get in trouble when she gets back "
481,p,0.992431640625,1467932372,i Love my atekinzz so much. &amp;&amp; i soo miss her.. ,POS,0.9919024109840393,i Love my atekinzz so much. &amp;&amp; i soo miss her.. i'm goin down to d members-only private lounge now to surf d webbie. heard bfast wud be awesome tmr. i &lt;3 their croissants n lil kebabs ,POS,0.9916073083877563,"i Love my atekinzz so much. &amp;&amp; i soo miss her.. i'm goin down to d members-only private lounge now to surf d webbie. heard bfast wud be awesome tmr. i &lt;3 their croissants n lil kebabs Mraow, I feel like dancing, but first art school wants to rape me some more. "
482,m,0.5253554582595825,1467932549,I wanna sneak into the zoo and play with the kitties ,POS,0.9871138334274292,"I wanna sneak into the zoo and play with the kitties @mememolly Yay! I got it yesterday, so much fun. ",NEG,0.90806645154953,"I wanna sneak into the zoo and play with the kitties @mememolly Yay! I got it yesterday, so much fun. @RyanSeacrest is it just me, or she hates anoop. i mean seriously, she's kinda mean to him. "
483,n,0.549317479133606,1467932979,@lolitariot oh no  hope you're not getting sick too!,POS,0.7604662775993347,"@lolitariot oh no  hope you're not getting sick too!@AgentMarcus nicht nur weekend, holiday!! ",NEG,0.49961280822753906,"@lolitariot oh no  hope you're not getting sick too!@AgentMarcus nicht nur weekend, holiday!! @naomicullen naominaominaominaominaomi!!! duudde did you watch the live chat last night?!?!? i did  and WHY ARENT YOU ONLINE WHEN I AM?!?"
484,m,0.8068386912345886,1467933048,@alejandralei i dont think i can cause its my cousins birthday party ,POS,0.8722900748252869,@alejandralei i dont think i can cause its my cousins birthday party @BFAS I finally ordered two bracelets. Yay! ,NEG,0.8477181196212769,"@alejandralei i dont think i can cause its my cousins birthday party @BFAS I finally ordered two bracelets. Yay! STOU site not update, no info about 2/2552 exam, and open course, I must wait for mail notices and doc. um... "
485,p,0.5106524229049683,1467933102,"Our sweet little man just fell asleep while waiting up for daddy and big brother to get home!  Poor baby, he missed them so much today!",POS,0.960048496723175,"Our sweet little man just fell asleep while waiting up for daddy and big brother to get home!  Poor baby, he missed them so much today!Yay Friday! Pedi &amp; wine tasting with CJ ",POS,0.9580391645431519,"Our sweet little man just fell asleep while waiting up for daddy and big brother to get home!  Poor baby, he missed them so much today!Yay Friday! Pedi &amp; wine tasting with CJ @ellievolia If oooonly we were really so lucky, eh? And awh  Definitely too early for work."
486,m,0.7088717818260193,1467933112,the angel is going to miss the athlete this weekend ,POS,0.9813467264175415,the angel is going to miss the athlete this weekend 6 years and counting today!  time really DOES fly when you're having fun.  yabyu! @cates,POS,0.9622611999511719,the angel is going to miss the athlete this weekend 6 years and counting today!  time really DOES fly when you're having fun.  yabyu! @catesugh. cant sleep. its 1:30am. 
487,n,0.7598981857299805,1467933295,trust is hard ,POS,0.9273605942726135,trust is hard @mayerskibb44 lol you bettterrr  i love how were quoting our best friends songs lol,NEG,0.8549129962921143,"trust is hard @mayerskibb44 lol you bettterrr  i love how were quoting our best friends songs lolYep he's eating it !!! The dirty bastard ,,, right gotta look busy 4 the last 45 mins !!! Later y'all in out this bitch  lovin ya work"
488,m,0.9450883269309998,1467933494,have watched that considering today. yaknow. shawnna tomomorrow;i need my bestfriend ,POS,0.7739185690879822,"have watched that considering today. yaknow. shawnna tomomorrow;i need my bestfriend @alicayaba so cuuute! hey, i miss you na!  its not the same not seeing you girls everyday ",POS,0.6677778959274292,"have watched that considering today. yaknow. shawnna tomomorrow;i need my bestfriend @alicayaba so cuuute! hey, i miss you na!  its not the same not seeing you girls everyday @jodiesays you still smell "
489,n,0.5591012239456177,1467933623,Grr i want to keep reading but if i do i wont have anything left to read ,POS,0.9332847595214844,"Grr i want to keep reading but if i do i wont have anything left to read Celebrating National Donut day with sweet creative thinking    Ahhhh, sugar high helps marketing ideas! Is there a national chocolate day?",NEU,0.4934476912021637,"Grr i want to keep reading but if i do i wont have anything left to read Celebrating National Donut day with sweet creative thinking    Ahhhh, sugar high helps marketing ideas! Is there a national chocolate day?I'm sweating my forthcoming trip to E3.  If I can't find someone to crash with while I'm out there, I may be screwed.  "
490,n,0.867861807346344,1467933662,"atekinzz, where in the world are you?? ",POS,0.9852352142333984,"atekinzz, where in the world are you?? 6 years and counting today!  time really DOES fly when you're having fun.  yabyu! @cates",POS,0.8548845648765564,"atekinzz, where in the world are you?? 6 years and counting today!  time really DOES fly when you're having fun.  yabyu! @catesNo phantasy star yesterday  going to work..."
491,n,0.845142662525177,1467933685,@RumLover No! u supposed to be my date ,POS,0.9923244714736938,@RumLover No! u supposed to be my date @TinkerBell_makp i loveeee your look you did!!!  it loooks awesome! you are amazing,POS,0.9762929677963257,@RumLover No! u supposed to be my date @TinkerBell_makp i loveeee your look you did!!!  it loooks awesome! you are amazingok I'm sick and spent an hour sitting in the shower cause I was too sick to stand and held back the puke like a champ. BED now 
492,p,0.944589376449585,1467934004,"pears &amp; Brie, bottle of Cabernet, and &quot;Win a Date With Tad Hamilton&quot;... oh gawwd my life flashed forward to when I'm 40 with my 75 cats ",POS,0.9688864350318909,"pears &amp; Brie, bottle of Cabernet, and &quot;Win a Date With Tad Hamilton&quot;... oh gawwd my life flashed forward to when I'm 40 with my 75 cats @cococourtney i was just listening to the sweets for the first time in forever! i miss them so much  can we go to chi town for visits plz?",POS,0.394305557012558,"pears &amp; Brie, bottle of Cabernet, and &quot;Win a Date With Tad Hamilton&quot;... oh gawwd my life flashed forward to when I'm 40 with my 75 cats @cococourtney i was just listening to the sweets for the first time in forever! i miss them so much  can we go to chi town for visits plz?@infinitydefines  omgawd i couldnt handle my cat being in heat all the time D: D:"
493,n,0.9605934619903564,1467934184,Crap. I need more dresses too. ,NEU,0.5855301022529602,Crap. I need more dresses too. @supersport I miss my buddy  ill be in NY on the 25th,NEG,0.8244904279708862,"Crap. I need more dresses too. @supersport I miss my buddy  ill be in NY on the 25th@benackerman BTW my iPhone is acting funny, dying quickly and freezing and BS.  I'm not admitting anything, just sayin "
494,n,0.9829676747322083,1467934481,@kaeeeep yeah! i know! it was horrible!!!! ugh. saddening. ,POS,0.6864734292030334,"@kaeeeep yeah! i know! it was horrible!!!! ugh. saddening. Good Morning San Francisco: http://twitpic.com/6od4z (view from my room), ok, it ain't great...but it's SF...so I am happy ",NEG,0.9720792174339294,"@kaeeeep yeah! i know! it was horrible!!!! ugh. saddening. Good Morning San Francisco: http://twitpic.com/6od4z (view from my room), ok, it ain't great...but it's SF...so I am happy walking home from school drains all my energy "
495,n,0.9752101898193359,1467934606,@Brodhe geez ur no fun are you ,NEU,0.6442241072654724,@Brodhe geez ur no fun are you sonny with a chance is so funny! ,NEG,0.8583050966262817,@Brodhe geez ur no fun are you sonny with a chance is so funny! @fleurylis I don't either. Its depressing. I don't think I even want to know about the kids in suitcases. 
496,m,0.5405251979827881,1467935121,I wanna be in a punk rock band again ,POS,0.9560323357582092,"I wanna be in a punk rock band again pears &amp; Brie, bottle of Cabernet, and &quot;Win a Date With Tad Hamilton&quot;... oh gawwd my life flashed forward to when I'm 40 with my 75 cats ",NEU,0.579843282699585,"I wanna be in a punk rock band again pears &amp; Brie, bottle of Cabernet, and &quot;Win a Date With Tad Hamilton&quot;... oh gawwd my life flashed forward to when I'm 40 with my 75 cats haha jills a sleep i have taken over her computer... next her room haha.. WAKE UP JILLY.... before ur room is all messed up... even more "
497,m,0.8503502011299133,1467935189,@jyesmith That's a lot of angst for a Tuesday afternoon ,NEU,0.8867512941360474,@jyesmith That's a lot of angst for a Tuesday afternoon @_shabbychica Thanks! ,NEG,0.7530048489570618,@jyesmith That's a lot of angst for a Tuesday afternoon @_shabbychica Thanks! some1 hacked my account on aim  now i have to make a new one
498,p,0.8112925291061401,1467935271,I'm very glad Britney isn't crazy anymore! That was one hell of a show! Now I'm sad that it's over.  Next up...AP at Cook County!,POS,0.9740541577339172,I'm very glad Britney isn't crazy anymore! That was one hell of a show! Now I'm sad that it's over.  Next up...AP at Cook County!lakers won! and the crowd gets free tacos lol ,POS,0.8477598428726196,I'm very glad Britney isn't crazy anymore! That was one hell of a show! Now I'm sad that it's over.  Next up...AP at Cook County!lakers won! and the crowd gets free tacos lol would rather the first party send bad messages than the 3rd party send mixed ones  Sophmore year all over again?
499,n,0.9832453727722168,1467935345,has a huuuge headache! omg I feel like crap! ,POS,0.623481035232544,has a huuuge headache! omg I feel like crap! or several books with partial of Bella and Edwards perspective could be REALLY cool  Just like with Jacob in Breaking Dawn  ,NEU,0.8267136216163635,has a huuuge headache! omg I feel like crap! or several books with partial of Bella and Edwards perspective could be REALLY cool  Just like with Jacob in Breaking Dawn  would rather the first party send bad messages than the 3rd party send mixed ones  Sophmore year all over again?
500,n,0.8190209269523621,1467936498,@Anistorm Sorry ,NEU,0.8158361315727234,"@Anistorm Sorry @dianerchen I know! Thankfully maintenance is scheduled for 8PM Pacific, so we will just make it!  #20BoySummer",NEG,0.6369985938072205,"@Anistorm Sorry @dianerchen I know! Thankfully maintenance is scheduled for 8PM Pacific, so we will just make it!  #20BoySummer@huntermoore I don't want him to ever punch me.  "
501,n,0.9769831895828247,1467936541,@cleders sorry...i was rooting for them too... ,NEU,0.5089590549468994,@cleders sorry...i was rooting for them too... @hochmann LOL!  I need to laugh...thank you.,NEU,0.6411737203598022,"@cleders sorry...i was rooting for them too... @hochmann LOL!  I need to laugh...thank you.@ninetease lol im mad slow. work got me nuts, just saw ur txt. we need to get our list together next week for the apartment essentials "
502,n,0.9595679044723511,1467936901,"Man, that took forever. ",POS,0.7792735695838928,"Man, that took forever. @tommcfly carrie posted that early, they make me laugh because they look like posh boys from all boys school, good job though! ",NEU,0.5007932186126709,"Man, that took forever. @tommcfly carrie posted that early, they make me laugh because they look like posh boys from all boys school, good job though! I'm really cold. I don't want to go to sleep yet but there's nothing to do "
503,m,0.972290575504303,1467937038,@shandasaurus  I see.,POS,0.9839593768119812,@shandasaurus  I see.@terrencej106 wassup papa we miss u!!! Glad 2 have u back! ,POS,0.9757995009422302,@shandasaurus  I see.@terrencej106 wassup papa we miss u!!! Glad 2 have u back! Car show season has started without me 
504,n,0.5731090903282166,1467937128,I am listing more items on ebay to sell!  Takes forever..meanwhile Coleman is watching The Hills season premier without me.. ,NEU,0.8022924661636353,I am listing more items on ebay to sell!  Takes forever..meanwhile Coleman is watching The Hills season premier without me.. There's a World Naked Bike Ride Day even! We should make all awareness days official holidays. I am for everything that promotes goodwill ,NEU,0.8319538235664368,I am listing more items on ebay to sell!  Takes forever..meanwhile Coleman is watching The Hills season premier without me.. There's a World Naked Bike Ride Day even! We should make all awareness days official holidays. I am for everything that promotes goodwill My thoughts are with Sandra Cantu's family at this difficult and sad time 
505,n,0.9508343935012817,1467937189,"Just got my presentation done, 23 slides done...  I'm crying for this week will be the hardest of all weeks.",NEG,0.5523566603660583,"Just got my presentation done, 23 slides done...  I'm crying for this week will be the hardest of all weeks.@stephenofficial hvent see you twit for a while.must b having busy day uh? do take care,and hv a lovely friday ",NEG,0.642528235912323,"Just got my presentation done, 23 slides done...  I'm crying for this week will be the hardest of all weeks.@stephenofficial hvent see you twit for a while.must b having busy day uh? do take care,and hv a lovely friday I feel bad for doing it "
506,n,0.9826377034187317,2044289668,"@AuthenticStyle The problem with tumbleweeds is that they never sit and chat a spellthey're always moving on. Like some people, sadly. ",NEG,0.8587955236434937,"@AuthenticStyle The problem with tumbleweeds is that they never sit and chat a spellthey're always moving on. Like some people, sadly. @robluketic  love the french. I tell people here in the south i'm qtr. french and they snarl at me.  french are beautiful people",NEG,0.9157053232192993,"@AuthenticStyle The problem with tumbleweeds is that they never sit and chat a spellthey're always moving on. Like some people, sadly. @robluketic  love the french. I tell people here in the south i'm qtr. french and they snarl at me.  french are beautiful people@Knights_ No, no notice. They told me I'd be working tomorrow, and then I called the agency to follow up and they said it was over. "
507,m,0.9474813938140869,2044289678,@Stratos What you are seeing is how we work daily--which inevitably making us dependent on the method for *every* decision ,NEU,0.9582181572914124,@Stratos What you are seeing is how we work daily--which inevitably making us dependent on the method for *every* decision Relaxing ,NEG,0.9165403246879578,@Stratos What you are seeing is how we work daily--which inevitably making us dependent on the method for *every* decision Relaxing @imaginarypeach now your leaving me  .... -gets sad-
