,original_label,score_x,twitter_id,Comments_x,MR1_label,score_y,Comments_y,MR2_label,score,Comments
468,p,0.2871949374675751,1467930220,"@Appomattox_News Thank you! However, I hate to be on the same list that includes 2 convicts.  ",4 stars,0.2885991930961609,"@Appomattox_News Thank you! However, I hate to be on the same list that includes 2 convicts.  @mmj86 technological systems with basics of ecology - hope I translated it correctly ",1 star,0.3472072184085846,"@Appomattox_News Thank you! However, I hate to be on the same list that includes 2 convicts.  @mmj86 technological systems with basics of ecology - hope I translated it correctly @alielayus I want to go to promote GEAR AND GROOVE but unfornately no ride there  I may b going to the one in Anaheim in May though"
469,p,0.3683741092681885,1467930309,"Heading to Altrincham, again! Out of hours install ",5 stars,0.2888215184211731,"Heading to Altrincham, again! Out of hours install on the Other Side Of Town ",1 star,0.4752470850944519,"Heading to Altrincham, again! Out of hours install on the Other Side Of Town too worried and tired to post tonight "
470,n,0.6004676818847656,1467930341,MORNING!!! Good im bloody knackered!!! Work is not for me today  HELPPP!!!! xxx,1 star,0.5256230235099792,MORNING!!! Good im bloody knackered!!! Work is not for me today  HELPPP!!!! xxxCan't wait for sunday  gonna be so good,1 star,0.758147120475769,"MORNING!!! Good im bloody knackered!!! Work is not for me today  HELPPP!!!! xxxCan't wait for sunday  gonna be so good@januarycrimson Sorry, babe!!  My fam annoys me too. Thankfully, they're asleep right now. Muahaha. *evil laugh*"
471,p,0.4467807114124298,1467930699,@jeffreecuntstar  I don't have a garage.  But you can park in my driveway!,4 stars,0.3639451563358307,@jeffreecuntstar  I don't have a garage.  But you can park in my driveway!@ABenton  still waiting for the BW20 AD Network so I can join...,4 stars,0.3122100532054901,@jeffreecuntstar  I don't have a garage.  But you can park in my driveway!@ABenton  still waiting for the BW20 AD Network so I can join...Nasty budget due and my iphone is being sent to Apple today. 
472,n,0.4908701777458191,1467931027,@lauredhel  What happened?,1 star,0.5043621063232422,@lauredhel  What happened?@WestEndActress lol ,1 star,0.5417657494544983,@lauredhel  What happened?@WestEndActress lol @akalostangel At least you can talk about your problems. 
473,n,0.501449704170227,1467931070,"&quot;On popular music&quot; by T.W.Adorno is probably the most difficult reading ever prescribed, I'm actually struggling to continue ",1 star,0.4571022391319275,"&quot;On popular music&quot; by T.W.Adorno is probably the most difficult reading ever prescribed, I'm actually struggling to continue is working working working while monitoring PIZZA E BIRRA!!  Going Blowfish soon to see the CyberJapan Dancers from Japan.",1 star,0.5348888635635376,"&quot;On popular music&quot; by T.W.Adorno is probably the most difficult reading ever prescribed, I'm actually struggling to continue is working working working while monitoring PIZZA E BIRRA!!  Going Blowfish soon to see the CyberJapan Dancers from Japan.walking home from school drains all my energy "
474,n,0.3068118393421173,1467931396,"http://twitpic.com/2y36e - cant see the flowers falling  i dont have a camera, just my cellphone",1 star,0.4061740040779114,"http://twitpic.com/2y36e - cant see the flowers falling  i dont have a camera, just my cellphone@Poohpot lmao im sorry poohpot i ate it all! ",1 star,0.8343847990036011,"http://twitpic.com/2y36e - cant see the flowers falling  i dont have a camera, just my cellphone@Poohpot lmao im sorry poohpot i ate it all! I just saw that they found that Tracy girl in a piece of luggage... How fucking terrible "
475,m,0.4612514078617096,1467931501,"We've been good. I'm not liking the snow right now, was getting used to the nice Spring-like weather.  How about you?",3 stars,0.41370269656181335,"We've been good. I'm not liking the snow right now, was getting used to the nice Spring-like weather.  How about you?@HelpYouWell morning honey ",3 stars,0.4312950372695923,"We've been good. I'm not liking the snow right now, was getting used to the nice Spring-like weather.  How about you?@HelpYouWell morning honey I miss you twitter. My phone broke, now I'm using a stupid Nokia phone. Ughhh, I miss my advance phone. "
476,n,0.8470476865768433,1467931736,@brian_armstrong What a pity YouTube is currently blocked in China.  I can't see the vids. ,1 star,0.8876848220825195,@brian_armstrong What a pity YouTube is currently blocked in China.  I can't see the vids. Thank you for the #followfriday and back at ya!  @HJSWritergal @Fanny57 @frelle @crazyjohnkerecz @UrbanitySCMG @thekatalist,1 star,0.8410013914108276,@brian_armstrong What a pity YouTube is currently blocked in China.  I can't see the vids. Thank you for the #followfriday and back at ya!  @HJSWritergal @Fanny57 @frelle @crazyjohnkerecz @UrbanitySCMG @thekatalistI am listing more items on ebay to sell!  Takes forever..meanwhile Coleman is watching The Hills season premier without me.. 
477,p,0.6440895199775696,1467931839,@margaretcho what happened to your show it was the hightlight of my life ,5 stars,0.6104915142059326,"@margaretcho what happened to your show it was the hightlight of my life @JessicaKnows Thanks for recommending it, I'm off to check it out! ",5 stars,0.4647977352142334,"@margaretcho what happened to your show it was the hightlight of my life @JessicaKnows Thanks for recommending it, I'm off to check it out! blagh class at 8 tomorrow "
478,p,0.8869027495384216,1467931983,This is the best leather sofa in the world!  It's in the office though which means I'm still here working ,5 stars,0.8777814507484436,This is the best leather sofa in the world!  It's in the office though which means I'm still here working is @ school playing with photoshop ha ,5 stars,0.6548631191253662,This is the best leather sofa in the world!  It's in the office though which means I'm still here working is @ school playing with photoshop ha @GuruMN but this is canada  canada is weird. we're supposed to get snow through wednesday. ugh.
479,n,0.3476199209690094,1467932117,Still 3 more days until my Internet gets uncapped ,3 stars,0.3135122060775757,"Still 3 more days until my Internet gets uncapped 2 days left then off to Houston for a couple weeks for my internship, got to make this weekend a good one ",1 star,0.31793853640556335,"Still 3 more days until my Internet gets uncapped 2 days left then off to Houston for a couple weeks for my internship, got to make this weekend a good one @onlyaustin oh hayyyy! What have you been doing lately for &quot;work study&quot; since you don't have a job? Hahah "
480,m,0.47171011567115784,1467932208,"If he doesn't get better in a few days, he could have something lodged in his belly ",5 stars,0.528449535369873,"If he doesn't get better in a few days, he could have something lodged in his belly @ladyjai87 @JammieAdams happy birthday!! Hope u have a blessed one  ~Thank you lil momma its already blessed He woke me up this morning ~",5 stars,0.30608195066452026,"If he doesn't get better in a few days, he could have something lodged in his belly @ladyjai87 @JammieAdams happy birthday!! Hope u have a blessed one  ~Thank you lil momma its already blessed He woke me up this morning ~I don't understand... I really don't "
481,p,0.7007524967193604,1467932372,i Love my atekinzz so much. &amp;&amp; i soo miss her.. ,5 stars,0.7037208080291748,i Love my atekinzz so much. &amp;&amp; i soo miss her.. Time to install sims 3 ,5 stars,0.6785340309143066,i Love my atekinzz so much. &amp;&amp; i soo miss her.. Time to install sims 3 just got home from watching Michigan State get tromped!   
482,p,0.4153289496898651,1467932549,I wanna sneak into the zoo and play with the kitties ,5 stars,0.589975893497467,I wanna sneak into the zoo and play with the kitties @psyfe Sounds like a great solution strategy ,1 star,0.33738893270492554,I wanna sneak into the zoo and play with the kitties @psyfe Sounds like a great solution strategy @SarahReedSC treaty isn't defined 
483,p,0.41341137886047363,1467932979,@lolitariot oh no  hope you're not getting sick too!,5 stars,0.47763141989707947,@lolitariot oh no  hope you're not getting sick too!i love summer for a few reasons .. nice blue skies ... not alot of rain and wow the hot women .. wait i just love texas for that ,5 stars,0.28097590804100037,"@lolitariot oh no  hope you're not getting sick too!i love summer for a few reasons .. nice blue skies ... not alot of rain and wow the hot women .. wait i just love texas for that I swear no matter how long I've been getting up at 5am, it never gets any easier. Man my eyes hurts wah "
484,p,0.2619389295578003,1467933048,@alejandralei i dont think i can cause its my cousins birthday party ,5 stars,0.2767272889614105,"@alejandralei i dont think i can cause its my cousins birthday party is getting a shower, going to the doctors, picking up some groceries, then going to a concert! ",1 star,0.29998958110809326,"@alejandralei i dont think i can cause its my cousins birthday party is getting a shower, going to the doctors, picking up some groceries, then going to a concert! i have to take my sidekick back. "
485,n,0.5130634903907776,1467933102,"Our sweet little man just fell asleep while waiting up for daddy and big brother to get home!  Poor baby, he missed them so much today!",5 stars,0.690430223941803,"Our sweet little man just fell asleep while waiting up for daddy and big brother to get home!  Poor baby, he missed them so much today!THE PPL @ T-MOBiLE ARE ALWAYS SO NiCE &amp;&amp; THEY ALWAYS FiX ANY PROBLEMS PROMPTLY. ",5 stars,0.6278191804885864,"Our sweet little man just fell asleep while waiting up for daddy and big brother to get home!  Poor baby, he missed them so much today!THE PPL @ T-MOBiLE ARE ALWAYS SO NiCE &amp;&amp; THEY ALWAYS FiX ANY PROBLEMS PROMPTLY. Nasty budget due and my iphone is being sent to Apple today. "
486,m,0.23054592311382294,1467933112,the angel is going to miss the athlete this weekend ,5 stars,0.5686399936676025,the angel is going to miss the athlete this weekend @DonnieWahlberg Always following but don't think I'll make it from Scotland!!  Keep having a blast-I'm loving this ride xx,1 star,0.5395013093948364,the angel is going to miss the athlete this weekend @DonnieWahlberg Always following but don't think I'll make it from Scotland!!  Keep having a blast-I'm loving this ride xxwonders why someone that u like so much can make you so unhappy in a split seccond . depressed . 
487,n,0.23027563095092773,1467933295,trust is hard ,1 star,0.32592982053756714,trust is hard Just going to cry myself to sleep after watching Marley and Me.  ,1 star,0.5062268972396851,trust is hard Just going to cry myself to sleep after watching Marley and Me.  @nomadicmatt mine is 1/10  how do you get it up?
488,p,0.4783613085746765,1467933494,have watched that considering today. yaknow. shawnna tomomorrow;i need my bestfriend ,5 stars,0.5223047137260437,have watched that considering today. yaknow. shawnna tomomorrow;i need my bestfriend @_shabbychica Thanks! ,5 stars,0.28393828868865967,have watched that considering today. yaknow. shawnna tomomorrow;i need my bestfriend @_shabbychica Thanks! 10pm again tnite but holliberries booked. Can't wait 
489,m,0.3906029760837555,1467933623,Grr i want to keep reading but if i do i wont have anything left to read ,3 stars,0.3810608386993408,"Grr i want to keep reading but if i do i wont have anything left to read Today's gonna be a good day, cause I said it's gonna be a good day ",3 stars,0.30910176038742065,"Grr i want to keep reading but if i do i wont have anything left to read Today's gonna be a good day, cause I said it's gonna be a good day @uncbear08 UNC Blue is Pantone 288. UNC Gold is Pantone 122. UNC Gold Metallic is Pantone 873. UNC Gold Foil is Kurz 420. "
490,n,0.3025509715080261,1467933662,"atekinzz, where in the world are you?? ",5 stars,0.3046986758708954,"atekinzz, where in the world are you?? @MyConnecticut Restaurant called WoodNTap has competitive eating tourney round tourney time. We place 2nd ",1 star,0.7197433114051819,"atekinzz, where in the world are you?? @MyConnecticut Restaurant called WoodNTap has competitive eating tourney round tourney time. We place 2nd @januarycrimson Sorry, babe!!  My fam annoys me too. Thankfully, they're asleep right now. Muahaha. *evil laugh*"
491,n,0.5581181049346924,1467933685,@RumLover No! u supposed to be my date ,1 star,0.5569251179695129,@RumLover No! u supposed to be my date @_shabbychica Thanks! ,1 star,0.7340935468673706,"@RumLover No! u supposed to be my date @_shabbychica Thanks! My bathtub drain is fired: it haz 1 job 2 do, &amp; it iz FAIL. I got all Drano on its ass, &amp; iz STILL NOT DRAINING. I wanna shower, dangit!! "
492,p,0.3114953935146332,1467934004,"pears &amp; Brie, bottle of Cabernet, and &quot;Win a Date With Tad Hamilton&quot;... oh gawwd my life flashed forward to when I'm 40 with my 75 cats ",1 star,0.27432912588119507,"pears &amp; Brie, bottle of Cabernet, and &quot;Win a Date With Tad Hamilton&quot;... oh gawwd my life flashed forward to when I'm 40 with my 75 cats just did the evil deed ",1 star,0.41280245780944824,"pears &amp; Brie, bottle of Cabernet, and &quot;Win a Date With Tad Hamilton&quot;... oh gawwd my life flashed forward to when I'm 40 with my 75 cats just did the evil deed Crap. I need more dresses too. "
493,n,0.8087274432182312,1467934184,Crap. I need more dresses too. ,1 star,0.9032245874404907,Crap. I need more dresses too. Love is the reason. Spread the word. ,1 star,0.9103020429611206,Crap. I need more dresses too. Love is the reason. Spread the word. @OfficialRandL when is the announcement? i stayed up late last night 
494,n,0.8713284134864807,1467934481,@kaeeeep yeah! i know! it was horrible!!!! ugh. saddening. ,1 star,0.7887621521949768,@kaeeeep yeah! i know! it was horrible!!!! ugh. saddening. @salancaster  hope your ok.,1 star,0.8294808864593506,@kaeeeep yeah! i know! it was horrible!!!! ugh. saddening. @salancaster  hope your ok.@jpfurry poor john  this is what happens when you play with fruit and a microwave! Seriously though HAVE you seen a doctor?? Xxx
495,n,0.699346661567688,1467934606,@Brodhe geez ur no fun are you ,1 star,0.5236524939537048,"@Brodhe geez ur no fun are you @Appomattox_News Thank you! However, I hate to be on the same list that includes 2 convicts.  ",2 stars,0.43978407979011536,"@Brodhe geez ur no fun are you @Appomattox_News Thank you! However, I hate to be on the same list that includes 2 convicts.  Keeping my fingers crossed for my buddy    He is not feeling well."
496,p,0.5212454795837402,1467935121,I wanna be in a punk rock band again ,5 stars,0.41460153460502625,I wanna be in a punk rock band again is gonna get a new ipod tomorrow ,1 star,0.43500325083732605,I wanna be in a punk rock band again is gonna get a new ipod tomorrow Waiting at the airport for my ride while I get harassed by 2 men trying to sell me ugly hats.. Why me?!  I just want to sleep..
497,n,0.24616864323616028,1467935189,@jyesmith That's a lot of angst for a Tuesday afternoon ,1 star,0.2200259417295456,@jyesmith That's a lot of angst for a Tuesday afternoon goodmornin ,1 star,0.336412250995636,@jyesmith That's a lot of angst for a Tuesday afternoon goodmornin im sad now  Miss.Lilly
498,p,0.3503313958644867,1467935271,I'm very glad Britney isn't crazy anymore! That was one hell of a show! Now I'm sad that it's over.  Next up...AP at Cook County!,1 star,0.3320004642009735,I'm very glad Britney isn't crazy anymore! That was one hell of a show! Now I'm sad that it's over.  Next up...AP at Cook County!e testando o twittermail.. ,1 star,0.6349984407424927,"I'm very glad Britney isn't crazy anymore! That was one hell of a show! Now I'm sad that it's over.  Next up...AP at Cook County!e testando o twittermail.. @goodlaura What about Reese dying on #TTSC? And season finale next week.  #24 boring, Madame President is a crazy woman."
499,n,0.8852411508560181,1467935345,has a huuuge headache! omg I feel like crap! ,1 star,0.9095268249511719,has a huuuge headache! omg I feel like crap! @exmoorjane yuck! that food put me right off my tea and biscuits ,1 star,0.938835620880127,has a huuuge headache! omg I feel like crap! @exmoorjane yuck! that food put me right off my tea and biscuits Thanks every1 4 all the #FF love!!! I have a lot 2do 2day but I promise I will return it!!! 
500,n,0.5116532444953918,1467936498,@Anistorm Sorry ,1 star,0.5819138288497925,@Anistorm Sorry @SupaMagg that happened to me saturday night. along with my glittery green lighter! ,1 star,0.6144716143608093,@Anistorm Sorry @SupaMagg that happened to me saturday night. along with my glittery green lighter! @hyperbets i hope this doesn't last too long.  i feel miserable!
501,n,0.45808443427085876,1467936541,@cleders sorry...i was rooting for them too... ,1 star,0.5127646327018738,@cleders sorry...i was rooting for them too... Follow me to the doctors office ,1 star,0.7306980490684509,"@cleders sorry...i was rooting for them too... Follow me to the doctors office Late night snack, glass of OJ b/c I'm &quot;down with the sickness&quot;, then back to sleep...ugh I hate getting sick... "
502,p,0.6749959588050842,1467936901,"Man, that took forever. ",5 stars,0.6642957925796509,"Man, that took forever. watching tv with my parents ",5 stars,0.5261673331260681,"Man, that took forever. watching tv with my parents Just registered as a Twitter "
503,p,0.2461971938610077,1467937038,@shandasaurus  I see.,5 stars,0.2960178852081299,"@shandasaurus  I see.Heading to Altrincham, again! Out of hours install ",1 star,0.43767017126083374,"@shandasaurus  I see.Heading to Altrincham, again! Out of hours install sooo sick of the snow  ughh"
504,n,0.32422205805778503,1467937128,I am listing more items on ebay to sell!  Takes forever..meanwhile Coleman is watching The Hills season premier without me.. ,1 star,0.5073460936546326,I am listing more items on ebay to sell!  Takes forever..meanwhile Coleman is watching The Hills season premier without me.. @Poohpot lmao im sorry poohpot i ate it all! ,1 star,0.5155805349349976,I am listing more items on ebay to sell!  Takes forever..meanwhile Coleman is watching The Hills season premier without me.. @Poohpot lmao im sorry poohpot i ate it all! @jonesette hahaha i think we all have to be sarcastic to some extend; basics of comedy - and what a pathetic day without laughter 
505,p,0.720125675201416,1467937189,"Just got my presentation done, 23 slides done...  I'm crying for this week will be the hardest of all weeks.",5 stars,0.6439820528030396,"Just got my presentation done, 23 slides done...  I'm crying for this week will be the hardest of all weeks.I need a hug ",5 stars,0.5281486511230469,"Just got my presentation done, 23 slides done...  I'm crying for this week will be the hardest of all weeks.I need a hug @djsfs Have a safe one... GOD BLESS!!! XOXO "
506,n,0.3564678430557251,2044289668,"@AuthenticStyle The problem with tumbleweeds is that they never sit and chat a spellâ€”they're always moving on. Like some people, sadly. ",1 star,0.379818856716156,"@AuthenticStyle The problem with tumbleweeds is that they never sit and chat a spellâ€”they're always moving on. Like some people, sadly. @pvponline the price you pay for all that computing power and productivity in one package.  i baby my macbook pro disproportionately too. ",1 star,0.4370866119861603,"@AuthenticStyle The problem with tumbleweeds is that they never sit and chat a spellâ€”they're always moving on. Like some people, sadly. @pvponline the price you pay for all that computing power and productivity in one package.  i baby my macbook pro disproportionately too. @create4fun Morning people? They see in the cold light of day what you saw as a stroke on genius in the middle of the night. "
507,p,0.28035467863082886,2044289678,@Stratos What you are seeing is how we work daily--which inevitably making us dependent on the method for *every* decision ,4 stars,0.27598580718040466,"@Stratos What you are seeing is how we work daily--which inevitably making us dependent on the method for *every* decision @mindicherry If anyone ever asks my opinion on attendees, I'll keep you in mind ",1 star,0.3606623113155365,"@Stratos What you are seeing is how we work daily--which inevitably making us dependent on the method for *every* decision @mindicherry If anyone ever asks my opinion on attendees, I'll keep you in mind @djsfs Have a safe one... GOD BLESS!!! XOXO "
508,m,0.3470863401889801,2044289693,@ABP1968 Happy to be corrected. Less happy about the result. Cheers fella ,3 stars,0.36350399255752563,@ABP1968 Happy to be corrected. Less happy about the result. Cheers fella Morning  thank God its friday... Hope everyone has a &quot;GREAT&quot; day...,3 stars,0.347459077835083,@ABP1968 Happy to be corrected. Less happy about the result. Cheers fella Morning  thank God its friday... Hope everyone has a &quot;GREAT&quot; day...@nickymason ch'yeah! Haha it's Fridayyyyyy woooohoooo! 
509,p,0.6400644779205322,2044289764,reached home! nice chilling w the girls  meet up soons again! ,5 stars,0.6063188314437866,reached home! nice chilling w the girls  meet up soons again! playing game at home! my new boss didn't call me yet... ,5 stars,0.479840487241745,reached home! nice chilling w the girls  meet up soons again! playing game at home! my new boss didn't call me yet... @msdrama hey missed ya at the meeting  sup mama
510,n,0.6477499604225159,2044289807,5 days till I leave for Download!! ,1 star,0.7369996905326843,5 days till I leave for Download!! Oh and I'm out of town right now! ,1 star,0.7972459197044373,5 days till I leave for Download!! Oh and I'm out of town right now! @Henkuyinepu it's overrated 
511,n,0.3555874824523926,2044289819,"@NeenDhie Yeh i think that 2! ive slept 4 abt 3 hrs earlier 2day n just had a shower, feel a little better now  wht u up 2 2nite hun? xx",2 stars,0.3212253153324127,"@NeenDhie Yeh i think that 2! ive slept 4 abt 3 hrs earlier 2day n just had a shower, feel a little better now  wht u up 2 2nite hun? xxBack from the library. Logan was a very good boy and caused his mommy no stress at all ",2 stars,0.3618309795856476,"@NeenDhie Yeh i think that 2! ive slept 4 abt 3 hrs earlier 2day n just had a shower, feel a little better now  wht u up 2 2nite hun? xxBack from the library. Logan was a very good boy and caused his mommy no stress at all is tireddddddd. want to sleep but i have an assignment to finish and an exam tomorrow to study for "
512,p,0.5739786028862,2044289838,@amlibertad @japmap2009  I'll take the kids this weekend to Voodoo donuts  in honor of you both ,5 stars,0.5072798728942871,@amlibertad @japmap2009  I'll take the kids this weekend to Voodoo donuts  in honor of you both @lazycoder Ahh come on! I had FirstTweet ,5 stars,0.44859567284584045,@amlibertad @japmap2009  I'll take the kids this weekend to Voodoo donuts  in honor of you both @lazycoder Ahh come on! I had FirstTweet @corrosivecandy Ive forgotten how to snoo-snoo  I wonder if snoo-snoo and I will ever meet again...
513,p,0.8142495155334473,2044289839,6 years and counting today!  time really DOES fly when you're having fun.  yabyu! @cates,5 stars,0.8685808777809143,6 years and counting today!  time really DOES fly when you're having fun.  yabyu! @catesOnly i could manage to get my hair caught on a tree going into a mcdonalds  haha i love me!,5 stars,0.5077111124992371,"6 years and counting today!  time really DOES fly when you're having fun.  yabyu! @catesOnly i could manage to get my hair caught on a tree going into a mcdonalds  haha i love me!@Marge_Inovera I tried tweetdeck once and I hated it with a passion. Or it hated me, I'm not sure... "
514,p,0.336394339799881,2044289855,@lisamariemary Like the background ,5 stars,0.40906164050102234,@lisamariemary Like the background @cam001 Courage ,5 stars,0.31669896841049194,@lisamariemary Like the background @cam001 Courage yessss @Jonasbrothers have done a video for Fly With Me 
515,m,0.21760293841362,2044289882,@gnglim about to pick mom upp  YAY,5 stars,0.31872349977493286,@gnglim about to pick mom upp  YAYyou're welcomed @MrFloydNL @Lunabee_art @derivativeofu @smallandround #FollowFriday #FF ,1 star,0.37495657801628113,"@gnglim about to pick mom upp  YAYyou're welcomed @MrFloydNL @Lunabee_art @derivativeofu @smallandround #FollowFriday #FF @austinhill I wish I was!  Sold out   If you have some time let me know, I would love to hear more about what you are up to!"
516,p,0.465585321187973,2044289904,@motif83 Go for it! ,5 stars,0.48126447200775146,@motif83 Go for it! @HelpYouWell morning honey ,1 star,0.5648782253265381,"@motif83 Go for it! @HelpYouWell morning honey Congrats to atlassian (http://www.atlassian.com/), finally the free beer for Java Posse payed off "
517,p,0.36666297912597656,2044289935,@xTwilighter Going out for dinner - will phone ya when I get bk about 2moro!  Have got everything sorted!,5 stars,0.8475325703620911,@xTwilighter Going out for dinner - will phone ya when I get bk about 2moro!  Have got everything sorted!I am thankful for today...for my family and friends and my life! I am just thankful! ,1 star,0.3618493676185608,"@xTwilighter Going out for dinner - will phone ya when I get bk about 2moro!  Have got everything sorted!I am thankful for today...for my family and friends and my life! I am just thankful! hey, I actually won one of my bracket pools! Too bad it wasn't the one for money "
518,n,0.3746689558029175,2044289987,@JustAmandaBlack yeah ,5 stars,0.6967407464981079,@JustAmandaBlack yeah Last night was awesome. Little Joy is heartbreaking good.  @loverlypaula and @misskaito,3 stars,0.29865124821662903,@JustAmandaBlack yeah Last night was awesome. Little Joy is heartbreaking good.  @loverlypaula and @misskaitospencer is not a good guy. 
