,original_label,score_x,twitter_id,Comments_x,MR1_label,score_y,Comments_y,MR2_label,score,Comments
741,p,0.7365620732307434,2044336970,@xoxoJL They aren't robots. They're Batman &amp; Robin! ,POS,0.9783833622932434,@xoxoJL They aren't robots. They're Batman &amp; Robin! @TexasMisty @IamSucceeding @kellydmahaffey @KCLAnderson @fitnewbie @PatBarone Thanks for the FF mention ,NEU,0.5544878244400024,@xoxoJL They aren't robots. They're Batman &amp; Robin! @TexasMisty @IamSucceeding @kellydmahaffey @KCLAnderson @fitnewbie @PatBarone Thanks for the FF mention @KevChoice I just don't get it. What in a persons mind could even have them on some ish like this???  My prayers are with her fam for real
742,m,0.9717620015144348,2044337017,@ABenton  still waiting for the BW20 AD Network so I can join...,POS,0.8519923090934753,"@ABenton  still waiting for the BW20 AD Network so I can join...@JessicaKnows Thanks for recommending it, I'm off to check it out! ",NEU,0.5677745342254639,"@ABenton  still waiting for the BW20 AD Network so I can join...@JessicaKnows Thanks for recommending it, I'm off to check it out! Awwh babs... you look so sad underneith that shop entrance of &quot;Yesterday's Musik&quot;  O-: I like the look of the new transformer movie "
743,p,0.9761776328086853,2044337043,Save the Mangos!  @StuccoHouse Thank you!!! Is that 1 or 2 large mangos or 102?  http://tinyurl.com/pjpkpa,POS,0.9901835322380066,Save the Mangos!  @StuccoHouse Thank you!!! Is that 1 or 2 large mangos or 102?  http://tinyurl.com/pjpkpa@playwildgames Sound delicious?  Hell yes! ,POS,0.9581753611564636,Save the Mangos!  @StuccoHouse Thank you!!! Is that 1 or 2 large mangos or 102?  http://tinyurl.com/pjpkpa@playwildgames Sound delicious?  Hell yes! Awwh babs... you look so sad underneith that shop entrance of &quot;Yesterday's Musik&quot;  O-: I like the look of the new transformer movie 
744,p,0.9725492596626282,2044337055,@k_love032705 I believe it's a way to send a shout out to your friendly followers. Seems to get you more followers somehow. And it's fun ,POS,0.9898272752761841,@k_love032705 I believe it's a way to send a shout out to your friendly followers. Seems to get you more followers somehow. And it's fun Love is the reason. Spread the word. ,POS,0.8645827174186707,@k_love032705 I believe it's a way to send a shout out to your friendly followers. Seems to get you more followers somehow. And it's fun Love is the reason. Spread the word. Is terrified she accidentally deleted a reference in her management assignment and hopes she doesnt get in trouble when she gets back 
745,p,0.9850724339485168,2044337056,@ifpetscouldtype I suspect that walks with you guys are as much fun as tweeting with U  Enjoy!,POS,0.991043210029602,@ifpetscouldtype I suspect that walks with you guys are as much fun as tweeting with U  Enjoy!@bevmost - Monday ... Apple WWDC ... San Fran ... new stuff coming soon ,NEG,0.6328572034835815,"@ifpetscouldtype I suspect that walks with you guys are as much fun as tweeting with U  Enjoy!@bevmost - Monday ... Apple WWDC ... San Fran ... new stuff coming soon Sad, sad, sad. I don't know why but I hate this feeling  I wanna sleep and I still can't!"
746,p,0.8280706405639648,2044337086,@HelpYouWell morning honey ,POS,0.9572431445121765,"@HelpYouWell morning honey The weather is rubish, but the rose is great with some jalapeno humous  Roll on the iphone get me started vids",POS,0.5432056188583374,"@HelpYouWell morning honey The weather is rubish, but the rose is great with some jalapeno humous  Roll on the iphone get me started vidsbad day at the betfair office "
747,m,0.9686298966407776,2044337122,@anahiyeh  You've seen my picture and know I'm blonde right??  ,POS,0.9870647192001343,@anahiyeh  You've seen my picture and know I'm blonde right??  Best friend randomly woke me up today! Partaayyy!!! ,POS,0.9739159941673279,@anahiyeh  You've seen my picture and know I'm blonde right??  Best friend randomly woke me up today! Partaayyy!!! @onemoreproject that is lame 
748,p,0.9909518957138062,2044337181,is very happy because there are no tests anymore ,POS,0.9927145838737488,is very happy because there are no tests anymore Almost done with work and will be on her way to NY in no time! Can't wait ,POS,0.9618069529533386,is very happy because there are no tests anymore Almost done with work and will be on her way to NY in no time! Can't wait @Starrbby too bad I won't be around I lost my job and can't even pay my phone bill lmao aw shucks 
749,p,0.9749802350997925,2044337184,@TexasMisty @IamSucceeding @kellydmahaffey @KCLAnderson @fitnewbie @PatBarone Thanks for the FF mention ,POS,0.9750315546989441,@TexasMisty @IamSucceeding @kellydmahaffey @KCLAnderson @fitnewbie @PatBarone Thanks for the FF mention VOTE for my boss @hao_country for Mr. Twitter Philippines  http://bit.ly/iH0pv,POS,0.9573882222175598,@TexasMisty @IamSucceeding @kellydmahaffey @KCLAnderson @fitnewbie @PatBarone Thanks for the FF mention VOTE for my boss @hao_country for Mr. Twitter Philippines  http://bit.ly/iH0pv@MissXu sorry! bed time came here (GMT+1)   http://is.gd/fNge
750,p,0.9628419280052185,2044337215,@TerryBorder the infrequency makes it all the more exciting... ,POS,0.9902021884918213,@TerryBorder the infrequency makes it all the more exciting... @geeneeyes the good part is .... it only gets better ,NEG,0.3812805712223053,@TerryBorder the infrequency makes it all the more exciting... @geeneeyes the good part is .... it only gets better ok I'm sick and spent an hour sitting in the shower cause I was too sick to stand and held back the puke like a champ. BED now 
751,m,0.5561965107917786,2044337358,"@Stev02008 he's still only about 6 months old, so puppy hyper. Should be fun, but have a feeling I'm going to be happy to hand him back ",POS,0.9907964468002319,"@Stev02008 he's still only about 6 months old, so puppy hyper. Should be fun, but have a feeling I'm going to be happy to hand him back @mememolly Yay! I got it yesterday, so much fun. ",POS,0.9626734852790833,"@Stev02008 he's still only about 6 months old, so puppy hyper. Should be fun, but have a feeling I'm going to be happy to hand him back @mememolly Yay! I got it yesterday, so much fun. Damn i am so late at filling this appraisal form, people have almost sent it .. i was so occupied in work "
752,p,0.9915881752967834,2044337362,Morning  thank God its friday... Hope everyone has a &quot;GREAT&quot; day...,POS,0.9927272796630859,"Morning  thank God its friday... Hope everyone has a &quot;GREAT&quot; day...@miazevedo Thanks, bb!  I better. YOU CAN DO IT TOO. I BELIEVE IN YOUUU.",NEG,0.6649554371833801,"Morning  thank God its friday... Hope everyone has a &quot;GREAT&quot; day...@miazevedo Thanks, bb!  I better. YOU CAN DO IT TOO. I BELIEVE IN YOUUU.Wow. The most depressing thing in the world is losing a video that you've created in a matter of seconds.  #FML"
753,p,0.699426531791687,2044337410,"deixei o tom com medo, depois do I know you're there. ahahah :x te amo Tom! ",POS,0.9811153411865234,"deixei o tom com medo, depois do I know you're there. ahahah :x te amo Tom! Has got that friday feelin  cant wait to get home to that cold bottle of wine and some army wives Xx",NEG,0.6376418471336365,"deixei o tom com medo, depois do I know you're there. ahahah :x te amo Tom! Has got that friday feelin  cant wait to get home to that cold bottle of wine and some army wives XxRIP Sandra....its so sad    how can someone do something like that??"
754,m,0.8421515226364136,2044337413,"@Contra_tss Yeah, but they building a train &amp; there's always some thangs wandering around that airport &amp; the hotel is inside the airport ",NEU,0.9227282404899597,"@Contra_tss Yeah, but they building a train &amp; there's always some thangs wandering around that airport &amp; the hotel is inside the airport @Redsmeanderings lol thanks ",NEU,0.6811348795890808,"@Contra_tss Yeah, but they building a train &amp; there's always some thangs wandering around that airport &amp; the hotel is inside the airport @Redsmeanderings lol thanks @charlietm I know right. I dunno what is going on with twitter. "
755,p,0.9864196181297302,2044337453,@chelseamcflyx3 oh well i love them both ,POS,0.9929267764091492,"@chelseamcflyx3 oh well i love them both @matildajones no doubt! He really is!  ' No, i haven't.. But man, I'm dying to see them. it is THE DREAM! &lt;3",NEG,0.6359704732894897,"@chelseamcflyx3 oh well i love them both @matildajones no doubt! He really is!  ' No, i haven't.. But man, I'm dying to see them. it is THE DREAM! &lt;3amazon s3 plugin not worked in my website . it need PHP 5 . but my hosting provider has only PHP 4.4  . very sad."
756,p,0.6368716359138489,2044337501,@Redsmeanderings lol thanks ,POS,0.7815217971801758,"@Redsmeanderings lol thanks @PortiaDaCosta okay I'm here now, thanks Portia ",NEU,0.5347408056259155,"@Redsmeanderings lol thanks @PortiaDaCosta okay I'm here now, thanks Portia spencer is not a good guy. "
757,p,0.9920778870582581,2044343989,@LanceGross omg how cute are yall?? loves it ,POS,0.9907082319259644,@LanceGross omg how cute are yall?? loves it @iamjazzyfizzle I wish I got to watch it with you!! I miss you and @iamlilnicki  how was the premiere?!,POS,0.9815728664398193,@LanceGross omg how cute are yall?? loves it @iamjazzyfizzle I wish I got to watch it with you!! I miss you and @iamlilnicki  how was the premiere?!Meh... Almost Lover is the exception... this track gets me depressed every time. 
758,m,0.8624698519706726,2044343996,I need a nap. Tweet ya later peeps. ,POS,0.9141581654548645,I need a nap. Tweet ya later peeps. here's mii follow friday  follow @LiLg3m1n1 @FLyGUy2800 @ashleyjanae @bjayjones @Yung_Cordi &amp;&amp;&amp; @gegebaybee &lt;- the best out of all yee!,NEG,0.8086584806442261,I need a nap. Tweet ya later peeps. here's mii follow friday  follow @LiLg3m1n1 @FLyGUy2800 @ashleyjanae @bjayjones @Yung_Cordi &amp;&amp;&amp; @gegebaybee &lt;- the best out of all yee!@TheLeagueSF Not Fun &amp; Furious? The new mantra for the Bay 2 Breakers? It was getting 2 rambunctious;the city overreacted &amp; clamped down 
759,m,0.9212409257888794,2044344021,@calire Yes but you think really ... The 15th JUne I'm in london ,POS,0.9786883592605591,@calire Yes but you think really ... The 15th JUne I'm in london @jessgonacha Congrats! Well deserved ,POS,0.9679315686225891,@calire Yes but you think really ... The 15th JUne I'm in london @jessgonacha Congrats! Well deserved @Henkuyinepu it's overrated 
760,p,0.9928747415542603,2044344096,whoa this day is going fast!! getting good things done...@FestivalGR is outside and calling my name! can't wait to go down there. ,POS,0.9928773045539856,whoa this day is going fast!! getting good things done...@FestivalGR is outside and calling my name! can't wait to go down there. Has got that friday feelin  cant wait to get home to that cold bottle of wine and some army wives Xx,POS,0.9922520518302917,whoa this day is going fast!! getting good things done...@FestivalGR is outside and calling my name! can't wait to go down there. Has got that friday feelin  cant wait to get home to that cold bottle of wine and some army wives Xxday 2. a lot harder than day 1. let's see how day 3 goes tomorrow. 
761,m,0.9197735786437988,2044344142,Heading to Atl for the weekend ,POS,0.9848840236663818,Heading to Atl for the weekend @scarletkristi Love you too! ,NEG,0.8317296504974365,"Heading to Atl for the weekend @scarletkristi Love you too! @smarrison i would've been the first, but i didn't have a gun.    not really though, zac snyder's just a doucheclown."
762,p,0.9684297442436218,2044344163,"gonna put the twins down for their nap. Then head to BG when they wake up to shop for some pageant dresses! Fun, Fun! ",POS,0.9843950271606445,"gonna put the twins down for their nap. Then head to BG when they wake up to shop for some pageant dresses! Fun, Fun! sonny with a chance is so funny! ",POS,0.9030336141586304,"gonna put the twins down for their nap. Then head to BG when they wake up to shop for some pageant dresses! Fun, Fun! sonny with a chance is so funny! Downloading NIN's new album &quot;the slip&quot; - when the hell did this come out? I'm so behind the times these days "
763,m,0.943737268447876,2044344176,. All the time. Seriously.  ,NEU,0.5274310111999512,. All the time. Seriously.  @Lindascrush I think we should offer a buffet breakfast on Sundays mornings with a jazz ensemble too.   I got planz i do.. big planz...,NEU,0.6657290458679199,. All the time. Seriously.  @Lindascrush I think we should offer a buffet breakfast on Sundays mornings with a jazz ensemble too.   I got planz i do.. big planz...missed Brent at praise band.  No fun to not have your lead guitarist. &lt;pout&gt;
764,p,0.9627910852432251,2044344187,@SPGInsider welcome! starwood (particularly w and aloft) is my hotel brand of choice. ,POS,0.9811197519302368,"@SPGInsider welcome! starwood (particularly w and aloft) is my hotel brand of choice. @tommcfly carrie posted that early, they make me laugh because they look like posh boys from all boys school, good job though! ",POS,0.4144259989261627,"@SPGInsider welcome! starwood (particularly w and aloft) is my hotel brand of choice. @tommcfly carrie posted that early, they make me laugh because they look like posh boys from all boys school, good job though! @Gailporter You're just getting carried away now! All this fluff has gone to your head! "
765,p,0.9839473962783813,2044344208,@Leeluvzyou hey DUB! good afternoon.  Thank god its friday! I just bought my mom 3rd row tix 2 an oldie show in sept. ,POS,0.9868580102920532,"@Leeluvzyou hey DUB! good afternoon.  Thank god its friday! I just bought my mom 3rd row tix 2 an oldie show in sept. Work is finished, @b13thy 's spider has been liberated, cash has been banked and proper chip shop chips will be consumed shortly. TGIF. ",NEG,0.7712775468826294,"@Leeluvzyou hey DUB! good afternoon.  Thank god its friday! I just bought my mom 3rd row tix 2 an oldie show in sept. Work is finished, @b13thy 's spider has been liberated, cash has been banked and proper chip shop chips will be consumed shortly. TGIF. @CarVin1 lol they are some emotional ass men!! Omg all this late night eating.. Both of us are broke "
766,p,0.992447018623352,2044344261,@djsfs Have a safe one... GOD BLESS!!! XOXO ,POS,0.9927276372909546,@djsfs Have a safe one... GOD BLESS!!! XOXO thank you friday for being here week after week to kickstart my weekend.  what would i do without u?  TGIF tweeples!!  ,POS,0.9926806092262268,@djsfs Have a safe one... GOD BLESS!!! XOXO thank you friday for being here week after week to kickstart my weekend.  what would i do without u?  TGIF tweeples!!  @duchess_rebecca Man... intervention is soo sad 
767,p,0.9579235911369324,2044344331,ate mac'n'chz out of my ARABIA bowls and juice from IITTALA last night- I love my Finnish dishes ,POS,0.9915036559104919,ate mac'n'chz out of my ARABIA bowls and juice from IITTALA last night- I love my Finnish dishes @jessgonacha Congrats! Well deserved ,POS,0.9663828611373901,ate mac'n'chz out of my ARABIA bowls and juice from IITTALA last night- I love my Finnish dishes @jessgonacha Congrats! Well deserved @brian_armstrong What a pity YouTube is currently blocked in China.  I can't see the vids. 
768,p,0.7071982026100159,2044344408,@cam001 Courage ,POS,0.9571239948272705,@cam001 Courage @amber_benson  my hubby (for some reason) thinks it's more important he has a good spot for red carpet for the Trek Movie Premiere. Sod!,NEU,0.5888611674308777,@cam001 Courage @amber_benson  my hubby (for some reason) thinks it's more important he has a good spot for red carpet for the Trek Movie Premiere. Sod!@marykatherine_q i know! I heard it this afternoon and wondered the same thing. Moscow is so behind the times 
769,p,0.9840271472930908,2044344513,@iamtrefusis Most Welcome ,POS,0.9842252731323242,@iamtrefusis Most Welcome Need a hug ,NEU,0.5055860877037048,@iamtrefusis Most Welcome Need a hug @EazyDoesIt87 NEGATIVE.. you lost my vote of confidence 
770,m,0.9784027338027954,2044344519,is going now. lav. ,POS,0.7934598922729492,is going now. lav. @azelmer yes please.. I get to go. Boss lady said so!! ,POS,0.5427352786064148,"is going now. lav. @azelmer yes please.. I get to go. Boss lady said so!! I'm SO behind in video games, and everything for that matter. I'm yesterday's news "
771,p,0.9911441802978516,2044344631,"@NataliaBonbon U2....  Play some good songs....can't wait for the summer, we have very cold weather here...",POS,0.9896440505981445,"@NataliaBonbon U2....  Play some good songs....can't wait for the summer, we have very cold weather here...@QCF2 I miss chatting to u guys.. i shud get on the chat mre often...i will do once my essays and stuff are over.... chat 2 u guys soon ",POS,0.8577651977539062,"@NataliaBonbon U2....  Play some good songs....can't wait for the summer, we have very cold weather here...@QCF2 I miss chatting to u guys.. i shud get on the chat mre often...i will do once my essays and stuff are over.... chat 2 u guys soon another day of work and boredom...wait... isn't that the same thing?? "
772,p,0.9844323396682739,2044344649,"@KatMcGraw HAHAHA, aww thx for the kitty hug ",POS,0.9910200238227844,"@KatMcGraw HAHAHA, aww thx for the kitty hug @waihang good, we have a new toy~ ",POS,0.569576621055603,"@KatMcGraw HAHAHA, aww thx for the kitty hug @waihang good, we have a new toy~ @Gailporter You're just getting carried away now! All this fluff has gone to your head! "
773,p,0.9898658394813538,2044344706,Up oh so early! Off to the river to have fun in the sun ,POS,0.9912623167037964,Up oh so early! Off to the river to have fun in the sun thanks nora~good luck for ur paper tomorrow ,POS,0.9886394739151001,Up oh so early! Off to the river to have fun in the sun thanks nora~good luck for ur paper tomorrow laying in bed with no voice.. 
774,p,0.9846447110176086,2044344730,@mattChevy Get outta here! That's awesome! Though I think we may need to put that to the test one of these days ,POS,0.9920935034751892,@mattChevy Get outta here! That's awesome! Though I think we may need to put that to the test one of these days @chelserlynn haha its so cooooold in the d! and no  but you should still go to the show. they do some incredible stuff,POS,0.9913182258605957,@mattChevy Get outta here! That's awesome! Though I think we may need to put that to the test one of these days @chelserlynn haha its so cooooold in the d! and no  but you should still go to the show. they do some incredible stuffmy nokia 1110 died..  
775,p,0.9896937012672424,2044344757,start my new job on monday!!! can't wait  going to enjoy my last saturday of freedom though,POS,0.9923598170280457,start my new job on monday!!! can't wait  going to enjoy my last saturday of freedom though@babygirlparis http://twitpic.com/6nih9 - I was so there! I wish I could have officially met you in person and got a pic!! ,POS,0.9919005632400513,start my new job on monday!!! can't wait  going to enjoy my last saturday of freedom though@babygirlparis http://twitpic.com/6nih9 - I was so there! I wish I could have officially met you in person and got a pic!! wednesday my b-day! don't know what 2 do!! 
776,p,0.784837007522583,2044344780,Relaxing ,POS,0.9921769499778748,Relaxing getting called a FF fox...a sign of bright and shiny things to come today?  Sweet!  Thanks @bobwarren for the #FF mention  ,POS,0.9762610197067261,Relaxing getting called a FF fox...a sign of bright and shiny things to come today?  Sweet!  Thanks @bobwarren for the #FF mention  @huntermoore I don't want him to ever punch me.  
777,p,0.9906826019287109,2044344793,I love my texttone. Damned if i do ya. ,POS,0.9916864037513733,I love my texttone. Damned if i do ya. Good morning twitterbugs!  it's friday! ,POS,0.730571985244751,I love my texttone. Damned if i do ya. Good morning twitterbugs!  it's friday! @allyheman but.. but.. but.. I'm not a big fan on camilla belle 
778,n,0.9241631627082825,2044344823,@jonesette hahaha i think we all have to be sarcastic to some extend; basics of comedy - and what a pathetic day without laughter ,POS,0.8489146828651428,@jonesette hahaha i think we all have to be sarcastic to some extend; basics of comedy - and what a pathetic day without laughter start my new job on monday!!! can't wait  going to enjoy my last saturday of freedom though,NEG,0.4497544765472412,"@jonesette hahaha i think we all have to be sarcastic to some extend; basics of comedy - and what a pathetic day without laughter start my new job on monday!!! can't wait  going to enjoy my last saturday of freedom though@nick_carter Aww Nick!! I like your hair longer, why did you cut it off?  Break. My. Heart."
779,m,0.5694775581359863,2044344839,"@jenniferhaymore Hey Jennifer, I bought your book yesterday ",POS,0.9928520321846008,"@jenniferhaymore Hey Jennifer, I bought your book yesterday whoa this day is going fast!! getting good things done...@FestivalGR is outside and calling my name! can't wait to go down there. ",POS,0.9918036460876465,"@jenniferhaymore Hey Jennifer, I bought your book yesterday whoa this day is going fast!! getting good things done...@FestivalGR is outside and calling my name! can't wait to go down there. @kyliecross An OB/GYN once told me that pregnancy lasts one month too long. After four, I can say I definitely agree! Yes, in Boston. "
780,m,0.9082868099212646,2044344849,@yellowscone what kind do you like? I can only suggest melodic and symphonic metal and female fronted stuff ,POS,0.9833883047103882,@yellowscone what kind do you like? I can only suggest melodic and symphonic metal and female fronted stuff i Love my atekinzz so much. &amp;&amp; i soo miss her.. ,POS,0.8896670937538147,@yellowscone what kind do you like? I can only suggest melodic and symphonic metal and female fronted stuff i Love my atekinzz so much. &amp;&amp; i soo miss her.. I wish I was better at writing. It's taking me so long to write this paper. 
781,m,0.650122880935669,2044344872,@TickleMeJoey please shout out to @MarianneSays plzzz ,POS,0.5882672667503357,@TickleMeJoey please shout out to @MarianneSays plzzz @salancaster  hope your ok.,NEU,0.5054556131362915,@TickleMeJoey please shout out to @MarianneSays plzzz @salancaster  hope your ok.the flirting in the office is making me queezy..sick bucket pronto. and shes playin wid her hairrr...classic..wanna get a sly pic 
782,p,0.9909996390342712,2044344953,is looking forward to the weekend ahead ,POS,0.9916895627975464,is looking forward to the weekend ahead sonny with a chance is so funny! ,POS,0.9743431210517883,is looking forward to the weekend ahead sonny with a chance is so funny! Meh... Almost Lover is the exception... this track gets me depressed every time. 
783,p,0.704753577709198,2044345001,@DENISE_RICHARDS You are SO busy with interviews!  Hang in there ,POS,0.941422164440155,"@DENISE_RICHARDS You are SO busy with interviews!  Hang in there Done with first class, I secretely love college lol  have a presentation for my last class, then I'm done for the week.",NEG,0.5586910247802734,"@DENISE_RICHARDS You are SO busy with interviews!  Hang in there Done with first class, I secretely love college lol  have a presentation for my last class, then I'm done for the week.So many channels.... yet so so boring... lazy day again  may have to find a hobby"
784,m,0.8634541034698486,2044345026,@jemostrom I play the Mermaid ,POS,0.9783151149749756,@jemostrom I play the Mermaid @hochmann LOL!  I need to laugh...thank you.,NEU,0.6987626552581787,@jemostrom I play the Mermaid @hochmann LOL!  I need to laugh...thank you.I am listing more items on ebay to sell!  Takes forever..meanwhile Coleman is watching The Hills season premier without me.. 
785,m,0.9674487709999084,2044345068,There needs to be an 'N' in 'Pattison Park'  lol,POS,0.9070156812667847,There needs to be an 'N' in 'Pattison Park'  lol@hochmann LOL!  I need to laugh...thank you.,NEG,0.6488215327262878,There needs to be an 'N' in 'Pattison Park'  lol@hochmann LOL!  I need to laugh...thank you.another day of work and boredom...wait... isn't that the same thing?? 
786,m,0.9533474445343018,2044345080,is a working man now. ,POS,0.979630708694458,is a working man now. @summersgrace24 Thanks! ,POS,0.9719574451446533,is a working man now. @summersgrace24 Thanks! This trolley has up packed in like sardines! Padre game and they REMOVE a car?! Good call MTS 
787,p,0.9547374844551086,2044345166,@BFAS I finally ordered two bracelets. Yay! ,POS,0.9807339906692505,@BFAS I finally ordered two bracelets. Yay! Relaxing ,POS,0.965556263923645,@BFAS I finally ordered two bracelets. Yay! Relaxing @PNemiroff Same here... watched them many times... and they've made paranoid of even crossing the street! 
788,p,0.9185352921485901,2044345207,@newmoonmovie HAHAH! Serves them right for being in her face! I bet Ashley got a good laugh outta that one ,POS,0.9764696955680847,@newmoonmovie HAHAH! Serves them right for being in her face! I bet Ashley got a good laugh outta that one Good morning twitterbugs!  it's friday! ,POS,0.43836715817451477,@newmoonmovie HAHAH! Serves them right for being in her face! I bet Ashley got a good laugh outta that one Good morning twitterbugs!  it's friday! Wish I had all the XBLM downloads all on the gamertag 'Hitokyri'. This 5 gamertag thing is nonsense... and I'm tired of it 
